{"run":74,"commit":"369df79","metric":2.971803728,"metrics":{"elapsed_seconds":8.284042,"timed_out":0,"evaluated_tokens":200000},"status":"discard","description":"Run 074 separate recent mix_weight_fixed=0.25 (opposite bracket)","timestamp":1777581522127,"segment":0,"confidence":11.005192968732763,"asi":{"hypothesis":"If recent_mix_weight_fixed=0.75 improved by favoring fixed-C44, then 0.25 (favoring adaptive-C) should worsen and bracket the optimum direction.","source":"run 073 recent_mix_weight_fixed=0.75 improvement, AGENTS/COMPETITION_RULES sequential N=200000, lectures 5/13/15 on mismatch, synchronized past-history evidence, and robust mixtures","changed_files":["autoresearch.md","explanations/run_074.md","submissions/ngram_interpolated_n5_laplace03_recent_n3_recenta001_w16_warm30000_mix025_wall262144.py"],"learned":"recent_mix_weight_fixed=0.25 scored 2.9718037280, worse than 0.75 (2.9717829205) and also slightly worse than shared 0.5 (2.9717926651). The dense low-order auxiliary model clearly prefers fixed-C44 calibration; adaptive-C diversity weighting is unnecessary for dense n=3 contexts.","rollback_reason":"Primary metric worsened by about 0.000021 bits/symbol versus current best recent_mix_weight_fixed=0.75.","next_action_hint":"This brackets the optimum direction. Next explore a more aggressive fixed-C preference such as 0.85 or 0.9 for the auxiliary model, or a different qualitative axis like adjusting main model C values separately."}}
{"type":"hook","stage":"after","exit_code":0,"duration_ms":46,"stdout_bytes":216,"timed_out":false}
{"type":"hook","stage":"before","exit_code":0,"duration_ms":31,"stdout_bytes":7938,"timed_out":false}
{"run":75,"commit":"020fa14","metric":2.9717777131,"metrics":{"elapsed_seconds":8.169034,"timed_out":0,"evaluated_tokens":200000},"status":"keep","description":"Run 075 separate recent mix_weight_fixed=0.9 (near pure fixed-C)","timestamp":1777581627805,"segment":0,"confidence":11.048339890037845,"asi":{"hypothesis":"If the auxiliary model benefits from still more fixed-C44 mass, 0.9 will improve over 0.75; if 0.75 is near optimal, 0.9 will worsen slightly.","source":"runs 073-074 bracketed direction 0.75 > 0.5 > 0.25, AGENTS/COMPETITION_RULES sequential N=200000, lectures 15 on minimax mixture","changed_files":["autoresearch.md","explanations/run_075.md","submissions/ngram_interpolated_n5_laplace03_recent_n3_recenta001_w16_warm30000_mix09_wall262144.py"],"learned":"recent_mix_weight_fixed=0.9 improved to 2.9717777131, further confirming the dense low-order auxiliary model strongly prefers fixed-C44 calibration over adaptive-C. The auxiliary component is now nearly pure fixed-C (90% fixed, 10% adaptive hedge).","next_focus":"Try 0.95 or 1.0 as final upper bracket to see if pure fixed-C is optimal for the auxiliary, or switch to a qualitatively different axis such as tuning main model fixed_c separately from the auxiliary."}}
{"type":"hook","stage":"after","exit_code":0,"duration_ms":40,"stdout_bytes":216,"timed_out":false}
{"type":"hook","stage":"before","exit_code":0,"duration_ms":34,"stdout_bytes":8126,"timed_out":false}
{"run":76,"commit":"20648c8","metric":2.9717760846,"metrics":{"elapsed_seconds":8.132365,"timed_out":0,"evaluated_tokens":200000},"status":"keep","description":"Run 076 separate recent mix_weight_fixed=0.95","timestamp":1777581699012,"segment":0,"confidence":11.028424295449398,"asi":{"hypothesis":"If the auxiliary still benefits from reducing the remaining adaptive-C hedge, 0.95 will improve over 0.9; if the 10% hedge is needed for boundary cases, 0.95 will worsen.","source":"runs 073-075 monotone 0.75→0.9 improvement, AGENTS/COMPETITION_RULES sequential N=200000, lectures 15 on minimax mixture","changed_files":["autoresearch.md","explanations/run_076.md","submissions/ngram_interpolated_n5_laplace03_recent_n3_recenta001_w16_warm30000_mix095_wall262144.py"],"learned":"recent_mix_weight_fixed=0.95 improved to 2.9717760846, about 0.0000016 better than 0.9. Nearly pure fixed-C continues to help the dense low-order auxiliary, but gains are now extremely marginal.","next_focus":"Try 1.0 (pure fixed-C, no adaptive-C at all) as the final upper bracket. If it's same or worse, stop at 0.95; if it improves, the auxiliary model's adaptive-C component was never helping for dense n=3 contexts."}}
{"type":"hook","stage":"after","exit_code":0,"duration_ms":40,"stdout_bytes":216,"timed_out":false}
{"type":"hook","stage":"before","exit_code":0,"duration_ms":33,"stdout_bytes":8106,"timed_out":false}
{"run":77,"commit":"1f743d6","metric":2.9717745101,"metrics":{"elapsed_seconds":8.690228,"timed_out":0,"evaluated_tokens":200000},"status":"keep","description":"Run 077 pure fixed-C (1.0) for auxiliary internal mixture","timestamp":1777581786905,"segment":0,"confidence":11.157801926752798,"asi":{"hypothesis":"If any adaptive-C hedge was still marginally harmful, 1.0 will improve or tie 0.95. If the last 5% adaptive-C protects occasional edge cases, 1.0 will worsen.","source":"runs 073-076 monotone 0.75→0.95 improvement, AGENTS/COMPETITION_RULES sequential N=200000, lectures 15 on minimax mixture","changed_files":["autoresearch.md","explanations/run_077.md","submissions/ngram_interpolated_n5_laplace03_recent_n3_recenta001_w16_warm30000_mix1_wall262144.py"],"learned":"Pure fixed-C (1.0) for the auxiliary component improved to 2.9717745101, confirming adaptive-C was never needed for dense low-order all-past contexts. The auxiliary model is now pure fixed-C44.","next_focus":"Shift to main model calibration: try lower mix_weight_fixed (e.g., 0.35) for the n=5 main model, since its sparser high-order contexts may benefit from more adaptive-C hedging than the n=4 model used."}}
{"type":"hook","stage":"after","exit_code":0,"duration_ms":39,"stdout_bytes":216,"timed_out":false}
{"type":"hook","stage":"before","exit_code":0,"duration_ms":36,"stdout_bytes":8168,"timed_out":false}
{"run":78,"commit":"1f743d6","metric":2.9722542491,"metrics":{"elapsed_seconds":8.490535,"timed_out":0,"evaluated_tokens":200000},"status":"discard","description":"Run 078 main model mix_weight_fixed=0.35 (more adaptive-C)","timestamp":1777581923084,"segment":0,"confidence":11.31109408844889,"asi":{"hypothesis":"If n=5's sparse high-order contexts benefit from more adaptive-C hedging, mix_weight_fixed=0.35 will improve. If the 50/50 blend remains optimal, it will worsen.","source":"runs 073-077 auxiliary internal mixture bracketing, run 027 original 0.5 for n=4, AGENTS/COMPETITION_RULES sequential N=200000","changed_files":["autoresearch.md","explanations/run_078.md","submissions/ngram_interpolated_n5_laplace03_recent_n3_recenta001_w16_warm30000_mix1_main035_wall262144.py"],"learned":"Lowering main mix_weight_fixed to 0.35 (more adaptive-C) worsened to 2.9722542491. Despite sparser n=5 contexts, adaptive-C doesn't help the main model either — fixed-C44 calibration is adequate for both the dense auxiliary and the sparser main model.","rollback_reason":"Primary metric worsened by about 0.000480 bits/symbol versus current best mix_weight_fixed=0.5.","next_action_hint":"Try the opposite bracket: mix_weight_fixed=0.65 or 0.75 for the main model to see if it also prefers fixed-C. Or shift to a qualitatively different axis like tuning main model fixed_c value."}}
{"type":"hook","stage":"after","exit_code":0,"duration_ms":39,"stdout_bytes":216,"timed_out":false}
{"type":"hook","stage":"before","exit_code":0,"duration_ms":32,"stdout_bytes":8168,"timed_out":false}
{"run":79,"commit":"d531e11","metric":2.9714358859,"metrics":{"elapsed_seconds":8.291061,"timed_out":0,"evaluated_tokens":200000},"status":"keep","description":"Run 079 main model mix_weight_fixed=0.65 (more fixed-C)","timestamp":1777581989715,"segment":0,"confidence":11.791242466415746,"asi":{"hypothesis":"If the main model also benefits from more fixed-C (like the auxiliary), 0.65 will improve. If 0.5 is optimal, it will worsen.","source":"runs 073-077 auxiliary internal mixture fixed-C preference, run 078 adaptive-C worsened, AGENTS/COMPETITION_RULES sequential N=200000, lectures 15 on minimax mixture","changed_files":["autoresearch.md","explanations/run_079.md","submissions/ngram_interpolated_n5_laplace03_recent_n3_recenta001_w16_warm30000_mix1_main065_wall262144.py"],"learned":"Main model mix_weight_fixed=0.65 improved to 2.9714358859, a meaningful ~0.000339 improvement. Like the auxiliary model, the n=5 main model also prefers fixed-C44 calibration over adaptive-C diversity weighting. The original 0.5 was suboptimally conservative for both components.","next_focus":"Bracket main model fixed-C further upward: try 0.75 and 0.85. Unlike the auxiliary which went to 1.0, the main model has sparse high-order contexts that may benefit from some small adaptive-C hedge."}}
{"type":"hook","stage":"after","exit_code":0,"duration_ms":40,"stdout_bytes":216,"timed_out":false}
{"type":"hook","stage":"before","exit_code":0,"duration_ms":37,"stdout_bytes":8151,"timed_out":false}
{"run":80,"commit":"557a0e5","metric":2.9712937298,"metrics":{"elapsed_seconds":8.039842,"timed_out":0,"evaluated_tokens":200000},"status":"keep","description":"Run 080 main model mix_weight_fixed=0.75 (more fixed-C)","timestamp":1777582061546,"segment":0,"confidence":12.212756531972495,"asi":{"hypothesis":"If the main model still benefits from more fixed-C, 0.75 will improve over 0.65.","source":"run 079 0.65 improvement, runs 073-077 auxiliary fixed-C preference, AGENTS/COMPETITION_RULES","changed_files":["autoresearch.md","explanations/run_080.md","submissions/ngram_interpolated_n5_laplace03_recent_n3_recenta001_w16_warm30000_mix1_main075_wall262144.py"],"learned":"main mix_weight_fixed=0.75 improved to 2.9712937298, ~0.000142 better than 0.65. Both model components strongly prefer fixed-C calibration.","next_focus":"Try 0.85 and 0.9 for main model, then stop if gains plateau or reverse."}}
{"type":"hook","stage":"after","exit_code":0,"duration_ms":41,"stdout_bytes":216,"timed_out":false}
{"type":"hook","stage":"before","exit_code":0,"duration_ms":28,"stdout_bytes":8220,"timed_out":false}
{"run":81,"commit":"10917fb","metric":2.9712233785,"metrics":{"elapsed_seconds":8.517817,"timed_out":0,"evaluated_tokens":200000},"status":"keep","description":"Run 081 main model mix_weight_fixed=0.85","timestamp":1777582138215,"segment":0,"confidence":12.306497481906838,"asi":{"hypothesis":"If main model still benefits from more fixed-C, 0.85 will improve over 0.75.","source":"runs 079-080 monotone improvement 0.65→0.75, AGENTS/COMPETITION_RULES","changed_files":["autoresearch.md","explanations/run_081.md","submissions/ngram_interpolated_n5_laplace03_recent_n3_recenta001_w16_warm30000_mix1_main085_wall262144.py"],"learned":"main mix_weight_fixed=0.85 improved to 2.9712233785, ~0.000070 better than 0.75. Fixed-C preference keeps strengthening.","next_focus":"Try 0.95 for main model, then 1.0 if still improving."}}
{"type":"hook","stage":"after","exit_code":0,"duration_ms":40,"stdout_bytes":216,"timed_out":false}
{"type":"hook","stage":"before","exit_code":0,"duration_ms":32,"stdout_bytes":8073,"timed_out":false}
{"run":82,"commit":"10917fb","metric":2.9712306095,"metrics":{"elapsed_seconds":9.505536,"timed_out":0,"evaluated_tokens":200000},"status":"discard","description":"Run 082 main model mix_weight_fixed=0.95 (plateau)","timestamp":1777582209645,"segment":0,"confidence":12.36943998425277,"asi":{"hypothesis":"If main model still benefits from more fixed-C, 0.95 will improve over 0.85.","source":"runs 079-081 monotone improvement 0.65→0.85, AGENTS/COMPETITION_RULES","changed_files":["autoresearch.md","explanations/run_082.md","submissions/ngram_interpolated_n5_laplace03_recent_n3_recenta001_w16_warm30000_mix1_main095_wall262144.py"],"learned":"main mix_weight_fixed=0.95 scored 2.9712306095, slightly worse than 0.85 (2.9712233785). The main model optimum is bracketed at 0.85 — it needs a small adaptive-C hedge for sparse high-order contexts, unlike the pure-fixed-C auxiliary.","rollback_reason":"Primary metric worsened by about 0.000007 bits/symbol versus current best 0.85.","next_action_hint":"Fixed/adaptive mixture bracketing is complete: auxiliary=1.0, main=0.85. Next explore main model fixed_c value (currently 44, tuned for n=4) or main model smoothing alpha."}}
{"type":"hook","stage":"after","exit_code":0,"duration_ms":40,"stdout_bytes":216,"timed_out":false}
{"type":"hook","stage":"before","exit_code":0,"duration_ms":36,"stdout_bytes":8073,"timed_out":false}
{"run":83,"commit":"74ed40e","metric":2.9707545492,"metrics":{"elapsed_seconds":9.319943,"timed_out":0,"evaluated_tokens":200000},"status":"keep","description":"Run 083 main Fixed_C=60 (more conservative interpolation)","timestamp":1777582286571,"segment":0,"confidence":12.628020737895437,"asi":{"hypothesis":"If n=5's sparser contexts benefit from more conservative interpolation, C=60 will improve over C=44.","source":"runs 009-015 tuned C~40-44 for n=4, run 016 n=5 C=44 failed with old architecture, current model significantly improved","changed_files":["autoresearch.md","explanations/run_083.md","submissions/ngram_interpolated_n5_laplace03_recent_n3_recenta001_w16_warm30000_mix1_main085_FIXEDC60_wall262144.py"],"learned":"Increasing fixed_C from 44 to 60 improved to 2.9707545492, ~0.000469 better. The n=5 model's sparser high-order contexts benefit from more conservative interpolation that borrows lower-order statistics more heavily.","next_focus":"Bracket C upward: try C=80 then C=100. This is a shared C affecting both main and auxiliary, but the auxiliary is unaffected (huge counts = lam_fixed≈1.0 at any reasonable C)."}}
{"type":"hook","stage":"after","exit_code":0,"duration_ms":41,"stdout_bytes":216,"timed_out":false}
{"type":"hook","stage":"before","exit_code":0,"duration_ms":33,"stdout_bytes":8190,"timed_out":false}
{"run":84,"commit":"74ed40e","metric":2.9711805391,"metrics":{"elapsed_seconds":8.239554,"timed_out":0,"evaluated_tokens":200000},"status":"discard","description":"Run 084 main Fixed_C=80 (too conservative)","timestamp":1777582345964,"segment":0,"confidence":12.67531854448812,"asi":{"hypothesis":"If still too aggressive at C=60, C=80 will improve.","source":"run 083 C=60 improvement","changed_files":["autoresearch.md","explanations/run_084.md","submissions/ngram_interpolated_n5_laplace03_recent_n3_recenta001_w16_warm30000_mix1_main085_FIXEDC80_wall262144.py"],"learned":"C=80 is too conservative — it over-borrows lower-order statistics. The fixed_C optimum for n=5 is between 44 and 80, with C=60 currently best.","rollback_reason":"Primary metric worsened by about 0.000426 bits/symbol versus current best C=60.","next_action_hint":"Try intermediate C=55 or C=65 to refine the bracket."}}
{"type":"hook","stage":"after","exit_code":0,"duration_ms":49,"stdout_bytes":216,"timed_out":false}
{"type":"hook","stage":"before","exit_code":0,"duration_ms":31,"stdout_bytes":8190,"timed_out":false}
{"run":85,"commit":"74ed40e","metric":2.9707908198,"metrics":{"elapsed_seconds":8.414779,"timed_out":0,"evaluated_tokens":200000},"status":"discard","description":"Run 085 main Fixed_C=55 (intermediate bracket)","timestamp":1777582407890,"segment":0,"confidence":12.803086165665913,"asi":{"hypothesis":"If optimum is near 55-60, C=55 may improve.","source":"runs 083-084 C bracket","changed_files":["autoresearch.md","explanations/run_085.md","submissions/ngram_interpolated_n5_laplace03_recent_n3_recenta001_w16_warm30000_mix1_main085_FIXEDC55_wall262144.py"],"learned":"C=55 scored 2.9707908198, slightly worse than C=60 (2.9707545492). The fixed_C optimum is confirmed around 60 for the n=5 model.","rollback_reason":"Primary metric worsened by 0.0000363 vs C=60.","next_action_hint":"C bracketing complete: optimum at 60. Next: retune main model alpha (currently 0.3, tuned early in experiment history when model was much simpler)."}}
{"type":"hook","stage":"after","exit_code":0,"duration_ms":43,"stdout_bytes":216,"timed_out":false}
{"type":"hook","stage":"before","exit_code":0,"duration_ms":28,"stdout_bytes":8190,"timed_out":false}
{"run":86,"commit":"74ed40e","metric":2.971182841,"metrics":{"elapsed_seconds":9.53387,"timed_out":0,"evaluated_tokens":200000},"status":"discard","description":"Run 086 main model alpha=0.35 retune","timestamp":1777582483289,"segment":0,"confidence":12.933455818922235,"asi":{"hypothesis":"Slightly smoother alpha=0.35 may improve with the current more conservative architecture.","source":"runs 031-033 alpha bracket for old n=5 model","changed_files":["autoresearch.md","explanations/run_086.md","submissions/ngram_interpolated_n5_laplace035_recent_n3_recenta001_w16_warm30000_mix1_main085_FIXEDC60_wall262144.py"],"learned":"alpha=0.35 worsened to 2.9711828410, about 0.000428 worse. Alpha=0.3 remains optimal even with the improved architecture.","rollback_reason":"Primary metric worsened vs alpha=0.3.","next_action_hint":"Current configuration is well-calibrated. Consider PPM-style exclusion or validation/repeat as next qualitative direction."}}
{"type":"hook","stage":"after","exit_code":0,"duration_ms":40,"stdout_bytes":216,"timed_out":false}
{"type":"hook","stage":"before","exit_code":0,"duration_ms":36,"stdout_bytes":8190,"timed_out":false}
{"run":87,"commit":"4a5825b","metric":2.9705561503,"metrics":{"elapsed_seconds":8.683709,"timed_out":0,"evaluated_tokens":200000},"status":"keep","description":"Run 087 recent max weight=0.14 (with improved architecture)","timestamp":1777582576076,"segment":0,"confidence":13.384054158640843,"asi":{"hypothesis":"With improved main model, reducing auxiliary weight to 0.14 may improve.","source":"runs 056-060 weight bracket with old architecture","changed_files":["autoresearch.md","explanations/run_087.md","submissions/ngram_interpolated_n5_laplace03_recent_n3_recenta001_w14_warm30000_mix1_main085_FIXEDC60_wall262144.py"],"learned":"Reducing recent max weight to 0.14 improved to 2.9705561503, ~0.000198 better. The improved main model (C=60, fixed-C=0.85) handles more of the probability assignment, so the auxiliary mass shifted down from 0.16 to 0.14.","next_focus":"Bracket further downward: try 0.12 and 0.10. With better main model, the auxiliary may need even less weight."}}
{"type":"hook","stage":"after","exit_code":0,"duration_ms":39,"stdout_bytes":216,"timed_out":false}
{"type":"hook","stage":"before","exit_code":0,"duration_ms":39,"stdout_bytes":7737,"timed_out":false}
{"run":88,"commit":"6cd455b","metric":2.9704409077,"metrics":{"elapsed_seconds":8.450282,"timed_out":0,"evaluated_tokens":200000},"status":"keep","description":"Run 088 recent max weight=0.12 (downward bracket)","timestamp":1777582669003,"segment":0,"confidence":13.784191393442613,"asi":{"hypothesis":"If improved main model still absorbs more, 0.12 will improve.","source":"run 087 weight 0.14 improvement","changed_files":["autoresearch.md","explanations/run_088.md","submissions/ngram_interpolated_n5_laplace03_recent_n3_recenta001_w12_warm30000_mix1_main085_FIXEDC60_wall262144.py"],"learned":"Weight 0.12 improved further to 2.9704409077, ~0.000115 better than 0.14. The improved main model continues absorbing more of the prediction.","next_focus":"Try 0.10 as further downward bracket."}}
{"type":"hook","stage":"after","exit_code":0,"duration_ms":57,"stdout_bytes":216,"timed_out":false}
{"type":"hook","stage":"before","exit_code":0,"duration_ms":31,"stdout_bytes":6778,"timed_out":false}
{"run":89,"commit":"3c6adb5","metric":2.9704122304,"metrics":{"elapsed_seconds":7.96004,"timed_out":0,"evaluated_tokens":200000},"status":"keep","description":"Run 089 recent max weight=0.10","timestamp":1777582722922,"segment":0,"confidence":13.923751244666695,"asi":{"hypothesis":"0.10 may further improve over 0.12.","source":"runs 087-088 weight bracket","changed_files":["autoresearch.md","explanations/run_089.md","submissions/ngram_interpolated_n5_laplace03_recent_n3_recenta001_w10_warm30000_mix1_main085_FIXEDC60_wall262144.py"],"learned":"Weight 0.10 improved to 2.9704122304, ~0.000029 better. Improved main model continues taking more mass from auxiliary.","next_focus":"Try 0.08 and 0.05."}}
{"type":"hook","stage":"after","exit_code":0,"duration_ms":40,"stdout_bytes":216,"timed_out":false}
{"type":"hook","stage":"before","exit_code":0,"duration_ms":43,"stdout_bytes":5770,"timed_out":false}
{"run":90,"commit":"3c6adb5","metric":2.970474247,"metrics":{"elapsed_seconds":8.405798,"timed_out":0,"evaluated_tokens":200000},"status":"discard","description":"Run 090 recent max weight=0.08 (too low)","timestamp":1777582778582,"segment":0,"confidence":14.051590912293944,"asi":{"hypothesis":"0.08 may further improve.","source":"runs 087-089 weight bracket","changed_files":["autoresearch.md","explanations/run_090.md","submissions/ngram_interpolated_n5_laplace03_recent_n3_recenta001_w08_warm30000_mix1_main085_FIXEDC60_wall262144.py"],"learned":"Weight 0.08 worsened to 2.9704742470. The auxiliary component optimum is bracketed at 0.10. Below this, the auxiliary model is under-used and the main model can't fully compensate.","rollback_reason":"Primary metric worsened by about 0.000062 vs weight 0.10.","next_action_hint":"Weight bracketing complete: optimum at 0.10. Current best score 2.9704122304 (down 0.0282 from baseline, 0.94% improvement). Next: consider qualitative change like PPM exclusion or validate/confirm current best."}}
{"type":"hook","stage":"after","exit_code":0,"duration_ms":38,"stdout_bytes":216,"timed_out":false}
{"type":"hook","stage":"before","exit_code":0,"duration_ms":31,"stdout_bytes":5770,"timed_out":false}
