{"run":61,"commit":"e1f8bcd","metric":2.9719344575,"metrics":{"elapsed_seconds":9.254501,"timed_out":0,"evaluated_tokens":200000},"status":"keep","description":"Run 061 all-past n=3 weight 0.14 warmup 20000","timestamp":1777579711058,"segment":0,"confidence":8.99792012919311,"asi":{"hypothesis":"If early all-past n=3 online estimates are noisy, a 20000-token warmup will improve by delaying full auxiliary weight; if useful online evidence appears quickly, it will underuse adaptation and worsen.","source":"runs 052-055 broad-window stabilization, run 060 flat steady-state weight, run 058 excessive weight failure, run 059 auxiliary n=4 failure, AGENTS/COMPETITION_RULES sequential N=200000, lectures 5/13/15 on mismatch, synchronized past-history evidence, and robust mixtures","changed_files":["autoresearch.md","explanations/run_061.md","submissions/ngram_interpolated_n5_laplace03_recent_n3_w14_warm20000_win262144.py"],"learned":"Slowing the all-past n=3 auxiliary ramp to 20000 tokens improved to 2.9719344575, about 0.0000335 bits/symbol better than Run 060. Early online-only estimates were noisy enough that delaying full mixture weight helped while preserving the same final hedge.","next_focus":"Bracket the warmup schedule coarsely, e.g. try 40000 to see if even slower ramp helps, or 15000 if 20000 may be too slow; avoid returning to narrow steady-state weight tuning until warmup is bracketed."}}
{"type":"hook","stage":"after","exit_code":0,"duration_ms":39,"stdout_bytes":216,"timed_out":false}
{"type":"hook","stage":"before","exit_code":0,"duration_ms":33,"stdout_bytes":7987,"timed_out":false}
{"run":62,"commit":"e1f8bcd","metric":2.9719714025,"metrics":{"elapsed_seconds":7.660224,"timed_out":0,"evaluated_tokens":200000},"status":"discard","description":"Run 062 all-past n=3 weight 0.14 warmup 40000","timestamp":1777579804402,"segment":0,"confidence":9.426795003546703,"asi":{"hypothesis":"If the all-past n=3 component is still unreliable during the first 20000 tokens, a 40000-token warmup should improve by delaying full auxiliary weight further; otherwise it will underuse useful online evidence and worsen.","source":"run 061 warmup 20000 improvement, runs 052-055 broad-window stabilization, run 060 flat steady-state weight, AGENTS/COMPETITION_RULES sequential N=200000, lectures 5/13/15 on mismatch, synchronized past-history evidence, and robust mixtures","changed_files":["autoresearch.md","explanations/run_062.md","submissions/ngram_interpolated_n5_laplace03_recent_n3_w14_warm40000_win262144.py"],"learned":"A 40000-token warmup scored 2.9719714025, worse than the 20000-token warmup. Delaying the all-past n=3 auxiliary component too long underuses useful low-order online evidence; the warmup optimum is bracketed between 10000 and 40000, with 20000 currently best.","rollback_reason":"Primary metric worsened by about 0.0000369 bits/symbol versus current best run 061 warmup 20000.","next_action_hint":"Keep warmup 20000. If continuing warmup tuning, try a lower/mid bracket such as 15000 or 25000; otherwise move to a qualitatively different change like auxiliary smoothing after noting public-practice tuning risk."}}
{"type":"hook","stage":"after","exit_code":0,"duration_ms":42,"stdout_bytes":216,"timed_out":false}
{"type":"hook","stage":"before","exit_code":0,"duration_ms":31,"stdout_bytes":7987,"timed_out":false}
{"run":63,"commit":"e1f8bcd","metric":2.9719350195,"metrics":{"elapsed_seconds":8.703606,"timed_out":0,"evaluated_tokens":200000},"status":"discard","description":"Run 063 all-past n=3 weight 0.14 warmup 25000","timestamp":1777579944608,"segment":0,"confidence":9.324445656309607,"asi":{"hypothesis":"If the best transition from train-heavy evidence to online low-order evidence is slightly slower than Run 061, a 25000-token warmup should improve; otherwise it will underuse online adaptation and worsen.","source":"run 061 warmup 20000 improvement, run 062 warmup 40000 failure, run 060 flat steady-state weight, AGENTS/COMPETITION_RULES sequential N=200000, lectures 5/13/15 on mismatch, synchronized past-history evidence, and robust mixtures","changed_files":["autoresearch.md","explanations/run_063.md","submissions/ngram_interpolated_n5_laplace03_recent_n3_w14_warm25000_win262144.py"],"learned":"A 25000-token warmup scored 2.9719350195, essentially tied but slightly worse than 20000 by about 0.0000006 bits/symbol. The warmup optimum is flat/noise-level around 20000-25000, with 20000 still current best.","rollback_reason":"Primary metric did not improve over current best run 061 warmup 20000, missing by about 0.0000006 bits/symbol.","next_action_hint":"Keep warmup 20000. Stop narrow warmup tuning unless validating/repeating; try a qualitative change such as separate auxiliary smoothing for the all-past n=3 component."}}
{"type":"hook","stage":"after","exit_code":0,"duration_ms":40,"stdout_bytes":216,"timed_out":false}
{"type":"hook","stage":"before","exit_code":0,"duration_ms":32,"stdout_bytes":7987,"timed_out":false}
{"run":64,"commit":"97028c8","metric":2.9718899997,"metrics":{"elapsed_seconds":7.692427,"timed_out":0,"evaluated_tokens":200000},"status":"keep","description":"Run 064 all-past n=3 auxiliary alpha 0.2","timestamp":1777580066117,"segment":0,"confidence":9.239659531325369,"asi":{"hypothesis":"If full-prefix n=3 online contexts are dense enough, auxiliary alpha 0.2 will sharpen test-specific low-order probabilities and improve; if rare symbols still need alpha 0.3 protection, it will worsen.","source":"run 061 current best weight/warmup, runs 062-063 flat/worse warmup tuning, runs 052-055 full-prefix stabilization, run 033 global alpha 0.2 too sharp for n=5 main, AGENTS/COMPETITION_RULES sequential N=200000, lectures 5/13/15 on mismatch, synchronized past-history evidence, and robust mixtures","changed_files":["autoresearch.md","explanations/run_064.md","submissions/ngram_interpolated_n5_laplace03_recent_n3_recenta02_w14_warm20000_win262144.py"],"learned":"Separating auxiliary smoothing and lowering only the all-past n=3 online component to alpha 0.2 improved to 2.9718899997, about 0.0000445 bits/symbol better than Run 061. The dense all-past low-order component benefits from sharper smoothing even though global n=5 alpha 0.2 was too sharp.","next_focus":"Bracket auxiliary smoothing around 0.2, e.g. try auxiliary alpha 0.1 or 0.25/0.15, while keeping main alpha 0.3, weight 0.14, and warmup 20000. Avoid changing main smoothing."}}
{"type":"hook","stage":"after","exit_code":0,"duration_ms":40,"stdout_bytes":216,"timed_out":false}
{"type":"hook","stage":"before","exit_code":0,"duration_ms":31,"stdout_bytes":7846,"timed_out":false}
{"run":65,"commit":"8796dc0","metric":2.971845241,"metrics":{"elapsed_seconds":7.877671,"timed_out":0,"evaluated_tokens":200000},"status":"keep","description":"Run 065 all-past n=3 auxiliary alpha 0.1","timestamp":1777580181775,"segment":0,"confidence":9.095393433156222,"asi":{"hypothesis":"If all-past n=3 online contexts are dense enough that auxiliary alpha 0.2 is still over-smoothed, alpha 0.1 should sharpen test-specific probabilities and improve; otherwise it will over-sharpen and worsen.","source":"run 064 auxiliary alpha 0.2 improvement, runs 052-055 full-prefix stabilization, run 033 global alpha 0.2 too sharp for n=5 main, AGENTS/COMPETITION_RULES sequential N=200000, lectures 5/13/15 on mismatch, synchronized past-history evidence, and robust mixtures","changed_files":["autoresearch.md","explanations/run_065.md","submissions/ngram_interpolated_n5_laplace03_recent_n3_recenta01_w14_warm20000_win262144.py"],"learned":"Lowering only the all-past n=3 auxiliary smoothing to alpha 0.1 improved to 2.9718452410, about 0.0000448 bits/symbol better than alpha 0.2. The dense low-order online component still benefits from sharper smoothing, despite main n=5 needing alpha 0.3.","next_focus":"Bracket the lower side of auxiliary smoothing once more, e.g. try alpha 0.05 or 0.07, while keeping main alpha 0.3, weight 0.14, and warmup 20000. Watch for rare-symbol surprise penalties."}}
{"type":"hook","stage":"after","exit_code":0,"duration_ms":41,"stdout_bytes":216,"timed_out":false}
{"type":"hook","stage":"before","exit_code":0,"duration_ms":39,"stdout_bytes":8009,"timed_out":false}
{"run":66,"commit":"e337340","metric":2.9718226807,"metrics":{"elapsed_seconds":8.400603,"timed_out":0,"evaluated_tokens":200000},"status":"keep","description":"Run 066 all-past n=3 auxiliary alpha 0.05","timestamp":1777580301117,"segment":0,"confidence":8.94861118980225,"asi":{"hypothesis":"If auxiliary alpha 0.1 is still over-smoothed for dense all-past n=3 online contexts, alpha 0.05 should improve; if 0.1 is near the rare-symbol protection limit, 0.05 will over-sharpen and worsen.","source":"run 065 auxiliary alpha 0.1 improvement, run 064 auxiliary alpha 0.2 improvement, runs 052-055 full-prefix stabilization, run 033 global alpha 0.2 too sharp for n=5 main, AGENTS/COMPETITION_RULES sequential N=200000, lectures 5/13/15 on mismatch, synchronized past-history evidence, and robust mixtures","changed_files":["autoresearch.md","explanations/run_066.md","submissions/ngram_interpolated_n5_laplace03_recent_n3_recenta005_w14_warm20000_win262144.py"],"learned":"Lowering only the all-past n=3 auxiliary smoothing to alpha 0.05 improved to 2.9718226807, about 0.0000226 bits/symbol better than alpha 0.1. The lower-side smoothing gains are shrinking but not yet reversed; the dense low-order auxiliary model still benefits from sharper smoothing.","next_focus":"Bracket the lower side once more more cautiously, e.g. auxiliary alpha 0.02 or 0.03, while keeping main alpha 0.3, weight 0.14, and warmup 20000; stop if rare-symbol penalties appear."}}
{"type":"hook","stage":"after","exit_code":0,"duration_ms":43,"stdout_bytes":216,"timed_out":false}
{"type":"hook","stage":"before","exit_code":0,"duration_ms":35,"stdout_bytes":8073,"timed_out":false}
{"run":67,"commit":"84dd39c","metric":2.971809091,"metrics":{"elapsed_seconds":7.789248,"timed_out":0,"evaluated_tokens":200000},"status":"keep","description":"Run 067 all-past n=3 auxiliary alpha 0.02","timestamp":1777580406372,"segment":0,"confidence":9.044846035122783,"asi":{"hypothesis":"If auxiliary alpha 0.05 is still over-smoothed, alpha 0.02 should improve for dense all-past n=3 online contexts; if the optimum is near 0.05, 0.02 will over-sharpen and worsen.","source":"run 066 auxiliary alpha 0.05 improvement, runs 064-065 auxiliary smoothing improvements, runs 052-055 full-prefix stabilization, run 033 global alpha 0.2 too sharp for n=5 main, AGENTS/COMPETITION_RULES sequential N=200000, lectures 5/13/15 on mismatch, synchronized past-history evidence, and robust mixtures","changed_files":["autoresearch.md","explanations/run_067.md","submissions/ngram_interpolated_n5_laplace03_recent_n3_recenta002_w14_warm20000_win262144.py"],"learned":"Lowering only the all-past n=3 auxiliary smoothing to alpha 0.02 improved to 2.9718090910, about 0.0000136 bits/symbol better than alpha 0.05. Gains continue but are shrinking; the optimum may be near a very small pseudocount, but rare-symbol penalty has not yet reversed within the current public-practice run.","next_focus":"Bracket below alpha 0.02 very cautiously, e.g. alpha 0.01, or try an intermediate alpha 0.03 for robustness. Keep main alpha 0.3, weight 0.14, and warmup 20000."}}
{"type":"hook","stage":"after","exit_code":0,"duration_ms":39,"stdout_bytes":216,"timed_out":false}
{"type":"hook","stage":"before","exit_code":0,"duration_ms":39,"stdout_bytes":8149,"timed_out":false}
{"run":68,"commit":"69390f0","metric":2.9718045659,"metrics":{"elapsed_seconds":8.033969,"timed_out":0,"evaluated_tokens":200000},"status":"keep","description":"Run 068 all-past n=3 auxiliary alpha 0.01","timestamp":1777580533155,"segment":0,"confidence":9.139983481573141,"asi":{"hypothesis":"If auxiliary alpha 0.02 is still over-smoothed, alpha 0.01 should improve for dense all-past n=3 online contexts; if rare-symbol protection limit is around 0.02, 0.01 will over-sharpen and worsen.","source":"runs 064-067 monotone auxiliary smoothing improvements with shrinking gains, runs 052-055 full-prefix stabilization, run 033 global alpha 0.2 too sharp for n=5 main, AGENTS/COMPETITION_RULES sequential N=200000, lectures 5/13/15 on mismatch, synchronized past-history evidence, and robust mixtures","changed_files":["autoresearch.md","explanations/run_068.md","submissions/ngram_interpolated_n5_laplace03_recent_n3_recenta001_w14_warm20000_win262144.py"],"learned":"Lowering only the all-past n=3 auxiliary smoothing to alpha 0.01 improved to 2.9718045659, only about 0.0000045 bits/symbol better than alpha 0.02. The lower-side smoothing optimum is very flat and likely near 0.01-0.02; gains are now noise-level.","next_focus":"Stop aggressive lower smoothing unless validating/repeating. Consider an intermediate alpha 0.015 or a qualitative change such as retuning weight/warmup after sharp auxiliary smoothing; avoid claiming robustness from tiny public-practice-only gains."}}
{"type":"hook","stage":"after","exit_code":0,"duration_ms":47,"stdout_bytes":216,"timed_out":false}
{"type":"hook","stage":"before","exit_code":0,"duration_ms":30,"stdout_bytes":8041,"timed_out":false}
{"run":69,"commit":"78cc26d","metric":2.9717929495,"metrics":{"elapsed_seconds":8.01854,"timed_out":0,"evaluated_tokens":200000},"status":"keep","description":"Run 069 all-past n=3 alpha 0.01 weight 0.16","timestamp":1777580662895,"segment":0,"confidence":9.34588893827972,"asi":{"hypothesis":"If the sharpened alpha 0.01 all-past n=3 auxiliary component is now underweighted, max weight 0.16 should improve; if it is already near its best mixture mass, 0.16 will dilute the main model and worsen.","source":"run 068 alpha 0.01 current best with tiny lower-smoothing gain, runs 064-067 auxiliary smoothing improvements, run 058 old alpha 0.3 weight 0.18 too high, AGENTS/COMPETITION_RULES sequential N=200000, lectures 5/13/15 on mismatch, synchronized past-history evidence, and robust mixtures","changed_files":["autoresearch.md","explanations/run_069.md","submissions/ngram_interpolated_n5_laplace03_recent_n3_recenta001_w16_warm20000_win262144.py"],"learned":"Increasing max auxiliary weight to 0.16 with alpha 0.01 improved to 2.9717929495, about 0.0000116 bits/symbol better than weight 0.14. Sharpening the auxiliary component changed the optimal hedge enough that it can carry slightly more mass, but the gain is small.","next_focus":"Bracket weight after sharp smoothing: try 0.18 or 0.17 cautiously to see whether the new optimum moved upward, while keeping alpha 0.01 and warmup 20000. Stop if over-weighting reappears."}}
{"type":"hook","stage":"after","exit_code":0,"duration_ms":39,"stdout_bytes":216,"timed_out":false}
{"type":"hook","stage":"before","exit_code":0,"duration_ms":40,"stdout_bytes":8143,"timed_out":false}
{"run":70,"commit":"78cc26d","metric":2.9718751228,"metrics":{"elapsed_seconds":8.423039,"timed_out":0,"evaluated_tokens":200000},"status":"discard","description":"Run 070 all-past n=3 alpha 0.01 weight 0.18","timestamp":1777580774173,"segment":0,"confidence":9.27576433840372,"asi":{"hypothesis":"If the sharpened alpha 0.01 all-past n=3 component is still underweighted at weight 0.16, max weight 0.18 should improve; if 0.16 is near the best hedge, 0.18 will over-weight the auxiliary model and worsen.","source":"run 069 weight 0.16 improvement, run 068 tiny alpha 0.01 smoothing gain, run 058 older alpha 0.3 weight 0.18 failure, AGENTS/COMPETITION_RULES sequential N=200000, lectures 5/13/15 on mismatch, synchronized past-history evidence, and robust mixtures","changed_files":["autoresearch.md","explanations/run_070.md","submissions/ngram_interpolated_n5_laplace03_recent_n3_recenta001_w18_warm20000_win262144.py"],"learned":"Raising max auxiliary weight to 0.18 worsened to 2.9718751228, so the sharpened all-past n=3 component is over-weighted by 0.18. Run 069 weight 0.16 remains the best bracketed setting.","rollback_reason":"Primary metric worsened by about 0.000082 bits/symbol versus current best weight 0.16.","next_action_hint":"Do not go above 0.16 without a different schedule. If continuing weight tuning, try a midpoint such as 0.17 only if the loop needs one more bracket; otherwise retune warmup or validate current best."}}
{"type":"hook","stage":"after","exit_code":0,"duration_ms":40,"stdout_bytes":216,"timed_out":false}
{"type":"hook","stage":"before","exit_code":0,"duration_ms":32,"stdout_bytes":8143,"timed_out":false}
{"run":71,"commit":"591f37b","metric":2.9717926651,"metrics":{"elapsed_seconds":8.974592,"timed_out":0,"evaluated_tokens":200000},"status":"keep","description":"Run 071 all-past n=3 alpha 0.01 weight 0.16 warmup 30000","timestamp":1777580915088,"segment":0,"confidence":9.25975748896933,"asi":{"hypothesis":"If the sharp, weight-0.16 auxiliary model is too noisy during the first 20000 symbols, a 30000 warmup will improve; if useful online evidence is already reliable by 20000, the slower ramp will underuse it and worsen.","source":"run 069 weight 0.16 improvement, run 070 weight 0.18 over-weighting, runs 061-063 warmup bracket for older auxiliary setup, AGENTS/COMPETITION_RULES sequential N=200000, lectures 5/13/15 on mismatch, synchronized past-history evidence, and robust mixtures","changed_files":["autoresearch.md","explanations/run_071.md","submissions/ngram_interpolated_n5_laplace03_recent_n3_recenta001_w16_warm30000_win262144.py"],"learned":"Slowing the sharp auxiliary weight ramp to 30000 tokens improved very slightly to 2.9717926651, about 0.0000003 bits/symbol better than 20000. The effect is essentially flat/noise-level, but does not hurt; early sharp auxiliary noise may still be marginally present.","next_focus":"Treat 20000-30000 warmup as flat. If continuing schedule tuning, try a clearly different ramp such as quadratic warmup to 30000 or a lower 25000 confirmation only if needed; otherwise explore separate recent internal fixed/adaptive mixture or validate current best."}}
{"type":"hook","stage":"after","exit_code":0,"duration_ms":41,"stdout_bytes":216,"timed_out":false}
{"type":"hook","stage":"before","exit_code":0,"duration_ms":35,"stdout_bytes":7986,"timed_out":false}
{"run":72,"commit":"591f37b","metric":2.9718579119,"metrics":{"elapsed_seconds":9.565274,"timed_out":0,"evaluated_tokens":200000},"status":"discard","description":"Run 072 quadratic warmup for sharp all-past n=3 auxiliary","timestamp":1777581064724,"segment":0,"confidence":9.24088601365803,"asi":{"hypothesis":"If the sharp all-past n=3 auxiliary model still hurts early tokens under a linear ramp, a quadratic 30000-token ramp will improve; if useful online evidence is reliable early, the slower initial ramp will underuse it and worsen.","source":"run 071 flat/slightly better linear warmup 30000, run 070 final weight 0.18 over-weighting, runs 064-068 sharp auxiliary smoothing, AGENTS/COMPETITION_RULES sequential N=200000, lectures 5/13/15 on mismatch, synchronized past-history evidence, and robust mixtures","changed_files":["autoresearch.md","explanations/run_072.md","submissions/ngram_interpolated_n5_laplace03_recent_n3_recenta001_w16_warm30000_quad_win262144.py"],"learned":"Quadratic warmup worsened to 2.9718579119, so the sharp all-past n=3 auxiliary evidence is useful early enough that delaying it quadratically loses more than it protects. Linear warmup 30000 remains best.","rollback_reason":"Primary metric worsened by about 0.000065 bits/symbol versus current best linear warmup 30000.","next_action_hint":"Avoid slower-than-linear early ramps for this auxiliary model. Next explore model-mixture calibration such as separate recent fixed/adaptive mixture weight, or validate/repeat the best predictor rather than more ramp micro-tuning."}}
{"type":"hook","stage":"after","exit_code":0,"duration_ms":42,"stdout_bytes":216,"timed_out":false}
{"type":"hook","stage":"before","exit_code":0,"duration_ms":32,"stdout_bytes":7986,"timed_out":false}
{"run":73,"commit":"369df79","metric":2.9717829205,"metrics":{"elapsed_seconds":8.655741,"timed_out":0,"evaluated_tokens":200000},"status":"keep","description":"Run 073 separate recent mix_weight_fixed=0.75 for all-past n=3 auxiliary","timestamp":1777581434333,"segment":0,"confidence":9.978310991804541,"asi":{"hypothesis":"If the all-past n=3 auxiliary contexts are dense enough that fixed-C44 is better calibrated than the 50/50 blend, recent_mix_weight_fixed=0.75 will improve; if the 50/50 blend is still the better hedge, the over-weighted fixed-C component will worsen.","source":"run 027 fixed/adaptive mixture originally 50/50 optimal for full n=4, runs 064-068 auxiliary smoothing made models qualitatively different, runs 052-055 full-prefix dense auxiliary counts, AGENTS/COMPETITION_RULES sequential N=200000, lectures 5/13/15 on mismatch, synchronized past-history evidence, and robust mixtures","changed_files":["autoresearch.md","explanations/run_073.md","submissions/ngram_interpolated_n5_laplace03_recent_n3_recenta001_w16_warm30000_mix075_wall262144.py"],"learned":"Increasing the auxiliary internal mixture weight towards fixed-C44 (0.75) improved slightly to 2.9717829205, about 0.000010 bits/symbol better than shared 0.5. Dense low-order online contexts benefit from simpler fixed-C calibration more than the sparse main model.","next_focus":"Bracket the opposite direction: try recent_mix_weight_fixed=0.25 (more adaptive-C for auxiliary) to see if the simplified calibration direction matters. If that also worsens, treat 0.75 as bracketed optimum."}}
{"type":"hook","stage":"after","exit_code":0,"duration_ms":41,"stdout_bytes":216,"timed_out":false}
{"type":"hook","stage":"before","exit_code":0,"duration_ms":30,"stdout_bytes":7938,"timed_out":false}
