{"type":"hook","stage":"after","exit_code":0,"duration_ms":41,"stdout_bytes":216,"timed_out":false}
{"type":"hook","stage":"before","exit_code":0,"duration_ms":34,"stdout_bytes":8225,"timed_out":false}
{"run":47,"commit":"4dfa819","metric":2.9739475853,"metrics":{"elapsed_seconds":6.959398,"timed_out":0,"evaluated_tokens":200000},"status":"discard","description":"Run 047 n=5 main with n=2 recent-window component","timestamp":1777578069675,"segment":0,"confidence":9.684445554783188,"asi":{"hypothesis":"If Run 046 still overuses sparse two-symbol recent contexts, recent n=2 should improve by using very reliable one-symbol local statistics while the main cumulative n=5 model preserves longer memory.","source":"run 046 recent n=3 improvement, run 044 recent n=4 improvement, run 045 smoothing failure, ideas backlog on recency adaptation, lectures 5/13/15 on mismatch, finite-history evidence, and robust mixtures","changed_files":["autoresearch.md","explanations/run_047.md","submissions/ngram_interpolated_n5_laplace03_recent_n2_win16384.py"],"learned":"Recent n=2 scored 2.9739475853, worse than recent n=3 despite being faster. The useful recent-window signal needs at least two-symbol context; the recent-order optimum is bracketed around n=3.","rollback_reason":"Primary metric worsened by about 0.000545 bits/symbol versus current best run 046 n=3 recent component.","next_action_hint":"Keep recent n=3 alpha 0.3 window 16384. Next either validate/repeat run 046 or tune a different recency dimension such as n=3 recent weight/window with coarse brackets."}}
{"type":"hook","stage":"after","exit_code":0,"duration_ms":43,"stdout_bytes":216,"timed_out":false}
{"type":"hook","stage":"before","exit_code":0,"duration_ms":34,"stdout_bytes":8225,"timed_out":false}
{"run":48,"commit":"0d150fc","metric":2.9730956697,"metrics":{"elapsed_seconds":8.371491,"timed_out":0,"evaluated_tokens":200000},"status":"keep","description":"Run 048 n=3 recent-window max weight 0.08","timestamp":1777578201777,"segment":0,"confidence":9.553473258898515,"asi":{"hypothesis":"Because recent n=3 is less sparse than previous recent models and beat both recent n=4 and n=2, raising max recent weight from 0.05 to 0.08 may improve by using the local-regime signal more strongly.","source":"run 046 recent n=3 improvement, run 047 recent n=2 failure, run 039 n=5 weight 0.08 failure as a cautionary bracket, ideas backlog on recency adaptation, lectures 5/13/15 on mismatch, synchronized past-history evidence, and robust mixtures","changed_files":["autoresearch.md","explanations/run_048.md","submissions/ngram_interpolated_n5_laplace03_recent_n3_w08_win16384.py"],"learned":"Max recent weight 0.08 improved to 2.9730956697, about 0.000307 bits/symbol better than the 0.05 n=3 recent model. Once the recent component is lowered to n=3, it is reliable enough to carry more mixture mass than the sparse n=5 recent model could.","next_focus":"Coarsely bracket n=3 recent weight upward/downward, e.g. try 0.11 or a moderate 0.065/0.10, but avoid excessive public-practice tuning; validation remains important."}}
{"type":"hook","stage":"after","exit_code":0,"duration_ms":45,"stdout_bytes":216,"timed_out":false}
{"type":"hook","stage":"before","exit_code":0,"duration_ms":33,"stdout_bytes":8027,"timed_out":false}
{"run":49,"commit":"0d150fc","metric":2.9731718557,"metrics":{"elapsed_seconds":8.881451,"timed_out":0,"evaluated_tokens":200000},"status":"discard","description":"Run 049 n=3 recent-window max weight 0.11","timestamp":1777578304818,"segment":0,"confidence":8.710657250103445,"asi":{"hypothesis":"If the Run 048 model still underweights reliable n=3 recent-window evidence, max recent weight 0.11 should improve; otherwise it will overfit recency noise or dilute long-context main-model evidence.","source":"run 048 n=3 recent weight 0.08 improvement, run 047 recent n=2 failure, run 039 sparse n=5 recent weight 0.08 failure as caution, ideas backlog on recency adaptation, lectures 5/13/15 on mismatch, synchronized past-history evidence, and robust mixtures","changed_files":["autoresearch.md","explanations/run_049.md","submissions/ngram_interpolated_n5_laplace03_recent_n3_w11_win16384.py"],"learned":"Max recent weight 0.11 scored 2.9731718557, worse than 0.08 but still better than 0.05. The n=3 recent-weight optimum is bracketed below 0.11; recent evidence is useful but begins to dilute main-model evidence when too heavy.","rollback_reason":"Primary metric worsened by about 0.000076 bits/symbol versus current best run 048 weight 0.08.","next_action_hint":"Prefer n=3 recent weight 0.08. If continuing, try a moderate upper-middle weight such as 0.095 or 0.10, or switch to validation/repeat to avoid overfitting."}}
{"type":"hook","stage":"after","exit_code":0,"duration_ms":41,"stdout_bytes":216,"timed_out":false}
{"type":"hook","stage":"before","exit_code":0,"duration_ms":29,"stdout_bytes":8027,"timed_out":false}
{"run":50,"commit":"684bf6d","metric":2.9730885237,"metrics":{"elapsed_seconds":7.555838,"timed_out":0,"evaluated_tokens":200000},"status":"keep","description":"Run 050 n=3 recent-window max weight 0.095","timestamp":1777578422495,"segment":0,"confidence":8.360664318252793,"asi":{"hypothesis":"If 0.08 underweights reliable n=3 recent evidence but 0.11 is too aggressive, then max recent weight 0.095 may improve while preserving the main model's long-context signal.","source":"run 048 n=3 recent weight 0.08 improvement, run 049 n=3 recent weight 0.11 failure, run 047 recent n=2 failure, ideas backlog on recency adaptation, lectures 5/13/15 on mismatch, synchronized past-history evidence, and robust mixtures","changed_files":["autoresearch.md","explanations/run_050.md","submissions/ngram_interpolated_n5_laplace03_recent_n3_w095_win16384.py"],"learned":"Max recent weight 0.095 narrowly improved to 2.9730885237, only about 0.000007 bits/symbol better than 0.08. The weight optimum is very flat around 0.08-0.095 and likely within public-practice noise; avoid more fine weight tuning without validation.","next_focus":"Stop narrow recent-weight tuning. Prefer train-derived validation/repeat of the w095 and w08 candidates, or a qualitatively different change such as recent-window length for n=3."}}
{"type":"hook","stage":"after","exit_code":0,"duration_ms":42,"stdout_bytes":216,"timed_out":false}
{"type":"hook","stage":"before","exit_code":0,"duration_ms":38,"stdout_bytes":8165,"timed_out":false}
{"run":51,"commit":"684bf6d","metric":2.9737838917,"metrics":{"elapsed_seconds":7.784543,"timed_out":0,"evaluated_tokens":200000},"status":"discard","description":"Run 051 n=3 recent weight 0.095 window 8192","timestamp":1777578522922,"segment":0,"confidence":8.33804624269597,"asi":{"hypothesis":"If useful recent regimes are shorter than 16384 and n=3 contexts are reliable enough, window 8192 should improve by adapting more locally; otherwise it will add noise.","source":"run 050 flat recent weight 0.095 improvement, runs 046-047 recent order bracket at n=3, run 041 n=5 window 16384 vs 8192 context as caution, ideas backlog on recency adaptation, lectures 5/13/15 on mismatch, synchronized past-history evidence, and robust mixtures","changed_files":["autoresearch.md","explanations/run_051.md","submissions/ngram_interpolated_n5_laplace03_recent_n3_w095_win8192.py"],"learned":"Window 8192 scored 2.9737838917, much worse than window 16384 for n=3 at weight 0.095. Even with lower recent order, the recent component needs the broader 16384-symbol window; shortening overfits local noise.","rollback_reason":"Primary metric worsened by about 0.000695 bits/symbol versus current best run 050 window 16384.","next_action_hint":"Keep n=3 recent weight 0.095 window 16384. Avoid shorter recent windows; if bracketing window, try broader 32768 once or prioritize validation/repeat."}}
{"type":"hook","stage":"after","exit_code":0,"duration_ms":40,"stdout_bytes":216,"timed_out":false}
{"type":"hook","stage":"before","exit_code":0,"duration_ms":38,"stdout_bytes":8165,"timed_out":false}
{"run":52,"commit":"91c8cc6","metric":2.9726531097,"metrics":{"elapsed_seconds":8.609578,"timed_out":0,"evaluated_tokens":200000},"status":"keep","description":"Run 052 n=3 recent weight 0.095 window 32768","timestamp":1777578613663,"segment":0,"confidence":8.457335271672813,"asi":{"hypothesis":"If Run 051 failed because even n=3 recent counts need more samples, then window 32768 may improve by stabilizing the recent distribution; otherwise it will dilute local-regime signal.","source":"run 050 current best n=3 weight 0.095 window 16384, run 051 window 8192 failure, run 043 n=5 window 32768 caution, ideas backlog on recency adaptation, lectures 5/13/15 on mismatch, synchronized-history evidence, and robust mixtures","changed_files":["autoresearch.md","explanations/run_052.md","submissions/ngram_interpolated_n5_laplace03_recent_n3_w095_win32768.py"],"learned":"Window 32768 improved to 2.9726531097, a sizable gain over 16384. For n=3 recent contexts at weight 0.095, the recent source is still variance-limited; broader history stabilizes local medium-short context probabilities better than the previous window.","next_focus":"Coarsely bracket broader n=3 recent windows, e.g. try 65536 once or validate/repeat; avoid returning to short-window variants."}}
{"type":"hook","stage":"after","exit_code":0,"duration_ms":40,"stdout_bytes":216,"timed_out":false}
{"type":"hook","stage":"before","exit_code":0,"duration_ms":33,"stdout_bytes":8123,"timed_out":false}
{"run":53,"commit":"a2c6152","metric":2.9724090913,"metrics":{"elapsed_seconds":8.509428,"timed_out":0,"evaluated_tokens":200000},"status":"keep","description":"Run 053 n=3 recent weight 0.095 window 65536","timestamp":1777578695926,"segment":0,"confidence":8.638444510647224,"asi":{"hypothesis":"If the recent n=3 model is still sample-limited at window 32768, then 65536 should improve by further stabilizing local probabilities; otherwise it will dilute useful local regimes.","source":"run 052 window 32768 improvement, run 051 window 8192 failure, run 050 flat recent-weight finding, ideas backlog on recency adaptation, lectures 5/13/15 on mismatch, synchronized-history evidence, and robust mixtures","changed_files":["autoresearch.md","explanations/run_053.md","submissions/ngram_interpolated_n5_laplace03_recent_n3_w095_win65536.py"],"learned":"Window 65536 improved to 2.9724090913, about 0.000244 bits/symbol better than 32768. The n=3 recent component remains sample-limited at 32768; broader recent history still adds useful stable medium-short-context adaptation.","next_focus":"Try one more broad-window bracket such as 131072, or validate/repeat because the recent window is approaching the full evaluated prefix scale."}}
{"type":"hook","stage":"after","exit_code":0,"duration_ms":39,"stdout_bytes":216,"timed_out":false}
{"type":"hook","stage":"before","exit_code":0,"duration_ms":32,"stdout_bytes":8221,"timed_out":false}
{"run":54,"commit":"1a21363","metric":2.9722786904,"metrics":{"elapsed_seconds":7.924573,"timed_out":0,"evaluated_tokens":200000},"status":"keep","description":"Run 054 n=3 recent weight 0.095 window 131072","timestamp":1777578794963,"segment":0,"confidence":8.786029444230097,"asi":{"hypothesis":"If n=3 recent counts are still sample-limited at window 65536, then 131072 should improve by further stabilizing local probabilities; otherwise it will dilute local regimes or duplicate the main model.","source":"run 053 window 65536 improvement, run 052 window 32768 improvement, run 051 short-window failure, ideas backlog on recency adaptation, lectures 5/13/15 on mismatch, synchronized-history evidence, and robust mixtures","changed_files":["autoresearch.md","explanations/run_054.md","submissions/ngram_interpolated_n5_laplace03_recent_n3_w095_win131072.py"],"learned":"Window 131072 improved to 2.9722786904, about 0.000130 bits/symbol better than 65536. The n=3 recent table still benefits from broad history, but marginal gains are shrinking and the window is near the evaluated prefix length.","next_focus":"Try a static/main mixture interpretation or one all-past n=3 online component; otherwise validate/repeat because recency is almost full-prefix now. Avoid short-window variants."}}
{"type":"hook","stage":"after","exit_code":0,"duration_ms":40,"stdout_bytes":216,"timed_out":false}
{"type":"hook","stage":"before","exit_code":0,"duration_ms":36,"stdout_bytes":7949,"timed_out":false}
{"run":55,"commit":"8abb224","metric":2.9722665972,"metrics":{"elapsed_seconds":8.128997,"timed_out":0,"evaluated_tokens":200000},"status":"keep","description":"Run 055 all-past n=3 online component","timestamp":1777578919456,"segment":0,"confidence":8.637261406807477,"asi":{"hypothesis":"If the n=3 auxiliary model is still sample-limited at window 131072, using all past test-prefix symbols via a 262144 window should improve by stabilizing low-order online probabilities; otherwise it will dilute locality or duplicate the main model.","source":"run 054 window 131072 improvement, runs 052-053 broad-window improvements, run 051 short-window failure, COMPETITION_RULES official N=200000, lectures 5/13/15 on mismatch, synchronized past-history evidence, and robust mixtures","changed_files":["autoresearch.md","explanations/run_055.md","submissions/ngram_interpolated_n5_laplace03_recent_n3_w095_win262144.py"],"learned":"Window 262144 improved only slightly to 2.9722665972, about 0.000012 bits/symbol better than 131072. The auxiliary component is effectively a test-prefix-only low-order online model; the benefit of more history is nearly saturated at the full-prefix scale.","next_focus":"Stop broad-window tuning. Consider validating/repeating the 131072/262144 candidates, or test a modest weight retune for the all-past n=3 component because its semantics changed from recency to test-only low-order adaptation."}}
{"type":"hook","stage":"after","exit_code":0,"duration_ms":43,"stdout_bytes":216,"timed_out":false}
{"type":"hook","stage":"before","exit_code":0,"duration_ms":28,"stdout_bytes":8028,"timed_out":false}
{"run":56,"commit":"b673cb9","metric":2.9720334599,"metrics":{"elapsed_seconds":8.689771,"timed_out":0,"evaluated_tokens":200000},"status":"keep","description":"Run 056 all-past n=3 online weight 0.12","timestamp":1777579039192,"segment":0,"confidence":8.63378244390782,"asi":{"hypothesis":"If Run 055 underweights the now-stable all-past n=3 component, max weight 0.12 should improve; otherwise it will dilute the main model's long-context/train evidence.","source":"run 055 all-past n=3 component saturation, runs 052-054 broad-window stabilization, run 049 high weight failure under shorter-window semantics, COMPETITION_RULES N=200000, lectures 5/13/15 on mismatch, synchronized past-history evidence, and robust mixtures","changed_files":["autoresearch.md","explanations/run_056.md","submissions/ngram_interpolated_n5_laplace03_recent_n3_w12_win262144.py"],"learned":"All-past n=3 max weight 0.12 improved to 2.9720334599, about 0.000233 bits/symbol better than weight 0.095. Once the auxiliary component uses essentially all past test-prefix symbols, it is stable enough to deserve more mixture mass than the recency-window versions.","next_focus":"Coarsely bracket all-past n=3 weight upward, e.g. 0.15, or validate/repeat; avoid returning to broad-window tuning."}}
{"type":"hook","stage":"after","exit_code":0,"duration_ms":41,"stdout_bytes":216,"timed_out":false}
{"type":"hook","stage":"before","exit_code":0,"duration_ms":32,"stdout_bytes":7992,"timed_out":false}
{"run":57,"commit":"682cd16","metric":2.9719738362,"metrics":{"elapsed_seconds":8.076668,"timed_out":0,"evaluated_tokens":200000},"status":"keep","description":"Run 057 all-past n=3 online weight 0.15","timestamp":1777579141988,"segment":0,"confidence":8.620311753743554,"asi":{"hypothesis":"If weight 0.12 still underweights the stable all-past n=3 component, weight 0.15 should improve; otherwise it will dilute the n=5 main model and worsen.","source":"run 056 all-past n=3 weight 0.12 improvement, run 055 broad-window saturation, run 049 high weight failure under shorter-window semantics, COMPETITION_RULES N=200000, lectures 5/13/15 on mismatch, synchronized past-history evidence, and robust mixtures","changed_files":["autoresearch.md","explanations/run_057.md","submissions/ngram_interpolated_n5_laplace03_recent_n3_w15_win262144.py"],"learned":"All-past n=3 max weight 0.15 improved to 2.9719738362, but only about 0.000060 bits/symbol better than 0.12. The stable low-order online component can carry more mass, but gains are shrinking; the weight optimum may be near 0.15.","next_focus":"Bracket all-past n=3 weight upward once more coarsely, e.g. 0.18 or 0.20, or validate/repeat because marginal gains are small."}}
{"type":"hook","stage":"after","exit_code":0,"duration_ms":40,"stdout_bytes":216,"timed_out":false}
{"type":"hook","stage":"before","exit_code":0,"duration_ms":42,"stdout_bytes":8200,"timed_out":false}
{"run":58,"commit":"682cd16","metric":2.9721402744,"metrics":{"elapsed_seconds":7.985581,"timed_out":0,"evaluated_tokens":200000},"status":"discard","description":"Run 058 all-past n=3 online weight 0.18","timestamp":1777579266068,"segment":0,"confidence":8.587730593674964,"asi":{"hypothesis":"If weight 0.15 still underweights the all-past n=3 online component, 0.18 should improve; if 0.15 is near optimal, 0.18 will over-weight low-order online evidence and worsen.","source":"run 057 all-past n=3 weight 0.15 small improvement, run 056 weight 0.12 improvement, run 055 broad-window saturation, COMPETITION_RULES N=200000, lectures 5/13/15 on mismatch, synchronized past-history evidence, and robust mixtures","changed_files":["autoresearch.md","explanations/run_058.md","submissions/ngram_interpolated_n5_laplace03_recent_n3_w18_win262144.py"],"learned":"All-past n=3 max weight 0.18 scored 2.9721402744, worse than 0.15. The all-past low-order online component is useful but over-weighted by 0.18; the mixture-weight optimum is bracketed near 0.15.","rollback_reason":"Primary metric worsened by about 0.000166 bits/symbol versus current best run 057 weight 0.15.","next_action_hint":"Keep all-past n=3 weight 0.15. Avoid larger weights; if continuing, try a small lower/mid bracket like 0.135 or prioritize validation/repeat to avoid public-practice overfitting."}}
{"type":"hook","stage":"after","exit_code":0,"duration_ms":47,"stdout_bytes":216,"timed_out":false}
{"type":"hook","stage":"before","exit_code":0,"duration_ms":31,"stdout_bytes":8200,"timed_out":false}
{"run":59,"commit":"682cd16","metric":2.9722374796,"metrics":{"elapsed_seconds":8.710676,"timed_out":0,"evaluated_tokens":200000},"status":"discard","description":"Run 059 all-past n=4 online component weight 0.15","timestamp":1777579429707,"segment":0,"confidence":9.006630403847828,"asi":{"hypothesis":"If full-prefix online history stabilizes n=4 context estimates, an all-past n=4 auxiliary component at weight 0.15 should beat the current all-past n=3 best; otherwise it will underperform due to noisier online-only contexts.","source":"run 057 all-past n=3 weight 0.15 current best, run 058 weight 0.18 over-weighting, runs 052-055 broad-window stabilization, runs 044/046 recent-order evidence, COMPETITION_RULES N=200000, lectures 5/13/15 on mismatch, shared past-history evidence, and robust mixtures","changed_files":["autoresearch.md","explanations/run_059.md","submissions/ngram_interpolated_n5_laplace03_recent_n4_w15_win262144.py"],"learned":"All-past n=4 online component at weight 0.15 scored 2.9722374796, worse than all-past n=3 at 0.15. Even with full-prefix counts, the auxiliary online-only component is still variance-limited or redundant at n=4; n=3 remains the best auxiliary order.","rollback_reason":"Primary metric worsened by about 0.000264 bits/symbol versus current best run 057 all-past n=3 weight 0.15.","next_action_hint":"Keep all-past n=3 weight 0.15. Avoid higher auxiliary order. If continuing, test whether a lower all-past n=4 weight such as 0.08 is worthwhile, or shift to validation/repeat or a different mixture structure."}}
{"type":"hook","stage":"after","exit_code":0,"duration_ms":40,"stdout_bytes":216,"timed_out":false}
{"type":"hook","stage":"before","exit_code":0,"duration_ms":32,"stdout_bytes":8200,"timed_out":false}
{"run":60,"commit":"a8edeef","metric":2.9719679315,"metrics":{"elapsed_seconds":8.446551,"timed_out":0,"evaluated_tokens":200000},"status":"keep","description":"Run 060 all-past n=3 online weight 0.14","timestamp":1777579602846,"segment":0,"confidence":9.32207500964876,"asi":{"hypothesis":"If the asymmetric 0.12/0.15/0.18 bracket means the all-past n=3 online mixture optimum is slightly below 0.15, then weight 0.14 should improve; otherwise it will be unchanged or worse.","source":"run 056 weight 0.12, run 057 weight 0.15, run 058 weight 0.18 over-weighting, run 059 auxiliary n=4 failure, AGENTS/COMPETITION_RULES N=200000, lectures 5/13/15 on mismatch, synchronized past-history evidence, and robust mixtures","changed_files":["autoresearch.md","explanations/run_060.md","submissions/ngram_interpolated_n5_laplace03_recent_n3_w14_win262144.py"],"learned":"All-past n=3 max weight 0.14 scored 2.9719679315, improving by about 0.0000059 bits/symbol over weight 0.15. The optimum appears extremely flat and slightly below 0.15, but the gain is tiny and should be validated/repeated before strong claims.","next_focus":"Avoid more wide upward n=3 weights and higher auxiliary order. If continuing public-practice optimization, either try one very local bracket around 0.135/0.145 or switch to a more qualitative change such as separate auxiliary smoothing or an additional small true-recent residual component."}}
{"type":"hook","stage":"after","exit_code":0,"duration_ms":40,"stdout_bytes":216,"timed_out":false}
{"type":"hook","stage":"before","exit_code":0,"duration_ms":32,"stdout_bytes":8226,"timed_out":false}
