{"run":17,"commit":"ac70c8a","metric":2.9801459465,"metrics":{"elapsed_seconds":3.900853,"timed_out":0,"evaluated_tokens":200000},"status":"discard","description":"Run 017 interpolated n=4 C=44 online weight 2","timestamp":1777574549558,"segment":0,"confidence":3.464073907438972,"asi":{"hypothesis":"Doubling online updates may adapt faster to the evaluated stream if online evidence is underweighted relative to train counts.","source":"run 006 static failure + run 015 current n=4 interpolated best + run 016 n=5 dead end + autoresearch ideas backlog + lectures 5, 13, and 15","changed_files":["autoresearch.md","explanations/run_017.md","submissions/ngram_interpolated_n4_c44_online2.py"],"learned":"Online update weight 2 scored 2.9801459465, worse than the current best 2.9792403269 though still better than baseline. Online adaptation helps versus static, but doubling each observation overweights sequential noise or recent realization details.","rollback_reason":"Primary metric worsened by about 0.000906 bits/symbol versus n=4 C=44 with unit online updates.","next_action_hint":"Do not increase online weight above 1 as a simple multiplier. If revisiting adaptation, try gentler fractional/static-online mixtures or validate on train-derived splits first."}}
{"type":"hook","stage":"after","exit_code":0,"duration_ms":44,"stdout_bytes":216,"timed_out":false}
{"type":"hook","stage":"before","exit_code":0,"duration_ms":31,"stdout_bytes":8096,"timed_out":false}
{"run":18,"commit":"4c98d21","metric":2.9773145652,"metrics":{"elapsed_seconds":3.628065,"timed_out":0,"evaluated_tokens":200000},"status":"keep","description":"Run 018 interpolated n=4 C=44 Laplace 0.5","timestamp":1777574662611,"segment":0,"confidence":4.2574078735959855,"asi":{"hypothesis":"KT-style half-count smoothing may sharpen local interpolated context estimates while lower-order mixture mass protects against rare surprises.","source":"runs 009-015 interpolation success + run 016/017 dead ends + run 005 hard-backoff Laplace 0.5 near miss + agent prior knowledge about KT/Jeffreys smoothing + lectures 5 and 15","changed_files":["autoresearch.md","explanations/run_018.md","submissions/ngram_interpolated_n4_c44_laplace05.py"],"learned":"Laplace 0.5 with n=4 C=44 improved to 2.9773145652, about 0.001926 bits/symbol better than the prior best. Interpolation makes sharper half-count local estimates useful, unlike hard-backoff where Laplace 0.5 was slightly worse.","next_focus":"Bracket smoothing around 0.5, e.g. 0.25 or 0.75, or confirm this model on train-derived validation/repeat runs before further public-practice tuning."}}
{"type":"hook","stage":"after","exit_code":0,"duration_ms":40,"stdout_bytes":216,"timed_out":false}
{"type":"hook","stage":"before","exit_code":0,"duration_ms":32,"stdout_bytes":8227,"timed_out":false}
{"run":19,"commit":"4c98d21","metric":2.9780370195,"metrics":{"elapsed_seconds":3.309805,"timed_out":0,"evaluated_tokens":200000},"status":"discard","description":"Run 019 interpolated n=4 C=44 Laplace 0.25","timestamp":1777574770007,"segment":0,"confidence":5.771089239971618,"asi":{"hypothesis":"Lowering additive smoothing from 0.5 to 0.25 may sharpen reliable local context estimates while interpolation protects rare cases.","source":"run 018 half-count smoothing improvement + run 004 very-low hard-backoff smoothing failure + run 016/017 dead ends + lectures 5 and 15 + symmetric Dirichlet prior reasoning","changed_files":["autoresearch.md","explanations/run_019.md","submissions/ngram_interpolated_n4_c44_laplace025.py"],"learned":"Additive smoothing 0.25 scored 2.9780370195, worse than 0.5 but still better than add-one. The smoothing optimum is likely near the KT/Jeffreys half-count rather than much lower; too-sharp local estimates begin to underweight surprises.","rollback_reason":"Primary metric worsened by about 0.000722 bits/symbol versus current best Laplace 0.5.","next_action_hint":"Try the upper bracket Laplace 0.75 or retune interpolation C around the Laplace 0.5 model, but avoid much smaller pseudocounts."}}
{"type":"hook","stage":"after","exit_code":0,"duration_ms":38,"stdout_bytes":216,"timed_out":false}
{"type":"hook","stage":"before","exit_code":0,"duration_ms":32,"stdout_bytes":8227,"timed_out":false}
{"run":20,"commit":"4c98d21","metric":2.9779357716,"metrics":{"elapsed_seconds":3.64684,"timed_out":0,"evaluated_tokens":200000},"status":"discard","description":"Run 020 interpolated n=4 C=44 Laplace 0.75","timestamp":1777574870545,"segment":0,"confidence":6.433112911565151,"asi":{"hypothesis":"Additive smoothing 0.75 may be a better upper bracket if half-count smoothing is slightly too sharp but add-one is too conservative.","source":"run 018 half-count improvement + run 019 lower-smoothing failure + run 015 add-one baseline for same structure + lectures 5 and 15 + symmetric Dirichlet prior reasoning","changed_files":["autoresearch.md","explanations/run_020.md","submissions/ngram_interpolated_n4_c44_laplace075.py"],"learned":"Additive smoothing 0.75 scored 2.9779357716, worse than 0.5 but better than add-one. Together with 0.25, this brackets the smoothing optimum around KT/Jeffreys half-count for the n=4 C=44 interpolated model.","rollback_reason":"Primary metric worsened by about 0.000621 bits/symbol versus current best Laplace 0.5.","next_action_hint":"Retune interpolation C for Laplace 0.5, or prioritize train-derived validation/repeat confirmation before further narrow public-practice tuning."}}
{"type":"hook","stage":"after","exit_code":0,"duration_ms":40,"stdout_bytes":216,"timed_out":false}
{"type":"hook","stage":"before","exit_code":0,"duration_ms":38,"stdout_bytes":8227,"timed_out":false}
{"run":21,"commit":"4c98d21","metric":2.977550382,"metrics":{"elapsed_seconds":3.610505,"timed_out":0,"evaluated_tokens":200000},"status":"discard","description":"Run 021 interpolated n=4 Laplace 0.5 C=56","timestamp":1777574997913,"segment":0,"confidence":8.210371655183303,"asi":{"hypothesis":"Increasing interpolation C to 56 may compensate for sharper half-count local estimates by retaining lower-order mixture mass longer.","source":"run 018 current best half-count model + runs 019/020 smoothing bracket + runs 011-015 add-one C bracket + lectures 5 and 15 on mismatch and robust mixtures","changed_files":["autoresearch.md","explanations/run_021.md","submissions/ngram_interpolated_n4_c56_laplace05.py"],"learned":"C=56 with Laplace 0.5 scored 2.9775503820, worse than C=44 but still close. The half-count model does not benefit from substantially more conservative high-order weighting; the C optimum may remain near 40-44 or slightly lower.","rollback_reason":"Primary metric worsened by about 0.000236 bits/symbol versus current best C=44 Laplace 0.5.","next_action_hint":"If retuning C further, try C=36 or C=40 with Laplace 0.5; otherwise prioritize validation/confirmation over more narrow public-practice tuning."}}
{"type":"hook","stage":"after","exit_code":0,"duration_ms":39,"stdout_bytes":216,"timed_out":false}
{"type":"hook","stage":"before","exit_code":0,"duration_ms":33,"stdout_bytes":8227,"timed_out":false}
{"run":22,"commit":"4c98d21","metric":2.9773386624,"metrics":{"elapsed_seconds":3.455034,"timed_out":0,"evaluated_tokens":200000},"status":"discard","description":"Run 022 interpolated n=4 Laplace 0.5 C=40","timestamp":1777575080442,"segment":0,"confidence":8.320153439821176,"asi":{"hypothesis":"Lowering interpolation C to 40 may trust reliable high-order contexts slightly sooner under half-count smoothing.","source":"run 018 current best + run 021 C=56 worse + add-one C=40/C=44 flat from runs 013/015 + lectures 5 and 15 on mismatch and robust mixtures","changed_files":["autoresearch.md","explanations/run_022.md","submissions/ngram_interpolated_n4_c40_laplace05.py"],"learned":"C=40 with Laplace 0.5 scored 2.9773386624, very close but slightly worse than C=44. The half-count interpolation optimum remains around C=44; both higher C=56 and lower C=40 miss by small margins.","rollback_reason":"Primary metric worsened by about 0.000024 bits/symbol versus current best C=44 Laplace 0.5.","next_action_hint":"Stop narrow C/smoothing tuning for now; prioritize train-derived validation/repeat confirmation or a qualitatively different sequential mixture such as fixed global weights or PPM-style escape."}}
{"type":"hook","stage":"after","exit_code":0,"duration_ms":39,"stdout_bytes":216,"timed_out":false}
{"type":"hook","stage":"before","exit_code":0,"duration_ms":32,"stdout_bytes":8227,"timed_out":false}
{"run":23,"commit":"7341228","metric":2.9771815925,"metrics":{"elapsed_seconds":3.716921,"timed_out":0,"evaluated_tokens":200000},"status":"keep","description":"Run 023 n=4 half-count adaptive unique-count interpolation","timestamp":1777575217745,"segment":0,"confidence":8.485530154852404,"asi":{"hypothesis":"Using continuation diversity T as context-specific interpolation uncertainty may trust concentrated high-order contexts sooner and ambiguous contexts later.","source":"run 018 current best + runs 019-022 saturated fixed smoothing/C tuning + autoresearch ideas backlog PPM-style escape + lectures 5, 13, and 15","changed_files":["autoresearch.md","explanations/run_023.md","submissions/ngram_interpolated_n4_laplace05_unique_c4.py"],"learned":"Adaptive C_eff=4*T with Laplace 0.5 improved to 2.9771815925, about 0.000133 bits/symbol better than fixed C=44. Continuation diversity is a useful uncertainty signal beyond total count alone, though the gain is small and needs validation.","next_focus":"Bracket the adaptive scale around 4, e.g. 3 or 5/6, or validate current best on train-derived splits before more public-practice tuning."}}
{"type":"hook","stage":"after","exit_code":0,"duration_ms":47,"stdout_bytes":216,"timed_out":false}
{"type":"hook","stage":"before","exit_code":0,"duration_ms":34,"stdout_bytes":8009,"timed_out":false}
{"run":24,"commit":"7341228","metric":2.9774736781,"metrics":{"elapsed_seconds":3.680708,"timed_out":0,"evaluated_tokens":200000},"status":"discard","description":"Run 024 adaptive unique-count scale 3","timestamp":1777575299907,"segment":0,"confidence":9.49166889847338,"asi":{"hypothesis":"Lowering adaptive diversity scale to 3 may trust concentrated high-order contexts sooner than run 023 scale 4.","source":"run 023 adaptive C_eff=4*T improvement + runs 019-022 saturated fixed tuning + PPM-style escape idea backlog + lectures 5, 13, and 15","changed_files":["autoresearch.md","explanations/run_024.md","submissions/ngram_interpolated_n4_laplace05_unique_c3.py"],"learned":"Adaptive scale 3 scored 2.9774736781, worse than scale 4. The run 023 model was not too cautious; smaller diversity penalty overtrusts context-specific counts.","rollback_reason":"Primary metric worsened by about 0.000292 bits/symbol versus adaptive scale 4.","next_action_hint":"Try the upper bracket scale 5 or 6 once, or validate run 023 before more public-practice scale tuning."}}
{"type":"hook","stage":"after","exit_code":0,"duration_ms":40,"stdout_bytes":216,"timed_out":false}
{"type":"hook","stage":"before","exit_code":0,"duration_ms":30,"stdout_bytes":8009,"timed_out":false}
{"run":25,"commit":"7341228","metric":2.977487694,"metrics":{"elapsed_seconds":3.594625,"timed_out":0,"evaluated_tokens":200000},"status":"discard","description":"Run 025 adaptive unique-count scale 5","timestamp":1777575400725,"segment":0,"confidence":10.084735440977871,"asi":{"hypothesis":"Increasing adaptive diversity scale to 5 may reserve more lower-order mass if run 023 scale 4 still overtrusts ambiguous contexts.","source":"run 023 adaptive C_eff=4*T improvement + run 024 scale 3 failure + PPM-style escape idea backlog + lectures 5, 13, and 15","changed_files":["autoresearch.md","explanations/run_025.md","submissions/ngram_interpolated_n4_laplace05_unique_c5.py"],"learned":"Adaptive scale 5 scored 2.9774876940, worse than scale 4 and about the same as scale 3. Scale 4 is bracketed by worse lower and upper settings; continuation-diversity scale tuning should stop for now.","rollback_reason":"Primary metric worsened by about 0.000306 bits/symbol versus adaptive scale 4.","next_action_hint":"Stop adaptive scale fine-tuning. Prioritize train-derived validation/repeat confirmation of run 023 or try a qualitatively different sequential model such as full Witten-Bell/PPM escape."}}
{"type":"hook","stage":"after","exit_code":0,"duration_ms":50,"stdout_bytes":216,"timed_out":false}
{"type":"hook","stage":"before","exit_code":0,"duration_ms":33,"stdout_bytes":8009,"timed_out":false}
{"run":26,"commit":"7341228","metric":2.9832630018,"metrics":{"elapsed_seconds":3.906558,"timed_out":0,"evaluated_tokens":200000},"status":"discard","description":"Run 026 PPM-style adaptive MLE local counts","timestamp":1777575535266,"segment":0,"confidence":9.49166889847338,"asi":{"hypothesis":"Replacing smoothed higher-order local distributions with MLE counts plus diversity-based escape may let lower-order models handle unseen symbols better.","source":"run 023 adaptive scale 4 best + runs 024/025 scale bracket failures + PPM-style escape backlog + lectures 5, 13, and 15","changed_files":["autoresearch.md","explanations/run_026.md","submissions/ngram_interpolated_n4_laplace05_unique_c4_mle.py"],"learned":"PPM-style MLE local components scored 2.9832630018, much worse than the smoothed adaptive run 023. Half-count smoothing inside higher-order local distributions remains important; escape/backoff alone does not provide enough robustness.","rollback_reason":"Primary metric worsened by about 0.006081 bits/symbol versus adaptive half-count scale 4.","next_action_hint":"Avoid unsmoothed MLE local distributions. If exploring PPM further, keep half-count local smoothing or use exclusion carefully; otherwise prioritize validation/confirmation of run 023."}}
{"type":"hook","stage":"after","exit_code":0,"duration_ms":40,"stdout_bytes":216,"timed_out":false}
{"type":"hook","stage":"before","exit_code":0,"duration_ms":32,"stdout_bytes":8009,"timed_out":false}
{"run":27,"commit":"6e65575","metric":2.9771224184,"metrics":{"elapsed_seconds":5.035593,"timed_out":0,"evaluated_tokens":200000},"status":"keep","description":"Run 027 equal mixture fixed-C and adaptive-C half-count n-gram","timestamp":1777575685450,"segment":0,"confidence":9.999245732879798,"asi":{"hypothesis":"An equal probability mixture of fixed-C44 and adaptive C_eff=4*T half-count predictors may hedge complementary calibration errors.","source":"run 018 fixed-C half-count model + run 023 adaptive continuation-diversity model + run 026 MLE local failure + lectures 5 and 15 on mismatch and robust mixture coding","changed_files":["autoresearch.md","explanations/run_027.md","submissions/ngram_interpolated_n4_laplace05_model_mix.py"],"learned":"The 50/50 model mixture improved to 2.9771224184, about 0.000059 bits/symbol better than adaptive scale 4 alone. Fixed-count and diversity-adaptive confidence schedules have complementary local calibration errors; explicit model averaging helps, at the cost of runtime rising to about 5.0s.","next_focus":"Validate or repeat the model-mixture best before tuning mixture weights. If continuing, try a coarse weight such as 0.25 fixed / 0.75 adaptive rather than many fine weights."}}
{"type":"hook","stage":"after","exit_code":0,"duration_ms":41,"stdout_bytes":216,"timed_out":false}
{"type":"hook","stage":"before","exit_code":0,"duration_ms":32,"stdout_bytes":8065,"timed_out":false}
{"run":28,"commit":"6e65575","metric":2.9771224575,"metrics":{"elapsed_seconds":4.261724,"timed_out":0,"evaluated_tokens":200000},"status":"discard","description":"Run 028 model mixture 25% fixed 75% adaptive","timestamp":1777575799196,"segment":0,"confidence":10.052117903851334,"asi":{"hypothesis":"Weighting the model mixture 25% fixed-C44 and 75% adaptive C_eff=4*T may keep the adaptive model's strength while preserving a smaller fixed-C hedge.","source":"run 027 equal model mixture best + run 023 adaptive model stronger than fixed run 018 + lectures 5 and 15 on cross-entropy mismatch and robust mixture coding","changed_files":["autoresearch.md","explanations/run_028.md","submissions/ngram_interpolated_n4_laplace05_model_mix_fixed025.py"],"learned":"The 25/75 fixed/adaptive mixture scored 2.9771224575, effectively tied with but fractionally worse than the 50/50 mixture by about 0.000000039 bits/symbol. Equal weighting remains best within numerical/noise-level resolution; the coarse weight change did not matter materially.","rollback_reason":"Primary metric did not improve over current best run 027; the difference is negligible but non-improving.","next_action_hint":"Stop public-practice mixture-weight tuning. Prioritize train-derived validation/repeat confirmation of run 027 or a new qualitatively different model."}}
{"type":"hook","stage":"after","exit_code":0,"duration_ms":40,"stdout_bytes":216,"timed_out":false}
{"type":"hook","stage":"before","exit_code":0,"duration_ms":32,"stdout_bytes":8065,"timed_out":false}
{"run":29,"commit":"0e281b8","metric":2.9766819653,"metrics":{"elapsed_seconds":5.151809,"timed_out":0,"evaluated_tokens":200000},"status":"keep","description":"Run 029 n=5 fixed/adaptive half-count model mixture","timestamp":1777575972807,"segment":0,"confidence":10.312550494989118,"asi":{"hypothesis":"The robust fixed/adaptive half-count mixture may safely use length-4 context evidence that earlier n=5 models overtrusted.","source":"run 027 current best model mixture + earlier n=5 failures with simpler confidence mechanisms + lectures 5, 13, and 15 on context evidence, mismatch, and robust mixtures","changed_files":["autoresearch.md","explanations/run_029.md","submissions/ngram_interpolated_n5_laplace05_model_mix.py"],"learned":"Extending the fixed/adaptive half-count model mixture to n=5 improved to 2.9766819653, a 0.000440 bits/symbol gain over n=4 run 027. Earlier n=5 failures were due to insufficiently robust confidence/smoothing, not necessarily useless length-4 context information.","next_focus":"Bracket n=5 model mixture details cautiously, e.g. test n=6 with the same robust mechanism or validate n=5/n=4 on train-derived splits before more public-practice tuning."}}
{"type":"hook","stage":"after","exit_code":0,"duration_ms":41,"stdout_bytes":216,"timed_out":false}
{"type":"hook","stage":"before","exit_code":0,"duration_ms":30,"stdout_bytes":8176,"timed_out":false}
{"run":30,"commit":"0e281b8","metric":2.9965394663,"metrics":{"elapsed_seconds":6.962608,"timed_out":0,"evaluated_tokens":200000},"status":"discard","description":"Run 030 n=6 fixed/adaptive half-count model mixture","timestamp":1777576059035,"segment":0,"confidence":9.817195997377725,"asi":{"hypothesis":"The robust fixed/adaptive half-count mixture may safely use length-5 context evidence if the source has memory beyond four symbols.","source":"run 029 n=5 robust mixture improvement + earlier n=5 failures explained by insufficient robustness + lectures 5, 13, and 15 on context evidence, mismatch, and robust mixtures","changed_files":["autoresearch.md","explanations/run_030.md","submissions/ngram_interpolated_n6_laplace05_model_mix.py"],"learned":"n=6 fixed/adaptive mixture scored 2.9965394663, much worse than n=5 and only slightly better than baseline. Length-5 contexts are too sparse/noisy even with robust confidence and half-count smoothing; n=5 is the useful higher-order limit for this family.","rollback_reason":"Primary metric worsened by about 0.019858 bits/symbol versus current best n=5 model mixture.","next_action_hint":"Do not increase order beyond n=5 in this family. Next try validating n=5 or retuning n=5 confidence/smoothing coarsely, not n=6+."}}
{"type":"hook","stage":"after","exit_code":0,"duration_ms":39,"stdout_bytes":216,"timed_out":false}
{"type":"hook","stage":"before","exit_code":0,"duration_ms":41,"stdout_bytes":8176,"timed_out":false}
{"run":31,"commit":"1df1743","metric":2.9754042414,"metrics":{"elapsed_seconds":5.607538,"timed_out":0,"evaluated_tokens":200000},"status":"keep","description":"Run 031 n=5 model mixture Laplace 0.4","timestamp":1777576165302,"segment":0,"confidence":10.617949668694935,"asi":{"hypothesis":"In the n=5 robust model mixture, local smoothing 0.4 may sharpen informative high-order contexts while fixed/adaptive averaging protects surprises.","source":"run 029 current best n=5 model mixture + run 030 n=6 order limit failure + n=4 smoothing bracket from runs 018-020 + lectures 5 and 15 on mismatch and robust mixtures","changed_files":["autoresearch.md","explanations/run_031.md","submissions/ngram_interpolated_n5_laplace04_model_mix.py"],"learned":"Lowering local smoothing from 0.5 to 0.4 in the n=5 model mixture improved to 2.9754042414, a sizable 0.001278 bits/symbol gain. The n=5 robust mixture benefits from sharper local distributions than the n=4 family.","next_focus":"Bracket n=5 smoothing around 0.4, e.g. try 0.3 or 0.45/0.35, while being mindful of public-practice overfitting and validating soon."}}
{"type":"hook","stage":"after","exit_code":0,"duration_ms":41,"stdout_bytes":216,"timed_out":false}
{"type":"hook","stage":"before","exit_code":0,"duration_ms":37,"stdout_bytes":8128,"timed_out":false}
