{"run":91,"commit":"3c6adb5","metric":2.9704204193,"metrics":{"elapsed_seconds":9.695354,"timed_out":0,"evaluated_tokens":200000},"status":"discard","description":"Run 091 warmup=15000 with weight=0.10","timestamp":1777582880778,"segment":0,"confidence":14.308249848334718,"asi":{"hypothesis":"With auxiliary at only 10%, faster warmup (15000) may improve over 30000.","source":"runs 061-063 old warmup bracket at higher weight","learned":"Warmup 15000 slightly worsened vs 30000 at weight 0.10. The 30000-token warmup remains near-optimal.","rollback_reason":"Primary metric worsened very slightly (0.000008) vs warmup 30000.","next_action_hint":"Warmup is confirmed around 30000. Next: consider qualitative change like PPM-style exclusion or record ideas for future work."}}
{"type":"hook","stage":"after","exit_code":0,"duration_ms":39,"stdout_bytes":216,"timed_out":false}
{"type":"hook","stage":"before","exit_code":0,"duration_ms":34,"stdout_bytes":5770,"timed_out":false}
{"run":92,"commit":"3c6adb5","metric":2.9704122304,"metrics":{"elapsed_seconds":8.191625,"timed_out":0,"evaluated_tokens":200000},"status":"discard","description":"Run 092 confirm current best (repeat — identical score)","timestamp":1777582966578,"segment":0,"confidence":14.574459220660785,"asi":{"hypothesis":"Confirm current best is deterministic and stable.","source":"run 089 best at 2.9704122304","learned":"Exact identical score (2.9704122304) confirming deterministic predictor. Score is stable.","next_action_hint":"Loop complete at 92 runs. Final predictor: n=5 alpha=0.3 mix_weight_fixed=0.85 fixed_c=60 + n=3 alpha=0.01 pure-fixed-C auxiliary at weight 0.10. Score 2.9704 bps (0.94% improvement)."}}
{"type":"hook","stage":"after","exit_code":0,"duration_ms":40,"stdout_bytes":216,"timed_out":false}
{"type":"hook","stage":"before","exit_code":0,"duration_ms":32,"stdout_bytes":5770,"timed_out":false}
{"run":93,"commit":"6d552df","metric":2.9703283463,"metrics":{"elapsed_seconds":9.69522,"timed_out":0,"evaluated_tokens":200000},"status":"keep","description":"Run 093 per-order smoothing for main model","timestamp":1777583268590,"segment":0,"confidence":13.76723438019514,"asi":{"hypothesis":"If lower-order main model contexts are dense enough for sharper smoothing, per-order alphas will improve over uniform alpha=0.3.","source":"runs 064-068 auxiliary alpha bracketing, run 036 old order-dependent smoothing, lectures 5/13/15","changed_files":["autoresearch.md","explanations/run_093.md","submissions/ngram_interpolated_n5_laplace03_perorder_recent_n3_recenta001_w10_warm30000_mix1_main085_FIXEDC60_wall262144.py"],"learned":"Per-order smoothing (alpha 0.1/0.1/0.15/0.25/0.3 for orders 0-4) improved to 2.9703283463, ~0.000084 better than uniform 0.3. The main model's low-order contexts benefit from sharper smoothing, while high-order contexts need 0.3 protection.","next_focus":"Bracket the per-order alphas coarsely: try a sharper lower-end (0.05/0.05/0.1/0.2/0.3) or smoother upper-end to see if further refinement helps."}}
{"type":"hook","stage":"after","exit_code":0,"duration_ms":49,"stdout_bytes":216,"timed_out":false}
{"type":"hook","stage":"before","exit_code":0,"duration_ms":30,"stdout_bytes":7163,"timed_out":false}
{"run":94,"commit":"71239fb","metric":2.9702796956,"metrics":{"elapsed_seconds":8.287141,"timed_out":0,"evaluated_tokens":200000},"status":"keep","description":"Run 094 sharper per-order smoothing (0.05/0.05/0.1/0.2/0.3)","timestamp":1777583361181,"segment":0,"confidence":13.439476429063184,"asi":{"hypothesis":"If lower order smoothing is still over-smoothed, sharper alphas improve.","source":"run 093 per-order smoothing","learned":"Sharper lower-end per-order smoothing improved to 2.9702796956, ~0.000049 better. Orders 0-2 can be even sharper.","next_focus":"Try (0.02, 0.02, 0.05, 0.15, 0.3) as further bracket."}}
{"type":"hook","stage":"after","exit_code":0,"duration_ms":55,"stdout_bytes":216,"timed_out":false}
{"type":"hook","stage":"before","exit_code":0,"duration_ms":30,"stdout_bytes":6581,"timed_out":false}
{"run":95,"commit":"f40d8b0","metric":2.9702684835,"metrics":{"elapsed_seconds":8.062338,"timed_out":0,"evaluated_tokens":200000},"status":"keep","description":"Run 095 sharper per-order smoothing (0.02/0.02/0.05/0.15/0.3)","timestamp":1777583419636,"segment":0,"confidence":13.7629703378107,"asi":{"hypothesis":"If still over-smoothed, 0.02/0.02/0.05 improves.","source":"runs 093-094","learned":"0.02/0.02/0.05 improved to 2.9702684835, ~0.000011 better. Low-order smoothing can approach the auxiliary's alpha=0.01.","next_focus":"Try (0.01, 0.01, 0.03, 0.12, 0.3) — match auxiliary alpha for orders 0-1."}}
{"type":"hook","stage":"after","exit_code":0,"duration_ms":59,"stdout_bytes":216,"timed_out":false}
{"type":"hook","stage":"before","exit_code":0,"duration_ms":31,"stdout_bytes":6129,"timed_out":false}
{"run":96,"commit":"f40d8b0","metric":2.9702825428,"metrics":{"elapsed_seconds":8.26002,"timed_out":0,"evaluated_tokens":200000},"status":"discard","description":"Run 096 auxiliary-matched alpha=0.01 (too sharp)","timestamp":1777583490295,"segment":0,"confidence":14.256622085297426,"asi":{"hypothesis":"If main model orders 0-1 match auxiliary alpha=0.01, improves.","source":"runs 093-095","learned":"alpha=0.01 too sharp for main low orders. Optimum at (0.02, 0.02, 0.05, 0.15, 0.3).","rollback_reason":"Worsened by ~0.000014 vs (0.02,0.02,0.05,0.15,0.3).","next_action_hint":"Per-order smoothing optimum found. Try warmup reduction with improved main model."}}
{"type":"hook","stage":"after","exit_code":0,"duration_ms":41,"stdout_bytes":216,"timed_out":false}
{"type":"hook","stage":"before","exit_code":0,"duration_ms":36,"stdout_bytes":6129,"timed_out":false}
{"run":97,"commit":"c0ccce0","metric":2.9702655552,"metrics":{"elapsed_seconds":8.622538,"timed_out":0,"evaluated_tokens":200000},"status":"keep","description":"Run 097 warmup=15000 with per-order sharp main","timestamp":1777583562045,"segment":0,"confidence":14.527922001265337,"asi":{"hypothesis":"With per-order sharper main model, warmup=15000 may work better than with uniform alpha.","source":"runs 091 and 093-095","learned":"warmup 15000 slightly improved to 2.9702655552 (~0.000003), essentially noise-level but marginally better. Combined with per-order smoothing, earlier auxiliary access is harmless.","next_focus":"Total improvement from baseline: 0.0284 bps (0.95%). Near noise-floor. Try one more axis: recent weight 0.11 with warmup 15000, then summarize."}}
{"type":"hook","stage":"after","exit_code":0,"duration_ms":43,"stdout_bytes":216,"timed_out":false}
{"type":"hook","stage":"before","exit_code":0,"duration_ms":35,"stdout_bytes":6046,"timed_out":false}
{"run":98,"commit":"c0ccce0","metric":2.9702704471,"metrics":{"elapsed_seconds":8.005442,"timed_out":0,"evaluated_tokens":200000},"status":"discard","description":"Run 098 recent weight 0.11 with warmup 15000","timestamp":1777583622449,"segment":0,"confidence":14.63853594608852,"asi":{"hypothesis":"With faster warmup, 0.11 may improve over 0.10.","source":"run 097 best","learned":"Weight 0.11 slightly worse than 0.10. Weight optimum confirmed at 0.10 even with warmup 15000 and per-order smoothing.","rollback_reason":"Worsened ~0.000005 vs 0.10.","next_action_hint":"Gains at noise floor (0.000003-0.000005). Final best: 2.9702655552 (0.95% improvement). Session summary ready."}}
{"type":"hook","stage":"after","exit_code":0,"duration_ms":40,"stdout_bytes":216,"timed_out":false}
{"type":"hook","stage":"before","exit_code":0,"duration_ms":33,"stdout_bytes":6046,"timed_out":false}
{"run":99,"commit":"eb272e4","metric":2.9701414093,"metrics":{"elapsed_seconds":8.26749,"timed_out":0,"evaluated_tokens":200000},"status":"keep","description":"Run 099 fixed_C=65 with per-order smoothing","timestamp":1777583714458,"segment":0,"confidence":14.024788790178317,"asi":{"hypothesis":"With per-order smoothing, C=65 may improve over C=60.","source":"runs 083-085 C bracket, 093-095 per-order smoothing","learned":"C=65 improved to 2.9701414093, ~0.000124 better than C=60. Per-order smoothing shifted the C optimum upward — sharper local distributions need more conservative interpolation.","next_focus":"Bracket C to 70 and 55 to find new optimum with per-order smoothing."}}
{"type":"hook","stage":"after","exit_code":0,"duration_ms":41,"stdout_bytes":216,"timed_out":false}
{"type":"hook","stage":"before","exit_code":0,"duration_ms":44,"stdout_bytes":6107,"timed_out":false}
{"run":100,"commit":"fb0cdb7","metric":2.9700868382,"metrics":{"elapsed_seconds":7.691042,"timed_out":0,"evaluated_tokens":200000},"status":"keep","description":"Run 100 fixed_C=70 bracket","timestamp":1777583776371,"segment":0,"confidence":13.432390820520174,"asi":{"hypothesis":"C=70 may improve over C=65.","source":"run 099","learned":"C=70 improved to 2.9700868382. Sharper local distributions need more conservative interpolation.","next_focus":"Bracket C=75 and C=80."}}
{"type":"hook","stage":"after","exit_code":0,"duration_ms":56,"stdout_bytes":216,"timed_out":false}
{"type":"hook","stage":"before","exit_code":0,"duration_ms":36,"stdout_bytes":4201,"timed_out":false}
{"run":101,"commit":"fb0cdb7","metric":2.9700886934,"metrics":{"elapsed_seconds":8.426018,"timed_out":0,"evaluated_tokens":200000},"status":"discard","description":"Run 101 fixed_C=75 (plateau)","timestamp":1777583841460,"segment":0,"confidence":13.34049740435925,"asi":{"hypothesis":"C=75 may improve over C=70.","source":"runs 099-100","learned":"C=75 tied/worsened vs C=70. C optimum at 70 with per-order smoothing. Per-order smoothing shifted optimum from C=60 to C=70 (+10).","rollback_reason":"Essentially tied at ~0.0000019 worse vs C=70.","next_action_hint":"C bracketing complete at C=70. Best score 2.9700868382 (1.00% improvement from baseline). All major axes explored."}}
{"type":"hook","stage":"after","exit_code":0,"duration_ms":52,"stdout_bytes":216,"timed_out":false}
{"type":"hook","stage":"before","exit_code":0,"duration_ms":31,"stdout_bytes":4201,"timed_out":false}
{"run":102,"commit":"686ba78","metric":2.9694820882,"metrics":{"elapsed_seconds":8.378004,"timed_out":0,"evaluated_tokens":200000},"status":"keep","description":"Run 102 per-order fixed_c (30,30,50,70,90)","timestamp":1777584001782,"segment":0,"confidence":13.375338519493816,"asi":{"hypothesis":"Per-order C lets dense low-order contexts trust local estimates sooner while sparse high-order borrow more.","source":"runs 083-085 uniform C, 099-101 per-order smoothing C interaction","learned":"Per-order C (30,30,50,70,90) improved to 2.9694820882, ~0.000605 better than uniform C=70. Dense orders 0-1 benefit from lower C (30 vs 70), sparse order 4 needs higher C (90).","next_focus":"Bracket to sharper per-order C: (20,20,40,60,85) and test lower bounds."}}
{"type":"hook","stage":"after","exit_code":0,"duration_ms":44,"stdout_bytes":216,"timed_out":false}
{"type":"hook","stage":"before","exit_code":0,"duration_ms":32,"stdout_bytes":5015,"timed_out":false}
{"run":103,"commit":"4027381","metric":2.9693012371,"metrics":{"elapsed_seconds":8.11995,"timed_out":0,"evaluated_tokens":200000},"status":"keep","description":"Run 103 sharper per-order C (20,20,40,60,85)","timestamp":1777584055452,"segment":0,"confidence":14.14205445451635,"asi":{"hypothesis":"If per-order C pattern is toward sharper, (20,20,40,60,85) improves.","source":"run 102","learned":"Sharper per-order C improved to 2.9693012371, ~0.000181 better. Pattern continues: lower C for dense orders.","next_focus":"Try (15,15,30,50,80)."}}
{"type":"hook","stage":"after","exit_code":0,"duration_ms":40,"stdout_bytes":216,"timed_out":false}
{"type":"hook","stage":"before","exit_code":0,"duration_ms":41,"stdout_bytes":5049,"timed_out":false}
{"run":104,"commit":"a553f56","metric":2.9692372348,"metrics":{"elapsed_seconds":8.229677,"timed_out":0,"evaluated_tokens":200000},"status":"keep","description":"Run 104 sharper per-order C (15,15,30,50,80)","timestamp":1777584116523,"segment":0,"confidence":14.931472653263734,"asi":{"hypothesis":"If per-order C trend continues, (15,15,30,50,80) improves.","source":"runs 102-103","learned":"Sharper per-order C improved to 2.9692372348. Dense orders continue benefiting from lower C.","next_focus":"Try (10,10,20,40,75)."}}
{"type":"hook","stage":"after","exit_code":0,"duration_ms":63,"stdout_bytes":216,"timed_out":false}
{"type":"hook","stage":"before","exit_code":0,"duration_ms":31,"stdout_bytes":5212,"timed_out":false}
{"run":105,"commit":"a553f56","metric":2.9693602175,"metrics":{"elapsed_seconds":8.471984,"timed_out":0,"evaluated_tokens":200000},"status":"discard","description":"Run 105 per-order C (10,10,20,40,75) too sharp","timestamp":1777584178915,"segment":0,"confidence":15.246108096947085,"asi":{"hypothesis":"If trend continues, (10,10,20,40,75) improves.","source":"runs 102-104","learned":"C=(10,10,20,40,75) reversed to 2.9693602175. Optimum at (15,15,30,50,80).","rollback_reason":"Worsened ~0.000123 vs (15,15,30,50,80).","next_action_hint":"Per-order C bracketed at (15,15,30,50,80). Next: retune auxiliary weight or main mix_weight_fixed with this architecture."}}
{"type":"hook","stage":"after","exit_code":0,"duration_ms":41,"stdout_bytes":216,"timed_out":false}
{"type":"hook","stage":"before","exit_code":0,"duration_ms":32,"stdout_bytes":5212,"timed_out":false}
{"run":106,"commit":"a553f56","metric":2.969275961,"metrics":{"elapsed_seconds":8.349659,"timed_out":0,"evaluated_tokens":200000},"status":"discard","description":"Run 106 auxiliary weight 0.08 retest","timestamp":1777584235144,"segment":0,"confidence":15.43294887166144,"asi":{"hypothesis":"With improved per-order C+alpha, weight 0.08 may beat 0.10.","source":"runs 087-090","learned":"Weight 0.08 slightly worse vs 0.10. Weight 0.10 remains optimal even with improved main model.","rollback_reason":"Worsened ~0.000039 vs 0.10.","next_action_hint":"106 experiments complete. Best: 2.9692372348 (1.03% improvement). Architecture stable."}}
{"type":"hook","stage":"after","exit_code":0,"duration_ms":41,"stdout_bytes":216,"timed_out":false}
{"type":"hook","stage":"before","exit_code":0,"duration_ms":33,"stdout_bytes":5212,"timed_out":false}
{"run":107,"commit":"a553f56","metric":2.9692677014,"metrics":{"elapsed_seconds":8.113554,"timed_out":0,"evaluated_tokens":200000},"status":"discard","description":"Run 107 sharper upper-order alpha","timestamp":1777584347366,"segment":0,"confidence":15.248315961676441,"asi":{"hypothesis":"With per-order C, sharper upper alphas may improve.","source":"runs 093-096 alpha, 102-104 per-order C","learned":"Sharper upper alphas slightly worse. Original (0.02,0.02,0.05,0.15,0.3) remains optimal even with per-order C.","rollback_reason":"Worsened ~0.000030 vs current.","next_action_hint":"107 experiments. Best: 2.9692372348 (1.03%). Architecture fully calibrated. Loop complete."}}
{"type":"hook","stage":"after","exit_code":0,"duration_ms":40,"stdout_bytes":216,"timed_out":false}
{"type":"hook","stage":"before","exit_code":0,"duration_ms":36,"stdout_bytes":5212,"timed_out":false}
{"run":108,"commit":"a553f56","metric":2.9695450175,"metrics":{"elapsed_seconds":8.923554,"timed_out":0,"evaluated_tokens":200000},"status":"discard","description":"Run 108 pure fixed-C main (mix=1.0) — adaptive-C still needed","timestamp":1777584426373,"segment":0,"confidence":15.162061629896087,"asi":{"hypothesis":"With per-order C, pure fixed-C for main model may improve over 0.85.","source":"runs 079-082, 102-104","learned":"Pure fixed-C worsened to 2.9695450175, ~0.000308 worse than 0.85. The 15% adaptive-C hedge serves a purpose that per-order C doesn't replace — diversity-based confidence is orthogonal to count-total confidence.","rollback_reason":"Worsened ~0.000308 vs current.","next_action_hint":"108 experiments. Best: 2.9692372348. All axes explored: per-order alpha+C, fixed/adaptive mixture, auxiliary component, interpolation constant, weight/warmup. Architecture converges."}}
{"type":"hook","stage":"after","exit_code":0,"duration_ms":40,"stdout_bytes":216,"timed_out":false}
{"type":"hook","stage":"before","exit_code":0,"duration_ms":41,"stdout_bytes":5212,"timed_out":false}
{"run":109,"commit":"a553f56","metric":2.9761858594,"metrics":{"elapsed_seconds":11.178459,"timed_out":0,"evaluated_tokens":200000},"status":"discard","description":"Run 109 PPM-style exclusion — actively harmful","timestamp":1777584577886,"segment":0,"confidence":15.011911986661708,"asi":{"hypothesis":"PPM exclusion improves by preventing probability dilution of high-order evidence.","source":"run 026 PPM escape failure, PPM literature","learned":"PPM exclusion worsened to 2.9761858594 (~0.00695 worse). Concentrating high-order probability mass on sparse-context seen symbols is too aggressive — the smoothed interpolation without exclusion is the correct approach for this source.","rollback_reason":"Massive worsening of ~0.00695 bps — exclusion is actively harmful, not just neutral.","next_action_hint":"109 experiments. PPM exclusion conclusively disproven. Best architecture (Run 104 at 2.9692372348) uses per-order smoothed interpolation without exclusion. Loop fully converged."}}
{"type":"hook","stage":"after","exit_code":0,"duration_ms":40,"stdout_bytes":216,"timed_out":false}
{"type":"hook","stage":"before","exit_code":0,"duration_ms":31,"stdout_bytes":5212,"timed_out":false}
{"run":110,"commit":"a553f56","metric":2.9719348294,"metrics":{"elapsed_seconds":9.352335,"timed_out":0,"evaluated_tokens":200000},"status":"discard","description":"Run 110 n=6 with per-order calibration (still too sparse)","timestamp":1777584692188,"segment":0,"confidence":15.162061629896087,"asi":{"hypothesis":"With per-order calibration, n=6 may capture additional source memory.","source":"run 030 n=6 failure, runs 102-104 per-order C","learned":"n=6 scored 2.9719, worse than n=5 (2.9692) but much better than old n=6 (2.9965). Per-order calibration reduces but doesn't eliminate the harm of sparse level-5 contexts. n=5 is the optimal context length.","rollback_reason":"Worsened ~0.00270 vs n=5.","next_action_hint":"n order conclusively bracketed at 5. No remaining simple hyperparameter axes. Consider train-derived validation for robustness check."}}
{"type":"hook","stage":"after","exit_code":0,"duration_ms":42,"stdout_bytes":216,"timed_out":false}
{"type":"hook","stage":"before","exit_code":0,"duration_ms":36,"stdout_bytes":5212,"timed_out":false}
{"run":111,"commit":"a553f56","metric":2.9694648411,"metrics":{"elapsed_seconds":10.009993,"timed_out":0,"evaluated_tokens":200000},"status":"discard","description":"Run 111 auxiliary n=4 (n=3 still optimal)","timestamp":1777584782597,"segment":0,"confidence":15.03232802650837,"asi":{"hypothesis":"With improved main model and lower weight, auxiliary n=4 may improve.","source":"run 059","learned":"Auxiliary n=4 slightly worse than n=3 even with improved main model and lower weight. n=3 remains optimal for all-past online auxiliary.","rollback_reason":"Worsened ~0.000228 vs n=3.","next_action_hint":"111 experiments. ALL axes explored and bracketed: order n, per-order alpha, per-order C, fixed/adaptive mix (both models), auxiliary weight/warmup/order, PPM exclusion. Best architecture stable at 2.9692372348. NO MORE MOVEMENTS POSSIBLE via hyperparameter tuning."}}
{"type":"hook","stage":"after","exit_code":0,"duration_ms":51,"stdout_bytes":216,"timed_out":false}
{"type":"hook","stage":"before","exit_code":0,"duration_ms":32,"stdout_bytes":5212,"timed_out":false}
{"run":112,"commit":"a553f56","metric":2.9692454214,"metrics":{"elapsed_seconds":9.422729,"timed_out":0,"evaluated_tokens":200000},"status":"discard","description":"Run 112 per-order smoothing for auxiliary (noise)","timestamp":1777585049627,"segment":0,"confidence":14.904795709178376,"asi":{"hypothesis":"Sharper auxiliary per-order smoothing improves.","source":"runs 093-096 main per-order","learned":"Auxiliary per-order smoothing scored 2.9692454 — noise-level tie with uniform 0.01. The auxiliary is already sharp enough at α=0.01 that per-order refinement adds nothing.","rollback_reason":"Noise-level (~0.000008 worse).","next_action_hint":"112 experiments. Every axis including novel ones (auxiliary per-order) exhausted. Best score 2.9692372348 is the convergence point of this architecture."}}
{"type":"hook","stage":"after","exit_code":0,"duration_ms":54,"stdout_bytes":216,"timed_out":false}
{"type":"hook","stage":"before","exit_code":0,"duration_ms":32,"stdout_bytes":5212,"timed_out":false}
{"run":113,"commit":"a553f56","metric":2.9693422652,"metrics":{"elapsed_seconds":7.983161,"timed_out":0,"evaluated_tokens":200000},"status":"discard","description":"Run 113 unique_c_scale=2.0","timestamp":1777585156812,"segment":0,"confidence":14.957603839866836,"asi":{"hypothesis":"unique_c_scale=2.0 may change adaptive-C behavior.","learned":"unique_c_scale=2.0 slightly worse than 4.0 (~0.000105). 4.0 remains reasonable.","rollback_reason":"Worsened ~0.000105 vs 4.0.","next_action_hint":"Try unique_c_scale=8.0 as upper bracket."}}
{"type":"hook","stage":"after","exit_code":0,"duration_ms":53,"stdout_bytes":216,"timed_out":false}
{"type":"hook","stage":"before","exit_code":0,"duration_ms":32,"stdout_bytes":5212,"timed_out":false}
