{"type":"config","name":"ITML Activity A sequential predictor","metricName":"bits_per_symbol","metricUnit":"","bestDirection":"lower"}
{"run":1,"commit":"2e56efe","metric":2.9986251144,"metrics":{"elapsed_seconds":1.826185,"timed_out":0,"evaluated_tokens":200000},"status":"keep","description":"Run 001 baseline official n=4 Laplace hard-backoff n-gram","timestamp":1777572681003,"segment":0,"confidence":null,"asi":{"hypothesis":"Record the official template baseline as the first machine-logged autoresearch run before changing predictors.","source":"course material + official project files + existing explanation run_001","changed_files":["autoresearch.jsonl"],"learned":"Baseline reproduced exactly at 2.9986251144 bits/symbol with full 200000 tokens and checks passed.","next_focus":"Try the first classical n-gram hyperparameter change: n=5 with Laplace=1.0 and online adaptation."}}
{"type":"hook","stage":"after","exit_code":0,"duration_ms":38,"stdout_bytes":216,"timed_out":false}
{"type":"hook","stage":"before","exit_code":0,"duration_ms":19,"stdout_bytes":2055,"timed_out":false}
{"run":2,"commit":"2e56efe","metric":3.1231208254,"metrics":{"elapsed_seconds":1.759423,"timed_out":0,"evaluated_tokens":200000},"status":"discard","description":"Run 002 n=5 Laplace=1.0 hard-backoff n-gram","timestamp":1777572770545,"segment":0,"confidence":null,"asi":{"hypothesis":"A one-symbol-longer context may reduce conditional model mismatch if source memory extends beyond the n=4 baseline.","source":"autoresearch ideas backlog + competition rules optional n=5 reference + lectures 7 and 13 on ideal code lengths/history as probability evidence","changed_files":["explanations/run_002.md","submissions/ngram_n5_laplace1.py"],"learned":"Increasing hard-backoff order from n=4 to n=5 with Laplace=1.0 worsened public-practice loss from 2.9986251144 to 3.1231208254, despite passing checks and running slightly faster. Sparse high-order contexts and/or over-smoothing dominate any extra-memory benefit.","rollback_reason":"Primary metric worsened by about 0.1245 bits/symbol versus baseline, so this candidate should not replace the official template.","next_action_hint":"Try n=5 with smaller Laplace such as 0.1 or add thresholded backoff/min_count before trusting high-order contexts."}}
{"type":"hook","stage":"after","exit_code":0,"duration_ms":40,"stdout_bytes":216,"timed_out":false}
{"type":"hook","stage":"before","exit_code":0,"duration_ms":19,"stdout_bytes":2055,"timed_out":false}
{"run":3,"commit":"2e56efe","metric":3.2288198643,"metrics":{"elapsed_seconds":1.755402,"timed_out":0,"evaluated_tokens":200000},"status":"discard","description":"Run 003 n=5 hard-backoff with Laplace 0.1","timestamp":1777572857772,"segment":0,"confidence":null,"asi":{"hypothesis":"Lowering n=5 pseudocount from 1.0 to 0.1 may reduce over-smoothing while keeping positive support.","source":"run 002 observation + autoresearch ideas backlog + lectures 5 and 13","changed_files":["autoresearch.md","explanations/run_003.md","submissions/ngram_n5_laplace01.py"],"learned":"n=5 with Laplace=0.1 worsened further to 3.2288198643, so the plain hard-backoff n=5 problem is not just over-smoothing; sparse length-4 contexts and hard context selection are likely harmful.","rollback_reason":"Primary metric was worse than both baseline and run 002, despite checks passing.","next_action_hint":"Stop plain n=5 hard-backoff sweeps for now; either tune n=4 smoothing or introduce thresholded backoff so high-order contexts require minimum support."}}
{"type":"hook","stage":"after","exit_code":0,"duration_ms":40,"stdout_bytes":216,"timed_out":false}
{"type":"hook","stage":"before","exit_code":0,"duration_ms":19,"stdout_bytes":2055,"timed_out":false}
{"run":4,"commit":"2e56efe","metric":3.0358045164,"metrics":{"elapsed_seconds":1.781356,"timed_out":0,"evaluated_tokens":200000},"status":"discard","description":"Run 004 n=4 hard-backoff with Laplace 0.1","timestamp":1777572942187,"segment":0,"confidence":null,"asi":{"hypothesis":"At the proven n=4 context order, lowering the pseudocount to 0.1 may reduce over-smoothing while preserving positive support.","source":"run 001 baseline + run 002/003 n=5 failures + autoresearch ideas backlog + lectures 5 and 7","changed_files":["autoresearch.md","explanations/run_004.md","submissions/ngram_n4_laplace01.py"],"learned":"n=4 with Laplace=0.1 worsened to 3.0358045164, so the baseline's Laplace=1.0 is not obviously too large; sharper smoothing underweights surprising symbols in public practice.","rollback_reason":"Primary metric worsened by about 0.0372 bits/symbol versus baseline, despite checks passing.","next_action_hint":"Try a gentler n=4 smoothing change such as Laplace=0.5 or test adapt_online=False; avoid very low pseudocounts for hard-backoff n-grams."}}
{"type":"hook","stage":"after","exit_code":0,"duration_ms":42,"stdout_bytes":216,"timed_out":false}
{"type":"hook","stage":"before","exit_code":0,"duration_ms":21,"stdout_bytes":2055,"timed_out":false}
{"run":5,"commit":"2e56efe","metric":3.0001517271,"metrics":{"elapsed_seconds":1.781194,"timed_out":0,"evaluated_tokens":200000},"status":"discard","description":"Run 005 n=4 hard-backoff with Laplace 0.5","timestamp":1777573026029,"segment":0,"confidence":null,"asi":{"hypothesis":"A moderate n=4 pseudocount 0.5 may reduce over-smoothing without the surprise penalty of 0.1.","source":"run 001 baseline + run 004 low-smoothing failure + autoresearch ideas backlog + lectures 5 and 7","changed_files":["autoresearch.md","explanations/run_005.md","submissions/ngram_n4_laplace05.py"],"learned":"n=4 Laplace=0.5 scored 3.0001517271, only slightly worse than baseline but still not an improvement. Laplace=1.0 remains the best tested smoothing for hard-backoff n=4.","rollback_reason":"Primary metric was worse than baseline by about 0.00153 bits/symbol, so no keep.","next_action_hint":"Try adapt_online=False to test whether online adaptation hurts, or move to thresholded n=5/min_count to address hard selection sparsity rather than more n=4 smoothing."}}
{"type":"hook","stage":"after","exit_code":0,"duration_ms":41,"stdout_bytes":216,"timed_out":false}
{"type":"hook","stage":"before","exit_code":0,"duration_ms":20,"stdout_bytes":2055,"timed_out":false}
{"run":6,"commit":"2e56efe","metric":3.010926187,"metrics":{"elapsed_seconds":1.464031,"timed_out":0,"evaluated_tokens":200000},"status":"discard","description":"Run 006 n=4 static train-only hard-backoff n-gram","timestamp":1777573129222,"segment":0,"confidence":null,"asi":{"hypothesis":"Disabling online adaptation may prevent test-prefix noise from moving the train-derived n=4 model away from the source conditional law.","source":"run 001/004/005 observations + autoresearch ideas backlog + harness update ordering + lectures 5 and 13","changed_files":["autoresearch.md","explanations/run_006.md","submissions/ngram_n4_static.py"],"learned":"Static n=4 Laplace=1.0 worsened to 3.0109261870 while running faster, so online adaptation materially improves log-loss on public practice despite its small runtime cost.","rollback_reason":"Primary metric worsened by about 0.0123 bits/symbol versus baseline, even though runtime improved.","next_action_hint":"Keep online adaptation enabled. Move to thresholded n=5/min_count or mixture/backoff variants rather than disabling updates."}}
{"type":"hook","stage":"after","exit_code":0,"duration_ms":39,"stdout_bytes":216,"timed_out":false}
{"type":"hook","stage":"before","exit_code":0,"duration_ms":19,"stdout_bytes":2055,"timed_out":false}
{"run":7,"commit":"2e56efe","metric":3.0626460725,"metrics":{"elapsed_seconds":1.811245,"timed_out":0,"evaluated_tokens":200000},"status":"discard","description":"Run 007 thresholded n=5 min_count=8 Laplace=1.0","timestamp":1777573247264,"segment":0,"confidence":null,"asi":{"hypothesis":"Require at least 8 observations before using nonzero-order contexts in n=5, so sparse high-order histories do not dominate predictions.","source":"competition rules optional ngram_threshold reference + runs 002/003 n=5 failures + run 006 adaptation result + lectures 5 and 13","changed_files":["autoresearch.md","explanations/run_007.md","submissions/ngram_threshold_n5_min8_laplace1.py"],"learned":"Thresholding all nonzero contexts at min_count=8 with n=5 Laplace=1.0 still worsened to 3.0626460725. This implementation likely backs off too aggressively at some lower orders or high-order contexts are not useful under Laplace=1.0.","rollback_reason":"Primary metric worsened versus baseline by about 0.0640 bits/symbol, despite checks passing.","next_action_hint":"Consider thresholding only the new order-4 contexts (keeping n=4 behavior unchanged) or move to mixture-of-orders so lower-order evidence is never discarded."}}
{"type":"hook","stage":"after","exit_code":0,"duration_ms":39,"stdout_bytes":216,"timed_out":false}
{"type":"hook","stage":"before","exit_code":0,"duration_ms":20,"stdout_bytes":2055,"timed_out":false}
{"run":8,"commit":"2e56efe","metric":3.0655748167,"metrics":{"elapsed_seconds":1.816222,"timed_out":0,"evaluated_tokens":200000},"status":"discard","description":"Run 008 threshold only length-4 n=5 contexts min_count=8","timestamp":1777573341333,"segment":0,"confidence":null,"asi":{"hypothesis":"Preserve baseline n=4 fallback and use length-4 contexts only when total count >=8, recovering any useful longer-memory signal without changing lower-order behavior.","source":"run 007 thresholding failure + runs 002/003 n=5 failures + competition rules optional reference + lectures 5 and 13","changed_files":["autoresearch.md","explanations/run_008.md","submissions/ngram_order4_threshold_n5_min8.py"],"learned":"Thresholding only the extra length-4 context still worsened to 3.0655748167, about the same as thresholding all nonzero orders. Length-4 hard-context estimates appear harmful on public practice even when supported by at least 8 observations.","rollback_reason":"Primary metric worsened by about 0.06695 bits/symbol versus baseline.","next_action_hint":"Stop n=5 hard/thresholded context experiments for now. Move to mixtures of orders 0..3/4 so lower-order evidence remains in the probability distribution rather than being discarded."}}
{"type":"hook","stage":"after","exit_code":0,"duration_ms":42,"stdout_bytes":216,"timed_out":false}
{"type":"hook","stage":"before","exit_code":0,"duration_ms":21,"stdout_bytes":2055,"timed_out":false}
{"run":9,"commit":"b2f1722","metric":2.9817296585,"metrics":{"elapsed_seconds":3.591695,"timed_out":0,"evaluated_tokens":200000},"status":"keep","description":"Run 009 count-dependent interpolated n=4 n-gram C=16","timestamp":1777573487761,"segment":0,"confidence":0.47388875405605196,"asi":{"hypothesis":"Recursive count-dependent interpolation over orders 0..3 can reduce hard-backoff model-order mismatch while staying close to reliable high-order counts.","source":"runs 002-008 dead ends + autoresearch ideas backlog + lectures 5, 13, and 15 on cross-entropy, recurrence evidence, and mixture universal codes","changed_files":["autoresearch.md","explanations/run_009.md","submissions/ngram_interpolated_n4_c16.py"],"learned":"Interpolated n=4 with C=16 improved public-practice loss from 2.9986251144 to 2.9817296585, a 0.0169 bits/symbol gain, while checks passed. Mixture/model averaging over context orders is the first successful direction; runtime increased to 3.59s but remains far below the 600s limit.","next_focus":"Tune the interpolation constant C around 8, 16, 32 and consider n=5 interpolated only after validating n=4 mixture robustness."}}
{"type":"hook","stage":"after","exit_code":0,"duration_ms":40,"stdout_bytes":216,"timed_out":false}
{"type":"hook","stage":"before","exit_code":0,"duration_ms":23,"stdout_bytes":4619,"timed_out":false}
{"run":10,"commit":"ad1b26f","metric":2.979464997,"metrics":{"elapsed_seconds":3.608527,"timed_out":0,"evaluated_tokens":200000},"status":"keep","description":"Run 010 interpolated n=4 n-gram C=32","timestamp":1777573614460,"segment":0,"confidence":0.4735780159511202,"asi":{"hypothesis":"A larger interpolation constant C=32 may improve calibration by retaining lower-order evidence longer than C=16.","source":"run 009 improvement + runs 002-008 dead ends + autoresearch ideas backlog + lectures 5 and 15 on mismatch and mixture universal codes","changed_files":["autoresearch.md","EXPERIMENTS.md","explanations/run_010.md","submissions/ngram_interpolated_n4_c32.py"],"learned":"Increasing interpolation constant from C=16 to C=32 improved loss further from 2.9817296585 to 2.9794649970, suggesting the model benefits from more conservative high-order weighting. Runtime stayed safe at 3.61s.","next_focus":"Try C=64 or C=24/48 to locate the interpolation optimum; later validate the best interpolated model on train-derived splits."}}
{"type":"hook","stage":"after","exit_code":0,"duration_ms":40,"stdout_bytes":216,"timed_out":false}
{"type":"hook","stage":"before","exit_code":0,"duration_ms":26,"stdout_bytes":7093,"timed_out":false}
{"run":11,"commit":"ad1b26f","metric":2.9798657316,"metrics":{"elapsed_seconds":3.420166,"timed_out":0,"evaluated_tokens":200000},"status":"discard","description":"Run 011 interpolated n=4 n-gram C=64","timestamp":1777573761065,"segment":0,"confidence":0.6168653084204224,"asi":{"hypothesis":"A larger interpolation constant C=64 may further reduce over-trust in high-order contexts after C=32 improved over C=16.","source":"run 009/010 interpolation improvements + autoresearch ideas backlog + lectures 5 and 15 on mismatch and universal mixture codes","changed_files":["autoresearch.md","EXPERIMENTS.md","explanations/run_011.md","submissions/ngram_interpolated_n4_c64.py"],"learned":"C=64 scored 2.9798657316, slightly worse than current best C=32 at 2.9794649970 but still better than baseline. The interpolation optimum is likely near C=32 rather than much larger; C=64 was also a bit faster/noisy in runtime.","rollback_reason":"Primary metric did not improve over the current best C=32 model, worsening by about 0.00040 bits/symbol.","next_action_hint":"Try intermediate constants around C=24 or C=48 to bracket the optimum, or rerun C=32 for confirmation because confidence remains low."}}
{"type":"hook","stage":"after","exit_code":0,"duration_ms":39,"stdout_bytes":216,"timed_out":false}
{"type":"hook","stage":"before","exit_code":0,"duration_ms":25,"stdout_bytes":7093,"timed_out":false}
{"run":12,"commit":"c5a5067","metric":2.9792935749,"metrics":{"elapsed_seconds":3.197505,"timed_out":0,"evaluated_tokens":200000},"status":"keep","description":"Run 012 interpolated n=4 n-gram C=48","timestamp":1777573904517,"segment":0,"confidence":0.7389825134307638,"asi":{"hypothesis":"An intermediate interpolation constant C=48 may bracket the optimum between current best C=32 and slightly worse C=64.","source":"run 010 C=32 success + run 011 C=64 bracket + autoresearch ideas backlog + lectures 5 and 15 on mismatch and universal mixture codes","changed_files":["autoresearch.md","EXPERIMENTS.md","explanations/run_012.md","submissions/ngram_interpolated_n4_c48.py"],"learned":"C=48 improved slightly over C=32, scoring 2.9792935749 versus 2.9794649970, and was faster in this run at 3.20s. The interpolation optimum is around 32-64, with C=48 current best; effect size is tiny and likely requires confirmation.","next_focus":"Try nearby constants C=40 or C=56, and rerun current best C=48/C=32 for noise confirmation before broader model changes."}}
{"type":"hook","stage":"after","exit_code":0,"duration_ms":42,"stdout_bytes":216,"timed_out":false}
{"type":"hook","stage":"before","exit_code":0,"duration_ms":32,"stdout_bytes":7984,"timed_out":false}
{"run":13,"commit":"f416e1f","metric":2.9792409029,"metrics":{"elapsed_seconds":3.047526,"timed_out":0,"evaluated_tokens":200000},"status":"keep","description":"Run 013 interpolated n=4 n-gram C=40","timestamp":1777573989726,"segment":0,"confidence":0.9293350299744968,"asi":{"hypothesis":"C=40 may improve over C=32/C=48 if the interpolation optimum lies between them.","source":"run 010 C=32, run 012 C=48, run 011 C=64 + autoresearch ideas backlog + lectures 5 and 15 on mismatch and universal mixture codes","changed_files":["autoresearch.md","EXPERIMENTS.md","explanations/run_013.md","submissions/ngram_interpolated_n4_c40.py"],"learned":"C=40 produced a tiny new best at 2.9792409029, slightly better than C=48 by about 0.000053 bits/symbol, with faster observed runtime 3.05s. The optimum appears around 40-48, but gains are well within noise and require confirmation.","next_focus":"Try C=36 or rerun C=40/C=48 for confirmation; consider consolidating interpolated predictor to avoid many duplicate files after tuning."}}
{"type":"hook","stage":"after","exit_code":0,"duration_ms":39,"stdout_bytes":216,"timed_out":false}
{"type":"hook","stage":"before","exit_code":0,"duration_ms":29,"stdout_bytes":7984,"timed_out":false}
{"run":14,"commit":"f416e1f","metric":2.9793094026,"metrics":{"elapsed_seconds":3.470488,"timed_out":0,"evaluated_tokens":200000},"status":"discard","description":"Run 014 interpolated n=4 n-gram C=36","timestamp":1777574107702,"segment":0,"confidence":0.9650160362966286,"asi":{"hypothesis":"C=36 may improve if the interpolation optimum lies between C=32 and current best C=40.","source":"run 010 C=32, run 013 C=40, run 012 C=48 + autoresearch ideas backlog + lectures 5 and 15 on mismatch and universal mixture codes","changed_files":["autoresearch.md","EXPERIMENTS.md","explanations/run_014.md","submissions/ngram_interpolated_n4_c36.py"],"learned":"C=36 scored 2.9793094026, worse than current best C=40 at 2.9792409029 and close to C=48. The local optimum is likely around C=40, but differences remain very small and need confirmation.","rollback_reason":"Primary metric worsened by about 0.0000685 bits/symbol versus current best C=40.","next_action_hint":"Try C=44 or rerun C=40 to confirm; if no clear gain, consolidate the interpolated predictor and build train-derived validation."}}
{"type":"hook","stage":"after","exit_code":0,"duration_ms":39,"stdout_bytes":216,"timed_out":false}
{"type":"hook","stage":"before","exit_code":0,"duration_ms":41,"stdout_bytes":7984,"timed_out":false}
{"run":15,"commit":"ac70c8a","metric":2.9792403269,"metrics":{"elapsed_seconds":3.224069,"timed_out":0,"evaluated_tokens":200000},"status":"keep","description":"Run 015 interpolated n=4 n-gram C=44","timestamp":1777574222471,"segment":0,"confidence":1.0027544624679245,"asi":{"hypothesis":"C=44 may improve if the local interpolation optimum lies between current best C=40 and prior C=48.","source":"run 013 C=40, run 014 C=36, run 012 C=48 + autoresearch ideas backlog + lectures 5 and 15 on mismatch and universal mixture codes","changed_files":["autoresearch.md","EXPERIMENTS.md","explanations/run_015.md","submissions/ngram_interpolated_n4_c44.py"],"learned":"C=44 scored 2.9792403269, a vanishingly small improvement over C=40 by about 0.000000576 bits/symbol. The optimum is flat/noise-dominated around C=40-44; further constant tuning is unlikely to be meaningful without repeats or validation.","next_focus":"Rerun current best C=44 or C=40 for noise confirmation, then consolidate duplicate interpolated predictors or build train-derived validation."}}
{"type":"hook","stage":"after","exit_code":0,"duration_ms":45,"stdout_bytes":216,"timed_out":false}
{"type":"hook","stage":"before","exit_code":0,"duration_ms":30,"stdout_bytes":8096,"timed_out":false}
{"run":16,"commit":"ac70c8a","metric":2.9848362778,"metrics":{"elapsed_seconds":4.42235,"timed_out":0,"evaluated_tokens":200000},"status":"discard","description":"Run 016 interpolated n=5 n-gram C=44","timestamp":1777574383087,"segment":0,"confidence":1.5553298887246139,"asi":{"hypothesis":"Soft interpolation may use length-4 context evidence safely, unlike hard/thresholded n=5, while preserving lower-order mass.","source":"run 015 current n=4 interpolated best + runs 002/003/007/008 n=5 hard failures + autoresearch ideas backlog + lectures 5, 13, and 15","changed_files":["autoresearch.md","EXPERIMENTS.md","explanations/run_016.md","submissions/ngram_interpolated_n5_c44.py"],"learned":"Interpolated n=5 with C=44 scored 2.9848362778, much worse than n=4 C=44 but still better than baseline. Adding length-4 contexts hurts even under soft interpolation; order-4 information appears noisy/mismatched for public practice.","rollback_reason":"Primary metric worsened by about 0.005596 bits/symbol versus current best n=4 C=44, and runtime increased to 4.42s.","next_action_hint":"Stay with n=4 interpolated models. Next useful step is confirmation/validation or consolidation rather than more n=5 context experiments."}}
{"type":"hook","stage":"after","exit_code":0,"duration_ms":39,"stdout_bytes":216,"timed_out":false}
{"type":"hook","stage":"before","exit_code":0,"duration_ms":40,"stdout_bytes":8096,"timed_out":false}
