{"run":32,"commit":"4b02c7a","metric":2.9749371262,"metrics":{"elapsed_seconds":5.536341,"timed_out":0,"evaluated_tokens":200000},"status":"keep","description":"Run 032 n=5 model mixture Laplace 0.3","timestamp":1777576275915,"segment":0,"confidence":10.870782911532288,"asi":{"hypothesis":"Further lowering n=5 model-mixture local smoothing to 0.3 may sharpen informative high-order contexts if model averaging protects rare outcomes.","source":"run 031 smoothing 0.4 improvement + run 030 n=6 limit failure + n=4 smoothing bracket + lectures 5 and 15 on mismatch and robust mixtures","changed_files":["autoresearch.md","explanations/run_032.md","submissions/ngram_interpolated_n5_laplace03_model_mix.py"],"learned":"Lowering n=5 model-mixture smoothing to 0.3 improved to 2.9749371262, another 0.000467 bits/symbol gain. The robust n=5 mixture continues to benefit from sharper local distributions, but lower smoothing increases risk of underweighting surprises and should be bracketed cautiously.","next_focus":"Try a lower bracket such as Laplace 0.2 or an intermediate 0.25, then validate/repeat the best to avoid overfitting public practice."}}
{"type":"hook","stage":"after","exit_code":0,"duration_ms":42,"stdout_bytes":216,"timed_out":false}
{"type":"hook","stage":"before","exit_code":0,"duration_ms":38,"stdout_bytes":8194,"timed_out":false}
{"run":33,"commit":"4b02c7a","metric":2.9759198844,"metrics":{"elapsed_seconds":5.183017,"timed_out":0,"evaluated_tokens":200000},"status":"discard","description":"Run 033 n=5 model mixture Laplace 0.2","timestamp":1777576379867,"segment":0,"confidence":10.910308952856388,"asi":{"hypothesis":"Lowering n=5 model-mixture smoothing to 0.2 may further sharpen informative contexts if mixture backoff protects surprises.","source":"run 032 smoothing 0.3 improvement + run 031 smoothing 0.4 improvement + run 030 n=6 limit failure + lectures 5 and 15 on mismatch and robust mixtures","changed_files":["autoresearch.md","explanations/run_033.md","submissions/ngram_interpolated_n5_laplace02_model_mix.py"],"learned":"Laplace 0.2 scored 2.9759198844, worse than 0.3 and 0.4. The n=5 smoothing optimum is bracketed between 0.2 and 0.4, with 0.3 current best; too little smoothing underweights surprises in sparse high-order contexts.","rollback_reason":"Primary metric worsened by about 0.000983 bits/symbol versus current best Laplace 0.3.","next_action_hint":"If continuing smoothing, try intermediate 0.25 or 0.35 once; otherwise validate/repeat n=5 Laplace 0.3."}}
{"type":"hook","stage":"after","exit_code":0,"duration_ms":38,"stdout_bytes":216,"timed_out":false}
{"type":"hook","stage":"before","exit_code":0,"duration_ms":34,"stdout_bytes":8194,"timed_out":false}
{"run":34,"commit":"4b02c7a","metric":2.9752131102,"metrics":{"elapsed_seconds":6.334009,"timed_out":0,"evaluated_tokens":200000},"status":"discard","description":"Run 034 n=5 diversity-dependent smoothing model mixture","timestamp":1777576525770,"segment":0,"confidence":10.282940626428523,"asi":{"hypothesis":"Diversity-dependent smoothing may keep sharp estimates for low-diversity contexts while avoiding the global Laplace 0.2 surprise penalty in high-diversity contexts.","source":"run 032 Laplace 0.3 best, run 033 Laplace 0.2 worse, runs 023-025 continuation-diversity signal, lectures 5 and 15 on mismatch and robust mixtures","changed_files":["autoresearch.md","explanations/run_034.md","submissions/ngram_interpolated_n5_diversity_laplace_model_mix.py"],"learned":"The diversity-dependent smoothing formula scored 2.9752131102: better than global 0.2 but worse than global 0.3. Continuation diversity alone is not enough to choose smoothing; it likely sharpens sparse low-diversity contexts too much or over-smooths genuinely useful high-diversity contexts.","rollback_reason":"Primary metric worsened by about 0.000276 bits/symbol versus current best global Laplace 0.3.","next_action_hint":"Prefer current n=5 Laplace 0.3. If continuing, try one conservative smoothing ensemble such as mixing alpha 0.3 with alpha 0.4, or move to train-derived validation rather than more scalar tuning."}}
{"type":"hook","stage":"after","exit_code":0,"duration_ms":42,"stdout_bytes":216,"timed_out":false}
{"type":"hook","stage":"before","exit_code":0,"duration_ms":33,"stdout_bytes":8194,"timed_out":false}
{"run":35,"commit":"4b02c7a","metric":2.9750329918,"metrics":{"elapsed_seconds":9.582717,"timed_out":0,"evaluated_tokens":200000},"status":"discard","description":"Run 035 n=5 smoothing ensemble alpha 0.3 and 0.4","timestamp":1777576629761,"segment":0,"confidence":9.518004982088375,"asi":{"hypothesis":"A 50/50 smoothing ensemble over alpha 0.3 and alpha 0.4 may hedge calibration errors while preserving the current best sharper model.","source":"run 032 alpha 0.3 current best, run 031 alpha 0.4 close, run 033 alpha 0.2 too sharp, run 034 adaptive smoothing worse, lectures 5 and 15 on mismatch and universal mixtures","changed_files":["autoresearch.md","explanations/run_035.md","submissions/ngram_interpolated_n5_laplace0304_ensemble.py"],"learned":"The alpha 0.3/0.4 ensemble scored 2.9750329918, slightly worse than alpha 0.3 alone. The conservative alpha 0.4 component dilutes the best model more than it protects against surprises on this benchmark, and runtime nearly doubles to 9.6s.","rollback_reason":"Primary metric worsened by about 0.000096 bits/symbol versus current best alpha 0.3.","next_action_hint":"Prefer the simple n=5 alpha 0.3 fixed/adaptive mixture. Further public-practice smoothing/model-ensemble tuning has diminishing returns; prioritize train-derived validation or a qualitatively different online adaptation idea."}}
{"type":"hook","stage":"after","exit_code":0,"duration_ms":41,"stdout_bytes":216,"timed_out":false}
{"type":"hook","stage":"before","exit_code":0,"duration_ms":39,"stdout_bytes":8194,"timed_out":false}
{"run":36,"commit":"4b02c7a","metric":2.975546627,"metrics":{"elapsed_seconds":6.052972,"timed_out":0,"evaluated_tokens":200000},"status":"discard","description":"Run 036 n=5 order-dependent smoothing model mixture","timestamp":1777576817157,"segment":0,"confidence":9.385668764496407,"asi":{"hypothesis":"Using half-count smoothing for lower-order models and alpha 0.3 only for order-4 contexts may preserve n=4 calibration while keeping sharper n=5 signal.","source":"runs 018-022 n=4 half-count optimum, runs 031-033 n=5 global alpha bracket, runs 034-035 failed adaptive/ensemble smoothing, lectures 5/13/15 on mismatch, repeated histories, and robust mixtures","changed_files":["autoresearch.md","explanations/run_036.md","submissions/ngram_interpolated_n5_order_smoothing_model_mix.py"],"learned":"Order-dependent smoothing scored 2.9755466270, worse than global alpha 0.3. The n=5 improvement is not isolated to order-4 smoothing; sharpening lower/intermediate orders or maintaining a consistent alpha across the recursive mixture appears important.","rollback_reason":"Primary metric worsened by about 0.000609 bits/symbol versus current best global alpha 0.3.","next_action_hint":"Avoid further smoothing tweaks. Prefer current n=5 alpha 0.3 model, then explore qualitatively different online adaptation/recency or build train-derived validation."}}
{"type":"hook","stage":"after","exit_code":0,"duration_ms":42,"stdout_bytes":216,"timed_out":false}
{"type":"hook","stage":"before","exit_code":0,"duration_ms":33,"stdout_bytes":8194,"timed_out":false}
{"run":37,"commit":"4b02c7a","metric":0,"metrics":{"elapsed_seconds":0.3,"timed_out":0,"evaluated_tokens":0},"status":"crash","description":"Run 037 recent-window online mixture crash due dataclass import issue","timestamp":1777576963232,"segment":0,"confidence":9.385668764496407,"asi":{"hypothesis":"A small ramped recent-window online model mixed into the current best n=5 alpha 0.3 predictor may capture local realization-specific structure.","source":"run 036 next hint to explore recency, runs 006/017 online adaptation evidence, ideas backlog recency-window adaptation, lectures 5/13/15","changed_files":["autoresearch.md","explanations/run_037.md","submissions/ngram_interpolated_n5_laplace03_recent_mix.py"],"learned":"The predictor did not import because a local @dataclass(slots=True) in a module loaded via importlib.util.module_from_spec triggered a Python dataclasses sys.modules lookup error before evaluation. The modeling idea was not tested.","rollback_reason":"Crash before benchmark; no valid bits_per_symbol or evaluated tokens.","next_action_hint":"Retry the same recent-window hypothesis without dataclasses, e.g. use a simple slotted/manual count class or plain lists/dicts."}}
{"type":"hook","stage":"after","exit_code":0,"duration_ms":41,"stdout_bytes":216,"timed_out":false}
{"type":"hook","stage":"before","exit_code":0,"duration_ms":32,"stdout_bytes":8194,"timed_out":false}
{"run":38,"commit":"2ac6ec3","metric":2.9740425033,"metrics":{"elapsed_seconds":9.773246,"timed_out":0,"evaluated_tokens":200000},"status":"keep","description":"Run 038 n=5 alpha 0.3 with ramped recent-window mixture","timestamp":1777577081491,"segment":0,"confidence":9.608732049449811,"asi":{"hypothesis":"A small ramped recent-window online model mixed into the current best n=5 alpha 0.3 predictor may capture local realization-specific structure without dominating the train+online model.","source":"run 037 crash retry without dataclasses; run 036 next hint to explore recency; runs 006/017 online adaptation evidence; autoresearch ideas backlog; lectures 5/13/15 on mismatch, recent repeated history, and universal mixtures","changed_files":["autoresearch.md","explanations/run_038.md","submissions/ngram_interpolated_n5_laplace03_recent_mix.py"],"learned":"The recent-window mixture improved to 2.9740425033, about 0.000895 bits/symbol better than the prior best. A small separate online-only window captures useful local structure that cumulative train+online counts miss, unlike global online overweighting.","next_focus":"Bracket the recency mechanism coarsely: try smaller recent weight/window or a weight 0.03/0.08, but avoid excessive public-practice tuning; validate the recency gain soon."}}
{"type":"hook","stage":"after","exit_code":0,"duration_ms":41,"stdout_bytes":216,"timed_out":false}
{"type":"hook","stage":"before","exit_code":0,"duration_ms":37,"stdout_bytes":8214,"timed_out":false}
{"run":39,"commit":"2ac6ec3","metric":2.974284289,"metrics":{"elapsed_seconds":10.139689,"timed_out":0,"evaluated_tokens":200000},"status":"discard","description":"Run 039 recent-window mixture max weight 0.08","timestamp":1777577176833,"segment":0,"confidence":8.462501528243692,"asi":{"hypothesis":"If the Run 038 recent component was underweighted, raising the ramped max recent weight from 0.05 to 0.08 should improve; otherwise it will overfit short-window noise.","source":"run 038 recent-window improvement; runs 033-036 smoothing saturation; run 017 global online overweighting failure; lectures 5/13/15 on mismatch, recent repeated history, and universal mixtures","changed_files":["autoresearch.md","explanations/run_039.md","submissions/ngram_interpolated_n5_laplace03_recent_mix_w08.py"],"learned":"Max recent weight 0.08 scored 2.9742842890, worse than the 0.05 recent mixture but still better than the pre-recency model. The recency signal is real but too much recent-window mass overfits local noise.","rollback_reason":"Primary metric worsened by about 0.000242 bits/symbol versus current best max recent weight 0.05.","next_action_hint":"Try a lower weight bracket such as 0.03 or keep 0.05 and vary window size coarsely; avoid increasing recency weight further without validation."}}
{"type":"hook","stage":"after","exit_code":0,"duration_ms":39,"stdout_bytes":216,"timed_out":false}
{"type":"hook","stage":"before","exit_code":0,"duration_ms":40,"stdout_bytes":8214,"timed_out":false}
{"run":40,"commit":"2ac6ec3","metric":2.9741829201,"metrics":{"elapsed_seconds":10.091164,"timed_out":0,"evaluated_tokens":200000},"status":"discard","description":"Run 040 recent-window mixture max weight 0.03","timestamp":1777577272445,"segment":0,"confidence":9.870978610801393,"asi":{"hypothesis":"If the Run 038 5% recent mixture was too aggressive, lowering the ramped max recent weight to 0.03 should improve; otherwise it will underuse local structure.","source":"run 038 recent-window improvement; run 039 weight 0.08 worse; run 017 online overweighting failure; lectures 5/13/15 on mismatch, recent repeated history, and universal mixtures","changed_files":["autoresearch.md","explanations/run_040.md","submissions/ngram_interpolated_n5_laplace03_recent_mix_w03.py"],"learned":"Max recent weight 0.03 scored 2.9741829201, worse than 0.05 but better than 0.08 and pre-recency. The useful recent-window weight is bracketed around 0.05; both less and more recent mass reduce performance.","rollback_reason":"Primary metric worsened by about 0.000140 bits/symbol versus current best max recent weight 0.05.","next_action_hint":"Keep recent weight 0.05. Coarsely vary window size next, e.g. 4096 or 16384, rather than further weight tuning."}}
{"type":"hook","stage":"after","exit_code":0,"duration_ms":42,"stdout_bytes":216,"timed_out":false}
{"type":"hook","stage":"before","exit_code":0,"duration_ms":34,"stdout_bytes":8214,"timed_out":false}
{"run":41,"commit":"25be18e","metric":2.9739917554,"metrics":{"elapsed_seconds":12.098904,"timed_out":0,"evaluated_tokens":200000},"status":"keep","description":"Run 041 recent-window mixture window 16384","timestamp":1777577363035,"segment":0,"confidence":9.810329816506812,"asi":{"hypothesis":"If the 8192 recent window is too noisy, doubling it to 16384 with the same 0.05 recent weight should stabilize local context estimates and improve log-loss.","source":"run 038 recent-window improvement, runs 039-040 bracketing weight around 0.05, run 039 too much recent mass overfits, lectures 5/13/15 on mismatch, repeated history, and robust mixtures","changed_files":["autoresearch.md","explanations/run_041.md","submissions/ngram_interpolated_n5_laplace03_recent_mix_win16384.py"],"learned":"Window 16384 improved slightly to 2.9739917554, about 0.000051 bits/symbol better than window 8192. A broader recent window reduces variance or better matches local regime length, but the gain is small; validate/repeat before fine window tuning.","next_focus":"Try one opposite coarse window bracket such as 4096 or validate/repeat the recency model; avoid narrow window tuning unless effects are decisive."}}
{"type":"hook","stage":"after","exit_code":0,"duration_ms":40,"stdout_bytes":216,"timed_out":false}
{"type":"hook","stage":"before","exit_code":0,"duration_ms":39,"stdout_bytes":8177,"timed_out":false}
{"run":42,"commit":"25be18e","metric":2.974243621,"metrics":{"elapsed_seconds":10.242123,"timed_out":0,"evaluated_tokens":200000},"status":"discard","description":"Run 042 recent-window mixture window 4096","timestamp":1777577454257,"segment":0,"confidence":9.730620239095758,"asi":{"hypothesis":"If useful local regimes are shorter than 8192, a 4096 window with max weight 0.05 should adapt faster; otherwise it will be too noisy for n=5 contexts.","source":"run 038 window 8192 improvement, run 041 window 16384 slight improvement, runs 039-040 recency weight bracket, lectures 5/13/15 on mismatch, recent repeated history, and robust mixtures","changed_files":["autoresearch.md","explanations/run_042.md","submissions/ngram_interpolated_n5_laplace03_recent_mix_win4096.py"],"learned":"Window 4096 scored 2.9742436210, worse than 8192 and 16384. The recent component needs more samples than 4096 symbols for reliable n=5 context estimates; the current best window 16384 remains best but the gain over 8192 is tiny.","rollback_reason":"Primary metric worsened by about 0.000252 bits/symbol versus current best window 16384.","next_action_hint":"Prefer window 16384. Consider one broader upper bracket such as 32768 or validation/repeat before further public-practice window tuning."}}
{"type":"hook","stage":"after","exit_code":0,"duration_ms":40,"stdout_bytes":216,"timed_out":false}
{"type":"hook","stage":"before","exit_code":0,"duration_ms":33,"stdout_bytes":8177,"timed_out":false}
{"run":43,"commit":"25be18e","metric":2.974019005,"metrics":{"elapsed_seconds":9.771333,"timed_out":0,"evaluated_tokens":200000},"status":"discard","description":"Run 043 recent-window mixture window 32768","timestamp":1777577565422,"segment":0,"confidence":9.987503132832222,"asi":{"hypothesis":"If the recent model is still variance-limited at window 16384, then a broader window 32768 with the same 0.05 recent weight should improve; otherwise it will dilute locality.","source":"run 041 window 16384 slight improvement, run 042 window 4096 too noisy, runs 039-040 recency weight bracket, lectures 5/13/15 on mismatch, repeated history, and robust mixtures","changed_files":["autoresearch.md","explanations/run_043.md","submissions/ngram_interpolated_n5_laplace03_recent_mix_win32768.py"],"learned":"Window 32768 scored 2.9740190050, worse than 16384 but better than 8192/4096. The window optimum in this family is bracketed around 16384; making the recent model too broad starts diluting useful local structure.","rollback_reason":"Primary metric worsened by about 0.000027 bits/symbol versus current best window 16384.","next_action_hint":"Prefer window 16384. Stop public-practice window tuning and validate/repeat the recency model or try a qualitatively different recency schedule."}}
{"type":"hook","stage":"after","exit_code":0,"duration_ms":40,"stdout_bytes":216,"timed_out":false}
{"type":"hook","stage":"before","exit_code":0,"duration_ms":38,"stdout_bytes":8177,"timed_out":false}
{"run":44,"commit":"898bc3c","metric":2.9737102858,"metrics":{"elapsed_seconds":9.299502,"timed_out":0,"evaluated_tokens":200000},"status":"keep","description":"Run 044 n=5 main with n=4 recent-window component","timestamp":1777577723376,"segment":0,"confidence":9.897086514438607,"asi":{"hypothesis":"The cumulative main model can afford n=5, but the sliding recent table may be variance-limited; using n=4 for the recent component at window 16384 and weight 0.05 may produce more reliable local probabilities.","source":"run 041 best recent window 16384, runs 042-043 window brackets, earlier n=5 sparsity failures, lectures 5/13/15 on mismatch, repeated history, and robust mixtures","changed_files":["autoresearch.md","explanations/run_044.md","submissions/ngram_interpolated_n5_laplace03_recent_n4_win16384.py"],"learned":"Using an n=4 recent-window component improved to 2.9737102858, about 0.000281 bits/symbol better than the n=5 recent component. The recent model is variance-limited; lower recent order gives more reliable local adaptation while the main n=5 model keeps longer-context signal.","next_focus":"Bracket recent component order/smoothing conservatively, e.g. try recent n=3 or adjust recent smoothing/window, but validate soon because recency tuning is now public-practice sensitive."}}
{"type":"hook","stage":"after","exit_code":0,"duration_ms":39,"stdout_bytes":216,"timed_out":false}
{"type":"hook","stage":"before","exit_code":0,"duration_ms":37,"stdout_bytes":8224,"timed_out":false}
{"run":45,"commit":"898bc3c","metric":2.9738223892,"metrics":{"elapsed_seconds":9.373034,"timed_out":0,"evaluated_tokens":200000},"status":"discard","description":"Run 045 n=4 recent component with recent smoothing 0.5","timestamp":1777577859210,"segment":0,"confidence":9.832294821700916,"asi":{"hypothesis":"If the n=4 recent-window component from run 044 is still too sharp for sliding-window counts, increasing only recent smoothing to 0.5 while keeping the main model at alpha 0.3 should improve.","source":"run 044 n=4 recent improvement, runs 018-022 n=4 half-count optimum, runs 031-033 n=5 main alpha 0.3 bracket, lectures 5/13/15 on mismatch, repeated history, and robust mixtures","changed_files":["autoresearch.md","explanations/run_045.md","submissions/ngram_interpolated_n5_laplace03_recent_n4_laplace05_win16384.py"],"learned":"Recent-only smoothing 0.5 scored 2.9738223892, worse than the run 044 recent alpha 0.3 model. Even though the recent table is variance-limited in context order, the n=4 recent local distributions still prefer the sharper alpha 0.3 calibration.","rollback_reason":"Primary metric worsened by about 0.000112 bits/symbol versus current best run 044.","next_action_hint":"Keep recent n=4, alpha 0.3, window 16384. If bracketing recent order, try recent n=3 once; otherwise prioritize validation/repeat of run 044."}}
{"type":"hook","stage":"after","exit_code":0,"duration_ms":39,"stdout_bytes":216,"timed_out":false}
{"type":"hook","stage":"before","exit_code":0,"duration_ms":34,"stdout_bytes":8224,"timed_out":false}
{"run":46,"commit":"4dfa819","metric":2.9734028461,"metrics":{"elapsed_seconds":8.1248,"timed_out":0,"evaluated_tokens":200000},"status":"keep","description":"Run 046 n=5 main with n=3 recent-window component","timestamp":1777577967170,"segment":0,"confidence":9.888883683075612,"asi":{"hypothesis":"If the n=4 recent model is still sparse, lowering only the recent component to n=3 while keeping the main cumulative model at n=5 should improve by reducing recent-window variance.","source":"run 044 n=4 recent improvement, run 045 recent smoothing failure, earlier n=5 sparsity failures, lectures 5/13/15 on mismatch, finite-history recurrence evidence, and robust mixtures","changed_files":["autoresearch.md","explanations/run_046.md","submissions/ngram_interpolated_n5_laplace03_recent_n3_win16384.py"],"learned":"Recent n=3 improved to 2.9734028461, about 0.000307 bits/symbol better than recent n=4 and faster. The best recent model is shorter-context than expected; sliding-window counts are strongly variance-limited and medium-short local adaptation is more reliable.","next_focus":"Bracket recent order once more with n=2 or validate/repeat run 046; avoid over-tuning public practice without train-derived validation."}}
