{"run":114,"commit":"a553f56","metric":2.9692732071,"metrics":{"elapsed_seconds":8.466362,"timed_out":0,"evaluated_tokens":200000},"status":"discard","description":"Run 114 unique_c_scale=8.0 (4.0 optimal)","timestamp":1777585212104,"segment":0,"confidence":15.010787502604735,"asi":{"hypothesis":"unique_c_scale=8.0 complete bracket.","learned":"unique_c_scale=4.0 optimal, bracketed by 2.0 and 8.0. This was the LAST untuned parameter. 114 experiments complete.","rollback_reason":"Worsened ~0.000036 vs 4.0.","next_action_hint":"LOOP COMPLETE. 114 experiments. ALL parameters bracketed. Best: 2.9692372348 at run 104. No further hyperparameter tuning possible — gains are now solely in architectural changes (CTW, skip-grams, etc.)."}}
{"type":"hook","stage":"after","exit_code":0,"duration_ms":42,"stdout_bytes":216,"timed_out":false}
{"type":"hook","stage":"before","exit_code":0,"duration_ms":34,"stdout_bytes":5212,"timed_out":false}
{"run":115,"commit":"f37aaf1","metric":2.9692309988,"metrics":{"elapsed_seconds":8.699094,"timed_out":0,"evaluated_tokens":200000},"status":"keep","description":"Run 115 main mix_weight_fixed=0.80 (re-test after per-order C)","timestamp":1777585369081,"segment":0,"confidence":15.314127552729648,"asi":{"hypothesis":"With per-order C, 0.80 may improve over 0.85.","source":"runs 079-082 old bracket, run 108","learned":"mix_weight_fixed=0.80 improved marginally to 2.9692309988. Per-order C shifted the fixed/adaptive optimum slightly lower — some adaptive-C diversity weighting now complements per-order interpolation.","next_focus":"Bracket to 0.78 and 0.82 to find new optimum."}}
{"type":"hook","stage":"after","exit_code":0,"duration_ms":42,"stdout_bytes":216,"timed_out":false}
{"type":"hook","stage":"before","exit_code":0,"duration_ms":36,"stdout_bytes":5571,"timed_out":false}
{"run":116,"commit":"f37aaf1","metric":2.9692408321,"metrics":{"elapsed_seconds":8.478678,"timed_out":0,"evaluated_tokens":200000},"status":"discard","description":"Run 116 mix_weight_fixed=0.78 (0.80 optimal)","timestamp":1777585434639,"segment":0,"confidence":15.645732070366101,"asi":{"hypothesis":"0.78 may further improve.","source":"run 115","learned":"0.78 slightly worse than 0.80. New mix optimum at 0.80 with per-order C.","rollback_reason":"Worsened ~0.000010 vs 0.80.","next_action_hint":"Try 0.82 as upper bracket to confirm optimum between 0.78-0.85."}}
{"type":"hook","stage":"after","exit_code":0,"duration_ms":42,"stdout_bytes":216,"timed_out":false}
{"type":"hook","stage":"before","exit_code":0,"duration_ms":33,"stdout_bytes":5571,"timed_out":false}
{"run":117,"commit":"6b03bd4","metric":2.9692281375,"metrics":{"elapsed_seconds":9.722408,"timed_out":0,"evaluated_tokens":200000},"status":"keep","description":"Run 117 mix_weight_fixed=0.82 (confirmed bracket)","timestamp":1777585497296,"segment":0,"confidence":15.162476531526385,"asi":{"hypothesis":"0.82 confirms upper bound of the bracket.","source":"runs 115-116","learned":"mix_weight_fixed optimum is at 0.80-0.82 with per-order C (was 0.85 before). The shift is ~0.05 toward more adaptive-C. Bracket: 0.78 (worse) < 0.80-0.82 (best) < 0.85 (worse). Gains are 3×10⁻⁶ bps — absolute noise floor.","next_action_hint":"117 experiments. Best: 2.9692281375. Gains at 0.000003 bps level. The architecture is fully rebracketed after per-order C. No further meaningful movement possible."}}
{"type":"hook","stage":"after","exit_code":0,"duration_ms":42,"stdout_bytes":216,"timed_out":false}
{"type":"hook","stage":"before","exit_code":0,"duration_ms":37,"stdout_bytes":5521,"timed_out":false}
{"run":118,"commit":"6b03bd4","metric":2.9753415126,"metrics":{"elapsed_seconds":14.447644,"timed_out":0,"evaluated_tokens":200000},"status":"discard","description":"Run 118 aux non-uniform prior — harmful","timestamp":1777585749010,"segment":0,"confidence":15.453963978781767,"asi":{"hypothesis":"Non-uniform auxiliary prior improves by using aux info more efficiently.","learned":"Non-uniform prior worsened massively to 2.9753 (−0.00611). Tighter coupling between auxiliary and main model (PPM exclusion, non-uniform priors) consistently fails. The independent mixture architecture is correct.","rollback_reason":"Massive worsening of ~0.00611 — non-uniform prior is actively harmful, not neutral.","next_action_hint":"118 experiments. Critical architectural lesson: independent mixture beats coupled models. PPM exclusion (run 109) and non-uniform prior (run 118) both failed decisively. The best architecture (run 117, mix_weight=0.82, independent mixture) is the correct design."}}
{"type":"hook","stage":"after","exit_code":0,"duration_ms":41,"stdout_bytes":216,"timed_out":false}
{"type":"hook","stage":"before","exit_code":0,"duration_ms":37,"stdout_bytes":5521,"timed_out":false}
{"run":119,"commit":"6b03bd4","metric":2.9692857799,"metrics":{"elapsed_seconds":10.292611,"timed_out":0,"evaluated_tokens":200000},"status":"discard","description":"Run 119 recent weight 0.12 (0.10 still optimal)","timestamp":1777586003289,"segment":0,"confidence":15.071145119804113,"asi":{"hypothesis":"With mix=0.82, weight 0.12 may improve.","source":"runs 087-090","learned":"Weight 0.12 slightly worse. 0.10 remains optimal even after mix_weight_fixed shift.","rollback_reason":"Worsened ~0.000058 vs 0.10."}}
{"type":"hook","stage":"after","exit_code":0,"duration_ms":42,"stdout_bytes":216,"timed_out":false}
{"type":"hook","stage":"before","exit_code":0,"duration_ms":36,"stdout_bytes":5521,"timed_out":false}
{"run":120,"commit":"6b03bd4","metric":2.969253461,"metrics":{"elapsed_seconds":8.620992,"timed_out":0,"evaluated_tokens":200000},"status":"discard","description":"Run 120 run-length repeat detector","timestamp":1777586098472,"segment":0,"confidence":15.011512256448269,"asi":{"hypothesis":"Run-length detection captures persistence patterns.","learned":"No benefit — n-gram model already captures run dynamics.","rollback_reason":"Worsened ~0.000025."}}
{"type":"hook","stage":"after","exit_code":0,"duration_ms":41,"stdout_bytes":216,"timed_out":false}
{"type":"hook","stage":"before","exit_code":0,"duration_ms":37,"stdout_bytes":5521,"timed_out":false}
{"run":121,"commit":"6b03bd4","metric":2.9728605189,"metrics":{"elapsed_seconds":8.777553,"timed_out":0,"evaluated_tokens":200000},"status":"discard","description":"Run 121 double online weight — harmful","timestamp":1777586191582,"segment":0,"confidence":15.071145119804113,"asi":{"hypothesis":"Double online weight improves adaptation.","learned":"Massive worsening (−0.00363). Equal train+online weighting is precisely optimal.","rollback_reason":"−0.00363 vs current."}}
{"type":"hook","stage":"after","exit_code":0,"duration_ms":41,"stdout_bytes":216,"timed_out":false}
{"type":"hook","stage":"before","exit_code":0,"duration_ms":32,"stdout_bytes":5521,"timed_out":false}
