{"type":"hook","stage":"before","exit_code":0,"duration_ms":31,"stdout_bytes":7966,"timed_out":false}
{"run":18,"commit":"none","metric":2.9690047302,"metrics":{"elapsed_seconds":42.51001,"timed_out":0,"evaluated_tokens":200000,"stability_std":4.440892098500626e-16,"train_val_score":2.7853336756066396},"status":"discard","description":"Run 018 order-4 PPM-A hybrid; loses the Run 016 order-5 PPM-A gain","timestamp":1777795125573,"segment":0,"confidence":10.29495283547964,"asi":{"hypothesis":"Order-4 PPM-A might preserve the conservative escape signal with less sparse high-order risk and lower runtime than order 5.","rollback_reason":"Primary metric 2.9690047302 is worse than current best Run 016/017 at 2.9689753717 and runtime remains similarly high.","next_action_hint":"Order-5 contexts carry the useful PPM-A signal. Avoid further PPM-A order reductions; consider runtime consolidation or a distinct architecture rather than bounded-depth PPM-A variants.","learned":"Order-4 PPM-A is deterministic and still beats Phase 1, but loses ~0.000029 bits/symbol relative to order-5 PPM-A. Lower train-val did not translate to better public score, reinforcing that train-val alone can favor over-smoothed/overfit variants."}}
{"type":"hook","stage":"after","exit_code":0,"duration_ms":43,"stdout_bytes":216,"timed_out":false}
{"type":"hook","stage":"before","exit_code":0,"duration_ms":30,"stdout_bytes":7966,"timed_out":false}
{"run":19,"commit":"98e5b27","metric":2.9689665968,"metrics":{"elapsed_seconds":40.421581,"timed_out":0,"evaluated_tokens":200000,"stability_std":0,"train_val_score":2.7812172330283182},"status":"keep","description":"Run 019 PPM-A selective online updates gated into Run 014 base; new best","timestamp":1777795451509,"segment":0,"confidence":11.296239348043738,"asi":{"hypothesis":"Selective PPM-A online updates can preserve train-learned intermediate contexts while adapting only global and most-specific contexts, reducing online update noise.","learned":"Selective PPM-A improved Run 016 by ~0.0000088 bits/symbol and original Phase 1 by ~0.0002615. It is deterministic and slightly faster than all-order PPM-A in this run. The update policy matters: all-order online updates were not optimal for the PPM-A component.","next_action_hint":"Confirm Run 019 before further work. If confirmed, consider applying selective-update logic to PPM-C or optimizing runtime by avoiding duplicate tree traversals."}}
{"type":"hook","stage":"after","exit_code":0,"duration_ms":41,"stdout_bytes":216,"timed_out":false}
{"type":"hook","stage":"before","exit_code":0,"duration_ms":33,"stdout_bytes":8083,"timed_out":false}
{"run":20,"commit":"none","metric":2.9689665968,"metrics":{"elapsed_seconds":39.933608,"timed_out":0,"evaluated_tokens":200000,"stability_std":0,"train_val_score":2.7812172330283182},"status":"discard","description":"Run 020 confirmation rerun of Run 019 selective-update PPM-A; exact score reproduced","timestamp":1777795690503,"segment":0,"confidence":12.038198647730269,"asi":{"hypothesis":"The Run 019 selective-update PPM-A hybrid should reproduce exactly if the new best is deterministic and has no hidden state.","rollback_reason":"Confirmation run matched the current best exactly, so it does not improve the primary metric and is logged as discard.","next_action_hint":"Treat Run 019 as confirmed. Next try applying selective-update logic to the PPM-C component or reduce runtime by consolidating duplicate PPM/CTW/VOMM tree traversals.","learned":"Run 019 is reproducible: public score 2.9689665968, train_val 2.7812172330, stability_std 0.0. Runtime varied slightly lower (~39.9s) but distribution outputs match exactly."}}
{"type":"hook","stage":"after","exit_code":0,"duration_ms":40,"stdout_bytes":216,"timed_out":false}
{"type":"hook","stage":"before","exit_code":0,"duration_ms":32,"stdout_bytes":8083,"timed_out":false}
{"run":21,"commit":"none","metric":2.9689671842,"metrics":{"elapsed_seconds":39.328674,"timed_out":0,"evaluated_tokens":200000,"stability_std":4.440892098500626e-16,"train_val_score":2.785535874135082},"status":"discard","description":"Run 021 selective online updates for both PPM-C and PPM-A; slight regression vs Run 019","timestamp":1777795974621,"segment":0,"confidence":13.434872838024889,"asi":{"hypothesis":"Selective online updates might also help the PPM-C base by avoiding noisy intermediate-order public updates, analogous to the Run 019 PPM-A gain.","rollback_reason":"Primary metric 2.9689671842 is slightly worse than confirmed Run 019 best at 2.9689665968, so selective PPM-C does not improve the stack.","next_action_hint":"Keep selective updates for PPM-A only. PPM-C appears to need all-order online adaptation or its change interacts badly with downstream experts. Next consider runtime consolidation or a genuinely different tree expert rather than applying selective updates to every component.","learned":"The update-policy lesson is component-specific: selective updates helped PPM-A but not PPM-C. Train-val worsened to 2.7855358741 while public score nearly tied, suggesting PPM-C intermediate updates are not the main overfitting source."}}
{"type":"hook","stage":"after","exit_code":0,"duration_ms":41,"stdout_bytes":216,"timed_out":false}
{"type":"hook","stage":"before","exit_code":0,"duration_ms":32,"stdout_bytes":8083,"timed_out":false}
{"run":22,"commit":"a868f1c","metric":2.9689665164,"metrics":{"elapsed_seconds":40.243959,"timed_out":0,"evaluated_tokens":200000,"stability_std":4.440892098500626e-16,"train_val_score":2.781207188711377},"status":"keep","description":"Run 022 selective online updates for probabilistic-depth VOMM plus selective PPM-A; tiny new best","timestamp":1777796222292,"segment":0,"confidence":12.041899299946804,"asi":{"hypothesis":"Intermediate-depth online updates in the probabilistic-depth VOMM may add noise; updating only unigram and deepest matched context could reduce mismatch while preserving train-derived intermediate statistics.","learned":"Selective VOMM updates produced a tiny improvement over confirmed Run 019: 2.9689665164 vs 2.9689665968 (~8e-8 bits/symbol). Train-val also improved slightly. The effect is extremely small and needs confirmation before trusting.","next_action_hint":"Confirm Run 022 before further architectural changes. If confirmed, record that selective online updates help PPM-A and VOMM but not PPM-C; then consider selective CTW or runtime consolidation."}}
{"type":"hook","stage":"after","exit_code":0,"duration_ms":41,"stdout_bytes":216,"timed_out":false}
{"type":"hook","stage":"before","exit_code":0,"duration_ms":32,"stdout_bytes":8141,"timed_out":false}
{"run":23,"commit":"none","metric":2.9689665164,"metrics":{"elapsed_seconds":39.358617,"timed_out":0,"evaluated_tokens":200000,"stability_std":4.440892098500626e-16,"train_val_score":2.781207188711377},"status":"discard","description":"Run 023 confirmation rerun of Run 022 selective VOMM/PPM-A; exact score reproduced","timestamp":1777796438755,"segment":0,"confidence":10.539505859341935,"asi":{"hypothesis":"The Run 022 selective VOMM plus selective PPM-A hybrid should reproduce exactly if the tiny new best is deterministic.","rollback_reason":"Confirmation matched the current best exactly, so it does not improve the primary metric and is logged as discard.","next_action_hint":"Treat Run 022 as confirmed. Record that selective online updates help PPM-A and VOMM but not PPM-C; next test selective CTW or consolidate runtime.","learned":"Run 022 reproduced exactly: public score 2.9689665164, train_val 2.7812071887, numerical-zero stability. The 8e-8 gain over Run 019 is deterministic on the fixed evaluator, though still practically tiny."}}
{"type":"hook","stage":"after","exit_code":0,"duration_ms":40,"stdout_bytes":216,"timed_out":false}
{"type":"hook","stage":"before","exit_code":0,"duration_ms":32,"stdout_bytes":8141,"timed_out":false}
{"run":24,"commit":"9b302be","metric":2.9689653121,"metrics":{"elapsed_seconds":39.8355,"timed_out":0,"evaluated_tokens":200000,"stability_std":0,"train_val_score":2.781178642468684},"status":"keep","description":"Run 024 selective online updates for count-dependent CTW plus selective VOMM/PPM-A; new best","timestamp":1777796689413,"segment":0,"confidence":10.900077761214563,"asi":{"hypothesis":"Intermediate-depth online updates in count-dependent CTW may add noise; updating only unigram and deepest contexts could reduce mismatch while retaining train-derived intermediate tree statistics.","learned":"Selective CTW improved the confirmed Run 022 best by ~0.00000120 bits/symbol and improved train-val slightly. Selective online updates now help CTW, VOMM, and PPM-A, while PPM-C was the exception.","next_action_hint":"Confirm Run 024 before further changes. If confirmed, update the durable lesson: all tree experts except PPM-C benefit from selective public updates. Then prioritize runtime consolidation or a genuinely new architecture."}}
{"type":"hook","stage":"after","exit_code":0,"duration_ms":40,"stdout_bytes":216,"timed_out":false}
{"type":"hook","stage":"before","exit_code":0,"duration_ms":37,"stdout_bytes":8220,"timed_out":false}
{"run":25,"commit":"none","metric":2.9689653121,"metrics":{"elapsed_seconds":39.582703,"timed_out":0,"evaluated_tokens":200000,"stability_std":0,"train_val_score":2.781178642468684},"status":"discard","description":"Run 025 confirmation rerun of Run 024 selective CTW/VOMM/PPM-A; exact score reproduced","timestamp":1777796901226,"segment":0,"confidence":11.231086763289474,"asi":{"hypothesis":"The Run 024 selective CTW/VOMM/PPM-A stack should reproduce exactly if the new best is deterministic and has no reset/state bug.","rollback_reason":"Confirmation matched the current best exactly, so it does not improve the primary metric and is logged as discard.","next_action_hint":"Treat Run 024 as confirmed. Durable lesson: selective online updates help CTW, VOMM, and PPM-A, but not PPM-C. Next prioritize runtime consolidation or a distinct architecture with larger expected gain.","learned":"Run 024 reproduced exactly: public score 2.9689653121, train_val 2.7811786425, stability_std 0.0. The selective-update stack is deterministic."}}
{"type":"hook","stage":"after","exit_code":0,"duration_ms":41,"stdout_bytes":216,"timed_out":false}
{"type":"hook","stage":"before","exit_code":0,"duration_ms":33,"stdout_bytes":8220,"timed_out":false}
{"run":26,"commit":"1e6e33f","metric":2.9689448398,"metrics":{"elapsed_seconds":40.419137,"timed_out":0,"evaluated_tokens":200000,"stability_std":0,"train_val_score":2.776001796350244},"status":"keep","description":"Run 026 order-6 selective PPM-A on confirmed selective CTW/VOMM stack; new best","timestamp":1777797172559,"segment":0,"confidence":12.105911561598344,"asi":{"hypothesis":"With selective public updates reducing online noise, order-6 PPM-A can exploit longer recurring contexts beyond the confirmed order-5 stack without overtrusting intermediate updates.","learned":"Order-6 selective PPM-A improved Run 024 by ~0.00002047 bits/symbol, much larger than recent marginal gains, and train-val improved substantially to 2.7760. Longer PPM-A contexts are useful once update noise is controlled.","next_action_hint":"Confirm Run 026 before further changes. If confirmed, consider order-7 selective PPM-A or runtime/memory consolidation, but beware sparse long-context overfitting."}}
{"type":"hook","stage":"after","exit_code":0,"duration_ms":40,"stdout_bytes":216,"timed_out":false}
{"type":"hook","stage":"before","exit_code":0,"duration_ms":32,"stdout_bytes":8212,"timed_out":false}
{"run":27,"commit":"none","metric":2.9689448398,"metrics":{"elapsed_seconds":39.632217,"timed_out":0,"evaluated_tokens":200000,"stability_std":0,"train_val_score":2.776001796350244},"status":"discard","description":"Run 027 confirmation rerun of Run 026 order-6 selective PPM-A stack; exact score reproduced","timestamp":1777797383405,"segment":0,"confidence":12.105911561598344,"asi":{"hypothesis":"The Run 026 order-6 selective PPM-A stack should reproduce exactly if the longer-context gain is deterministic.","rollback_reason":"Confirmation matched the current best exactly, so it does not improve the primary metric and is logged as discard.","next_action_hint":"Treat Run 026 as confirmed. Next consider order-7 selective PPM-A to test whether longer recurrence continues helping, or runtime consolidation if depth 7 overfits.","learned":"Run 026 reproduced exactly: public score 2.9689448398, train_val 2.7760017964, stability_std 0.0. The order-6 PPM-A gain is deterministic on the fixed evaluator."}}
{"type":"hook","stage":"after","exit_code":0,"duration_ms":41,"stdout_bytes":216,"timed_out":false}
{"type":"hook","stage":"before","exit_code":0,"duration_ms":31,"stdout_bytes":8212,"timed_out":false}
{"run":28,"commit":"c08ad77","metric":2.9689447582,"metrics":{"elapsed_seconds":43.137436,"timed_out":0,"evaluated_tokens":200000,"stability_std":4.440892098500626e-16,"train_val_score":2.7724492008329986},"status":"keep","description":"Run 028 order-7 selective PPM-A on confirmed selective tree stack; tiny new best","timestamp":1777797623292,"segment":0,"confidence":14.259082400529831,"asi":{"hypothesis":"Order-7 selective PPM-A may exploit one-symbol-longer recurrences beyond the confirmed order-6 model while escape recursion and gating limit sparse-context harm.","learned":"Order 7 improved public score over Run 026 by only ~0.00000008 bits/symbol, but train-val improved strongly to 2.77245. Long-context recurrence keeps improving train-derived validation, while public-practice gain is nearly saturated at order 7.","next_action_hint":"Confirm Run 028 because the public gain is extremely tiny. If confirmed, be cautious about order 8: train-val may improve while public score saturates or overfits; consider confirmation then maybe order 8 or runtime consolidation."}}
{"type":"hook","stage":"after","exit_code":0,"duration_ms":40,"stdout_bytes":216,"timed_out":false}
{"type":"hook","stage":"before","exit_code":0,"duration_ms":31,"stdout_bytes":8233,"timed_out":false}
{"run":29,"commit":"none","metric":2.9689447582,"metrics":{"elapsed_seconds":40.369527,"timed_out":0,"evaluated_tokens":200000,"stability_std":4.440892098500626e-16,"train_val_score":2.7724492008329986},"status":"discard","description":"Run 029 confirmation rerun of Run 028 order-7 selective PPM-A stack; exact score reproduced","timestamp":1777797842658,"segment":0,"confidence":17.4224294811272,"asi":{"hypothesis":"The Run 028 order-7 selective PPM-A stack should reproduce exactly if the tiny public gain is deterministic.","rollback_reason":"Confirmation matched the current best exactly, so it does not improve the primary metric and is logged as discard.","next_action_hint":"Treat Run 028 as confirmed but nearly saturated. Next test order-8 selective PPM-A cautiously or pivot to runtime consolidation; watch for train-val improvement without public gain.","learned":"Run 028 reproduced exactly: public score 2.9689447582, train_val 2.7724492008, numerical-zero stability. Order 7 is deterministic but public gain over order 6 is only ~8e-8 bits/symbol."}}
{"type":"hook","stage":"after","exit_code":0,"duration_ms":40,"stdout_bytes":216,"timed_out":false}
{"type":"hook","stage":"before","exit_code":0,"duration_ms":31,"stdout_bytes":8233,"timed_out":false}
{"run":30,"commit":"none","metric":2.9689490139,"metrics":{"elapsed_seconds":40.989833,"timed_out":0,"evaluated_tokens":200000,"stability_std":4.440892098500626e-16,"train_val_score":2.770567933174242},"status":"discard","description":"Run 030 order-8 selective PPM-A; train-val improves but public score regresses vs order 7","timestamp":1777798081197,"segment":0,"confidence":14.378130858632574,"asi":{"hypothesis":"Order-8 selective PPM-A might exploit one more recurrence symbol beyond order 7, but may also cross the public-practice saturation boundary.","rollback_reason":"Primary metric 2.9689490139 is worse than confirmed Run 028/029 best 2.9689447582, despite better train-val.","next_action_hint":"Do not keep increasing PPM-A order blindly. Order 7 is public-practice sweet spot so far; consider order-6/7 gate calibration only if architectural, or pivot to runtime consolidation/distillation.","learned":"Train-val continued improving to 2.77057, but public score regressed by ~0.00000426 vs order 7. This is a clear train/public transfer warning: deeper recurrence past order 7 overfits train-like structure or adds mismatch on public practice."}}
{"type":"hook","stage":"after","exit_code":0,"duration_ms":43,"stdout_bytes":216,"timed_out":false}
{"type":"hook","stage":"before","exit_code":0,"duration_ms":36,"stdout_bytes":8227,"timed_out":false}
{"run":31,"commit":"none","metric":2.968944877,"metrics":{"elapsed_seconds":40.410156,"timed_out":0,"evaluated_tokens":200000,"stability_std":0,"train_val_score":2.772062290683642},"status":"discard","description":"Run 031 support-gated order-8 PPM-A; improves over naive order8 but still worse than order7 best","timestamp":1777798343423,"segment":0,"confidence":12.239473240992323,"asi":{"hypothesis":"If naive order-8 PPM-A regressed because of low-support long contexts, requiring top-order support >=4 should reduce mismatch while preserving some long-context benefit.","rollback_reason":"Primary metric 2.9689448770 remains worse than confirmed order-7 best 2.9689447582, even though it improves over naive order8.","next_action_hint":"Order 7 remains the public-practice sweet spot. Avoid more order-8 support threshold tuning unless there is a genuinely new gating architecture. Pivot to runtime consolidation/distillation or another model family.","learned":"Support gating repaired most of the naive order-8 regression and train-val stayed strong (2.77206), but public score still did not beat order 7. The train/public gap confirms saturation/overfitting beyond order 7."}}
{"type":"hook","stage":"after","exit_code":0,"duration_ms":41,"stdout_bytes":216,"timed_out":false}
{"type":"hook","stage":"before","exit_code":0,"duration_ms":35,"stdout_bytes":8227,"timed_out":false}
{"run":32,"commit":"none","metric":2.968948293,"metrics":{"elapsed_seconds":39.996088,"timed_out":0,"evaluated_tokens":200000,"stability_std":0,"train_val_score":2.7752921529399375},"status":"discard","description":"Run 032 support-gated order-7 PPM-A; regresses toward order6 and misses current best","timestamp":1777798585840,"segment":0,"confidence":10.246872197617805,"asi":{"hypothesis":"If sparse order-7 contexts were harmful, requiring top-order support >=4 could improve the confirmed order-7 PPM-A model.","rollback_reason":"Primary metric 2.9689482930 is worse than confirmed order-7 best 2.9689447582 and even worse than order6, so rare order-7 contexts carry useful public signal.","next_action_hint":"Do not support-gate order 7 this way. Current sweet spot remains ungated order 7. Pivot away from PPM-A depth/threshold tweaks toward runtime consolidation or a structurally different model.","learned":"Support gating order 7 removed useful rare-context signal. In contrast to order 8, where support gating repaired most harm, order 7 needs its low-support contexts for the small public gain."}}
{"type":"hook","stage":"after","exit_code":0,"duration_ms":43,"stdout_bytes":216,"timed_out":false}
{"type":"hook","stage":"before","exit_code":0,"duration_ms":32,"stdout_bytes":8233,"timed_out":false}
{"run":33,"commit":"848af2f","metric":2.9689387975,"metrics":{"elapsed_seconds":39.972224,"timed_out":0,"evaluated_tokens":200000,"stability_std":0,"train_val_score":2.760161007633074},"status":"keep","description":"Run 033 order-7 half-escape selective PPM-A; new best","timestamp":1777798860303,"segment":0,"confidence":10.68515105966581,"asi":{"hypothesis":"Order-7 contexts carry useful rare-context signal, and PPM-A's full escape pseudo-count may be too conservative; half escape should sharpen useful contexts without increasing depth.","learned":"Half escape improved the confirmed order-7 best by ~0.00000596 bits/symbol and substantially improved train-val to 2.76016. Escape calibration, not deeper contexts, is the promising next axis after order-7 depth saturation.","next_action_hint":"Confirm Run 033 before further changes. If confirmed, consider nearby escape-law architecture such as quarter escape or count-dependent escape, but avoid blind hyperparameter sweeps."}}
{"type":"hook","stage":"after","exit_code":0,"duration_ms":40,"stdout_bytes":216,"timed_out":false}
{"type":"hook","stage":"before","exit_code":0,"duration_ms":38,"stdout_bytes":8214,"timed_out":false}
{"run":34,"commit":"none","metric":2.9689387975,"metrics":{"elapsed_seconds":41.686047,"timed_out":0,"evaluated_tokens":200000,"stability_std":0,"train_val_score":2.760161007633074},"status":"discard","description":"Run 034 confirmation rerun of Run 033 order-7 half-escape PPM-A; exact score reproduced","timestamp":1777799093779,"segment":0,"confidence":10.25352072746164,"asi":{"hypothesis":"The Run 033 order-7 half-escape selective PPM-A stack should reproduce exactly if the escape-law gain is deterministic.","rollback_reason":"Confirmation matched the current best exactly, so it does not improve the primary metric and is logged as discard.","next_action_hint":"Treat Run 033 as confirmed. Next explore nearby escape-law architecture such as quarter escape or count-dependent escape, but avoid blind sweeps; maintain validation discipline because train-val improvements may not always transfer.","learned":"Run 033 reproduced exactly: public score 2.9689387975, train_val 2.7601610076, stability_std 0.0. Half escape is deterministic and currently best."}}
{"type":"hook","stage":"after","exit_code":0,"duration_ms":41,"stdout_bytes":216,"timed_out":false}
{"type":"hook","stage":"before","exit_code":0,"duration_ms":32,"stdout_bytes":8233,"timed_out":false}
