{"run":52,"commit":"5d9da23","metric":2.9689355534,"metrics":{"elapsed_seconds":41.75238,"timed_out":0,"evaluated_tokens":200000,"stability_std":4.440892098500626e-16,"train_val_score":2.7608427732306406},"status":"keep","description":"Run 052 final saturation JS disagreement boost 0.40; new best","timestamp":1777803528129,"segment":0,"confidence":22.739991450485583,"asi":{"hypothesis":"If JS disagreement still underweights useful PPM-A conditional information, increasing the boost from 0.32 to 0.40 should further reduce log-loss without changing experts or evaluator semantics.","next_action_hint":"Confirm Run 052 with an exact rerun before further changes. If confirmed, be cautious: either test one smaller saturation step only if train-val remains aligned, or switch to support-conditioned disagreement gating to reduce overconfidence risk.","learned":"The disagreement-boost trend continued through 0.40 with improved public score and train-val; saturation has still not visibly appeared, but continued scalar increases risk overfitting."}}
{"type":"hook","stage":"after","exit_code":0,"duration_ms":40,"stdout_bytes":216,"timed_out":false}
{"type":"hook","stage":"before","exit_code":0,"duration_ms":32,"stdout_bytes":8207,"timed_out":false}
{"run":53,"commit":"none","metric":2.9689355534,"metrics":{"elapsed_seconds":42.072844,"timed_out":0,"evaluated_tokens":200000,"stability_std":4.440892098500626e-16,"train_val_score":2.7608427732306406},"status":"discard","description":"Run 053 confirmation rerun of Run 052 final saturation boost; exact score reproduced","timestamp":1777803746048,"segment":0,"confidence":22.92475789019033,"asi":{"hypothesis":"The Run 052 final saturation disagreement-boosted PPM-A stack should reproduce exactly if the new best is deterministic and has no hidden state.","rollback_reason":"Confirmation matched the current best exactly, so it does not improve the primary metric and is logged as discard.","next_action_hint":"Treat Run 052 as confirmed. Next avoid unbounded scalar boost chasing; try support-conditioned disagreement gating or one cautious saturation step only if justified by validation alignment.","learned":"Run 052 is deterministic: public score, train-val, and stability block scores reproduced exactly."}}
{"type":"hook","stage":"after","exit_code":0,"duration_ms":41,"stdout_bytes":216,"timed_out":false}
{"type":"hook","stage":"before","exit_code":0,"duration_ms":33,"stdout_bytes":8207,"timed_out":false}
{"run":54,"commit":"44d09aa","metric":2.9689349548,"metrics":{"elapsed_seconds":44.435071,"timed_out":0,"evaluated_tokens":200000,"stability_std":4.440892098500626e-16,"train_val_score":2.761381513762431},"status":"keep","description":"Run 054 support-conditioned JS disagreement boost; new best","timestamp":1777804003917,"segment":0,"confidence":22.992557563429735,"asi":{"hypothesis":"Conditioning the JS disagreement boost on PPM-A support should amplify disagreement when recurrence evidence is reliable while reducing overconfidence on sparse contexts.","next_action_hint":"Confirm Run 054 with an exact rerun before further changes. If confirmed, consider tuning support-conditioned boost/cap cautiously or comparing against pure scalar 0.48 to separate support conditioning from larger average boost.","learned":"Support-conditioned disagreement boost improved public score beyond Run 052, though train-val is slightly worse than Run 052; public benefit suggests support conditioning may improve calibration on practice data."}}
{"type":"hook","stage":"after","exit_code":0,"duration_ms":42,"stdout_bytes":216,"timed_out":false}
{"type":"hook","stage":"before","exit_code":0,"duration_ms":31,"stdout_bytes":8204,"timed_out":false}
{"run":55,"commit":"none","metric":2.9689349548,"metrics":{"elapsed_seconds":47.011932,"timed_out":0,"evaluated_tokens":200000,"stability_std":4.440892098500626e-16,"train_val_score":2.761381513762431},"status":"discard","description":"Run 055 confirmation rerun of Run 054 support-conditioned boost; exact score reproduced","timestamp":1777804223357,"segment":0,"confidence":23.013493359638893,"asi":{"hypothesis":"The Run 054 support-conditioned disagreement-boosted PPM-A stack should reproduce exactly if the new best is deterministic and has no hidden state.","rollback_reason":"Confirmation matched the current best exactly, so it does not improve the primary metric and is logged as discard.","next_action_hint":"Treat Run 054 as confirmed. Next compare against a pure scalar boost with similar effective strength, or tune support-conditioned boost/cap cautiously while monitoring train-val divergence.","learned":"Run 054 is deterministic: public score, train-val, and stability block scores reproduced exactly."}}
{"type":"hook","stage":"after","exit_code":0,"duration_ms":39,"stdout_bytes":216,"timed_out":false}
{"type":"hook","stage":"before","exit_code":0,"duration_ms":30,"stdout_bytes":8204,"timed_out":false}
{"run":56,"commit":"none","metric":2.9689350959,"metrics":{"elapsed_seconds":42.137881,"timed_out":0,"evaluated_tokens":200000,"stability_std":0,"train_val_score":2.7601960891011688},"status":"discard","description":"Run 056 pure scalar JS boost 0.48; train-val improves but public misses support-conditioned best","timestamp":1777804473938,"segment":0,"confidence":26.036730651772796,"asi":{"hypothesis":"If Run 054's gain came mainly from a larger effective disagreement boost rather than support conditioning, a pure scalar 0.48/cap1.52 boost should match or beat it.","rollback_reason":"Primary metric 2.9689350959 is worse than confirmed Run 054 best 2.9689349548, even though train-val improved; support conditioning appears to help public-practice calibration.","next_action_hint":"Keep Run 054 as current best. Next try modest support-conditioned gate refinements rather than pure scalar boosts, but watch train/public divergence.","learned":"Pure scalar boosting gives better train-val but worse public score than support-conditioned boosting; this suggests support conditioning changes calibration rather than merely increasing boost strength."}}
{"type":"hook","stage":"after","exit_code":0,"duration_ms":40,"stdout_bytes":216,"timed_out":false}
{"type":"hook","stage":"before","exit_code":0,"duration_ms":33,"stdout_bytes":8204,"timed_out":false}
{"run":57,"commit":"5692cf4","metric":2.968934504,"metrics":{"elapsed_seconds":42.300385,"timed_out":0,"evaluated_tokens":200000,"stability_std":0,"train_val_score":2.7609661070504576},"status":"keep","description":"Run 057 stronger support-conditioned JS disagreement boost; new best","timestamp":1777804720505,"segment":0,"confidence":30.02049871642963,"asi":{"hypothesis":"If support-conditioned disagreement still underweights reliable PPM-A incremental signal, increasing boost from 0.52 to 0.60 should improve public log-loss without changing experts.","next_action_hint":"Confirm Run 057 with an exact rerun before further changes. If confirmed, cautiously test another support-conditioned step or a cap-only variant, monitoring train/public divergence.","learned":"Support-conditioned boost 0.60 improved public score over Run 054 and recovered some train-val versus Run 054, so the support-conditioned family remains promising."}}
{"type":"hook","stage":"after","exit_code":0,"duration_ms":41,"stdout_bytes":216,"timed_out":false}
{"type":"hook","stage":"before","exit_code":0,"duration_ms":31,"stdout_bytes":8127,"timed_out":false}
{"run":58,"commit":"none","metric":2.968934504,"metrics":{"elapsed_seconds":44.242939,"timed_out":0,"evaluated_tokens":200000,"stability_std":0,"train_val_score":2.7609661070504576},"status":"discard","description":"Run 058 confirmation rerun of Run 057 stronger support-conditioned boost; exact score reproduced","timestamp":1777804942344,"segment":0,"confidence":29.861894325723114,"asi":{"hypothesis":"The Run 057 stronger support-conditioned disagreement-boosted PPM-A stack should reproduce exactly if the new best is deterministic and has no hidden state.","rollback_reason":"Confirmation matched the current best exactly, so it does not improve the primary metric and is logged as discard.","next_action_hint":"Treat Run 057 as confirmed. Next cautiously test support-conditioned boost/cap saturation, or alter support exponent to check calibration without only increasing strength.","learned":"Run 057 is deterministic: public score, train-val, and stability block scores reproduced exactly."}}
{"type":"hook","stage":"after","exit_code":0,"duration_ms":54,"stdout_bytes":216,"timed_out":false}
{"type":"hook","stage":"before","exit_code":0,"duration_ms":33,"stdout_bytes":8127,"timed_out":false}
{"run":59,"commit":"none","metric":2.9689347629,"metrics":{"elapsed_seconds":42.256555,"timed_out":0,"evaluated_tokens":200000,"stability_std":0,"train_val_score":2.7615266217282812},"status":"discard","description":"Run 059 support exponent 0.75 disagreement boost; over-conservative vs Run 057","timestamp":1777805207595,"segment":0,"confidence":29.704957005947236,"asi":{"hypothesis":"If low-support disagreement is over-amplified in Run 057, a more conservative support exponent 0.75 should improve public robustness.","rollback_reason":"Primary metric 2.9689347629 is worse than confirmed Run 057 best 2.9689345040, and train-val also worsened; exponent 0.75 suppresses useful lower-support signal too much.","next_action_hint":"Keep exponent 0.50 from Run 057. Next try a slightly stronger boost/cap with sqrt support, or a gentler exponent such as 0.40 if exploring support calibration.","learned":"Square-root support gating is better than exponent 0.75; useful PPM-A disagreement still comes from moderately low-support contexts."}}
{"type":"hook","stage":"after","exit_code":0,"duration_ms":41,"stdout_bytes":216,"timed_out":false}
{"type":"hook","stage":"before","exit_code":0,"duration_ms":40,"stdout_bytes":8127,"timed_out":false}
{"run":60,"commit":"c872149","metric":2.9689340716,"metrics":{"elapsed_seconds":42.059497,"timed_out":0,"evaluated_tokens":200000,"stability_std":4.440892098500626e-16,"train_val_score":2.760551496192461},"status":"keep","description":"Run 060 extra support-conditioned JS disagreement boost 0.68; new best","timestamp":1777805472392,"segment":0,"confidence":29.748700050945832,"asi":{"hypothesis":"If Run 057 still underweights square-root-supported PPM-A disagreement, increasing boost from 0.60 to 0.68 should improve public log-loss.","next_action_hint":"Confirm Run 060 with an exact rerun before further changes. If confirmed, cautiously test another sqrt-support boost step or a cap-only variant, watching for saturation.","learned":"Square-root support-conditioned boost 0.68 improved both public score and train-val over Run 057; exponent 0.75 was too conservative, but more boost at exponent 0.5 remains beneficial."}}
{"type":"hook","stage":"after","exit_code":0,"duration_ms":40,"stdout_bytes":216,"timed_out":false}
{"type":"hook","stage":"before","exit_code":0,"duration_ms":33,"stdout_bytes":8221,"timed_out":false}
{"run":61,"commit":"none","metric":2.9689340716,"metrics":{"elapsed_seconds":42.777134,"timed_out":0,"evaluated_tokens":200000,"stability_std":4.440892098500626e-16,"train_val_score":2.760551496192461},"status":"discard","description":"Run 061 confirmation rerun of Run 060 extra support-conditioned boost; exact score reproduced","timestamp":1777805700747,"segment":0,"confidence":29.748700050945832,"asi":{"hypothesis":"The Run 060 extra support-conditioned disagreement-boosted PPM-A stack should reproduce exactly if the new best is deterministic and has no hidden state.","rollback_reason":"Confirmation matched the current best exactly, so it does not improve the primary metric and is logged as discard.","next_action_hint":"Treat Run 060 as confirmed. Next cautiously test another sqrt-support boost step or a cap-only variant, while monitoring saturation and train/public divergence.","learned":"Run 060 is deterministic: public score, train-val, and stability block scores reproduced exactly."}}
{"type":"hook","stage":"after","exit_code":0,"duration_ms":39,"stdout_bytes":216,"timed_out":false}
{"type":"hook","stage":"before","exit_code":0,"duration_ms":31,"stdout_bytes":8221,"timed_out":false}
{"run":62,"commit":"8b0dc0d","metric":2.9689336574,"metrics":{"elapsed_seconds":44.693398,"timed_out":0,"evaluated_tokens":200000,"stability_std":0,"train_val_score":2.7601376742759394},"status":"keep","description":"Run 062 next support-conditioned JS disagreement boost 0.76; new best","timestamp":1777805945254,"segment":0,"confidence":29.62531752539339,"asi":{"hypothesis":"If Run 060 still underweights square-root-supported PPM-A disagreement, increasing boost from 0.68 to 0.76 should improve public log-loss.","next_action_hint":"Confirm Run 062 with an exact rerun before further changes. If confirmed, cautiously test one more sqrt-support step or examine whether cap is active to avoid blind scalar chasing.","learned":"Square-root support-conditioned boost 0.76 improved public and train-val over Run 060, so saturation has still not appeared in this gate family."}}
{"type":"hook","stage":"after","exit_code":0,"duration_ms":40,"stdout_bytes":216,"timed_out":false}
{"type":"hook","stage":"before","exit_code":0,"duration_ms":33,"stdout_bytes":8210,"timed_out":false}
{"run":63,"commit":"none","metric":2.9689336574,"metrics":{"elapsed_seconds":43.209745,"timed_out":0,"evaluated_tokens":200000,"stability_std":0,"train_val_score":2.7601376742759394},"status":"discard","description":"Run 063 confirmation rerun of Run 062 next support-conditioned boost; exact score reproduced","timestamp":1777806158262,"segment":0,"confidence":29.461857072467804,"asi":{"hypothesis":"The Run 062 next support-conditioned disagreement-boosted PPM-A stack should reproduce exactly if the new best is deterministic and has no hidden state.","rollback_reason":"Confirmation matched the current best exactly, so it does not improve the primary metric and is logged as discard.","next_action_hint":"Treat Run 062 as confirmed. Next cautiously test another sqrt-support boost step or inspect cap activation to avoid blind scalar chasing.","learned":"Run 062 is deterministic: public score, train-val, and stability block scores reproduced exactly."}}
{"type":"hook","stage":"after","exit_code":0,"duration_ms":47,"stdout_bytes":216,"timed_out":false}
{"type":"hook","stage":"before","exit_code":0,"duration_ms":30,"stdout_bytes":8210,"timed_out":false}
{"run":64,"commit":"bbb0d51","metric":2.9689332613,"metrics":{"elapsed_seconds":49.951402,"timed_out":0,"evaluated_tokens":200000,"stability_std":0,"train_val_score":2.759724634533402},"status":"keep","description":"Run 064 further support-conditioned JS disagreement boost 0.84; new best","timestamp":1777806416711,"segment":0,"confidence":29.12429442651494,"asi":{"hypothesis":"If Run 062 still underweights reliable square-root-supported PPM-A disagreement, increasing boost from 0.76 to 0.84 should improve public log-loss.","next_action_hint":"Confirm Run 064 with an exact rerun before further changes. If confirmed, consider inspecting whether the cap is active before another boost step, or test a smaller increment to avoid overshooting.","learned":"Square-root support-conditioned boost 0.84 improved both public score and train-val over 0.76; saturation has still not appeared, but runtime increased in this run."}}
{"type":"hook","stage":"after","exit_code":0,"duration_ms":56,"stdout_bytes":216,"timed_out":false}
{"type":"hook","stage":"before","exit_code":0,"duration_ms":30,"stdout_bytes":8152,"timed_out":false}
{"run":65,"commit":"none","metric":2.9689332613,"metrics":{"elapsed_seconds":45.032032,"timed_out":0,"evaluated_tokens":200000,"stability_std":0,"train_val_score":2.759724634533402},"status":"discard","description":"Run 065 confirmation rerun of Run 064 further support-conditioned boost; exact score reproduced","timestamp":1777806639999,"segment":0,"confidence":28.75662655237934,"asi":{"hypothesis":"The Run 064 further support-conditioned disagreement-boosted PPM-A stack should reproduce exactly if the new best is deterministic and has no hidden state.","rollback_reason":"Confirmation matched the current best exactly, so it does not improve the primary metric and is logged as discard.","next_action_hint":"Treat Run 064 as confirmed. Next inspect or infer cap activity before another boost step, or test a smaller boost increment to avoid overshooting saturation.","learned":"Run 064 is deterministic: public score and train-val reproduced exactly; runtime returned closer to prior runs than the initial Run 064 timing."}}
{"type":"hook","stage":"after","exit_code":0,"duration_ms":55,"stdout_bytes":216,"timed_out":false}
{"type":"hook","stage":"before","exit_code":0,"duration_ms":29,"stdout_bytes":8152,"timed_out":false}
{"run":66,"commit":"none","metric":0,"metrics":{"elapsed_seconds":0.1,"timed_out":0,"evaluated_tokens":0,"stability_std":0,"train_val_score":0},"status":"crash","description":"Run 066 attempted confirmation without required run_066 explanation","timestamp":1777806708660,"segment":0,"confidence":28.75662655237934,"asi":{"hypothesis":"Confirm the current best further support-conditioned disagreement boost predictor deterministically.","rollback_reason":"Pre-run discipline failure: autoresearch expected explanations/run_066.md but only run_065 was written, so benchmark did not execute.","next_action_hint":"Write explanations/run_066.md for the next actual iteration before rerunning autoresearch; use the current predictor if confirming or pick the next support-gate experiment.","error_detail":"autoresearch exited code 12: Missing required pre-run explanation explanations/run_066.md"}}
{"type":"hook","stage":"after","exit_code":0,"duration_ms":40,"stdout_bytes":216,"timed_out":false}
{"type":"hook","stage":"before","exit_code":0,"duration_ms":31,"stdout_bytes":8152,"timed_out":false}
{"run":67,"commit":"f59c654","metric":2.9689330701,"metrics":{"elapsed_seconds":43.84906,"timed_out":0,"evaluated_tokens":200000,"stability_std":4.440892098500626e-16,"train_val_score":2.7595184059008253},"status":"keep","description":"Run 067 cautious square-root support disagreement boost 0.88; new best","timestamp":1777806979038,"segment":0,"confidence":36.26220804828988,"asi":{"hypothesis":"If Run 064 still slightly underweights reliable square-root-supported PPM-A disagreement, increasing boost from 0.84 to 0.88 with a matching cap should improve public log-loss without the risk of a full larger jump.","next_action_hint":"Confirm Run 067 with an exact rerun before further changes. If confirmed, test another cautious half-step only if train-val remains aligned, or run a cap-only diagnostic to check whether caps are active.","learned":"A smaller 0.04 step in the square-root support-conditioned disagreement boost improved both public score and train-val, suggesting the PPM-A incremental signal is still slightly underweighted. Stability std was numerical zero (4.4e-16)."}}
{"type":"hook","stage":"after","exit_code":0,"duration_ms":39,"stdout_bytes":216,"timed_out":false}
{"type":"hook","stage":"before","exit_code":0,"duration_ms":32,"stdout_bytes":8085,"timed_out":false}
