{"run":35,"commit":"none","metric":2.9689483162,"metrics":{"elapsed_seconds":41.067487,"timed_out":0,"evaluated_tokens":200000,"stability_std":0,"train_val_score":2.747651324080566},"status":"discard","description":"Run 035 order-7 quarter-escape PPM-A; sharper escape overfits train-val and regresses public score","timestamp":1777799331076,"segment":0,"confidence":10.68515105966581,"asi":{"hypothesis":"If half escape was still too conservative, quarter escape could sharpen useful order-7 recurrences and improve bits/symbol.","rollback_reason":"Primary metric 2.9689483162 is worse than confirmed half-escape best 2.9689387975 despite much better train-val.","next_action_hint":"Do not sharpen escape below 0.5 blindly. Half escape appears to balance public mismatch better than quarter escape; consider intermediate/count-dependent escape only if architecture is justified, or pivot to runtime consolidation.","learned":"Quarter escape strongly improves train-val to 2.74765 but hurts public practice by ~0.0000095 vs half escape, showing overconfidence/transfer mismatch. Train-val is not sufficient for escape calibration."}}
{"type":"hook","stage":"after","exit_code":0,"duration_ms":39,"stdout_bytes":216,"timed_out":false}
{"type":"hook","stage":"before","exit_code":0,"duration_ms":31,"stdout_bytes":8233,"timed_out":false}
{"run":36,"commit":"none","metric":2.9689405239,"metrics":{"elapsed_seconds":46.656821,"timed_out":0,"evaluated_tokens":200000,"stability_std":0,"train_val_score":2.7676100490137965},"status":"discard","description":"Run 036 order-7 0.75-escape PPM-A; safer escape regresses vs half escape","timestamp":1777799590920,"segment":0,"confidence":11.58240262603652,"asi":{"hypothesis":"If half escape is slightly too sharp, 0.75 escape could improve public log-loss by backing off more often while remaining sharper than full escape.","rollback_reason":"Primary metric 2.9689405239 is worse than confirmed half-escape best 2.9689387975, though better than full escape.","next_action_hint":"Half escape remains best among full/0.75/0.5/0.25. Consider a count-dependent escape architecture centered near 0.5 or pivot to runtime consolidation; avoid more scalar escape sweeps without a new rationale.","learned":"0.75 escape is less overconfident than quarter escape but still worse than half escape. Public optimum for this PPM-A stack appears near escape pseudo-count 0.5."}}
{"type":"hook","stage":"after","exit_code":0,"duration_ms":40,"stdout_bytes":216,"timed_out":false}
{"type":"hook","stage":"before","exit_code":0,"duration_ms":34,"stdout_bytes":8214,"timed_out":false}
{"run":37,"commit":"3efb9ab","metric":2.9689383361,"metrics":{"elapsed_seconds":40.44458,"timed_out":0,"evaluated_tokens":200000,"stability_std":0,"train_val_score":2.7641015595393577},"status":"keep","description":"Run 037 count-dependent escape around half-escape PPM-A; tiny new best","timestamp":1777799857004,"segment":0,"confidence":12.922563096591926,"asi":{"hypothesis":"Half escape may be best for supported contexts while sparse contexts need slightly more backoff; a count-dependent escape can reduce sparse-context mismatch without abandoning useful order-7 rare signal.","learned":"Count-dependent escape improved confirmed half escape by ~0.00000046 bits/symbol. Train-val is worse than quarter escape but public score is best, supporting the idea that public robustness needs more backoff in sparse contexts while keeping half escape for supported ones.","next_action_hint":"Confirm Run 037. If confirmed, consider a stronger but still centered count-dependent escape, or pivot to runtime consolidation because the gain is tiny."}}
{"type":"hook","stage":"after","exit_code":0,"duration_ms":41,"stdout_bytes":216,"timed_out":false}
{"type":"hook","stage":"before","exit_code":0,"duration_ms":32,"stdout_bytes":7969,"timed_out":false}
{"run":38,"commit":"none","metric":2.9689383361,"metrics":{"elapsed_seconds":40.027027,"timed_out":0,"evaluated_tokens":200000,"stability_std":0,"train_val_score":2.7641015595393577},"status":"discard","description":"Run 038 confirmation rerun of Run 037 count-dependent escape PPM-A; exact score reproduced","timestamp":1777800088229,"segment":0,"confidence":12.811676340969301,"asi":{"hypothesis":"The Run 037 count-dependent escape PPM-A stack should reproduce exactly if the tiny new best is deterministic.","rollback_reason":"Confirmation matched the current best exactly, so it does not improve the primary metric and is logged as discard.","next_action_hint":"Treat Run 037 as confirmed. Next consider a stronger support-dependent escape centered near half escape, but be cautious: scalar escape sweeps overfit easily; runtime consolidation may now be higher leverage.","learned":"Run 037 reproduced exactly: public score 2.9689383361, train_val 2.7641015595, stability_std 0.0. Count-dependent escape is deterministic and current best."}}
{"type":"hook","stage":"after","exit_code":0,"duration_ms":41,"stdout_bytes":216,"timed_out":false}
{"type":"hook","stage":"before","exit_code":0,"duration_ms":32,"stdout_bytes":7969,"timed_out":false}
{"run":39,"commit":"none","metric":2.9689390101,"metrics":{"elapsed_seconds":40.71816,"timed_out":0,"evaluated_tokens":200000,"stability_std":0,"train_val_score":2.7672022924653072},"status":"discard","description":"Run 039 stronger support-dependent escape; regresses vs confirmed Run 037","timestamp":1777800333256,"segment":0,"confidence":12.383828456164299,"asi":{"hypothesis":"A stronger sparse-context escape correction may improve public robustness while preserving half-escape behavior for supported contexts.","rollback_reason":"Primary metric 2.9689390101 is worse than confirmed Run 037 best 2.9689383361, so the stronger sparse-context backoff removes useful signal or over-backs off.","next_action_hint":"Keep the mild Run 037 count-dependent escape. Avoid further scalar strength tweaks unless tied to a different evidence statistic. Consider runtime consolidation/distillation or a structurally different model.","learned":"The mild sparse escape correction was better calibrated than a stronger correction. Public score worsened while train-val also worsened relative to Run 037, suggesting over-backoff on sparse contexts."}}
{"type":"hook","stage":"after","exit_code":0,"duration_ms":40,"stdout_bytes":216,"timed_out":false}
{"type":"hook","stage":"before","exit_code":0,"duration_ms":32,"stdout_bytes":7969,"timed_out":false}
{"run":40,"commit":"none","metric":2.9689385942,"metrics":{"elapsed_seconds":43.495703,"timed_out":0,"evaluated_tokens":200000,"stability_std":0,"train_val_score":2.7643120514161668},"status":"discard","description":"Run 040 diversity-dependent escape; near tie but worse than support-dependent escape best","timestamp":1777800592996,"segment":0,"confidence":12.383828456164299,"asi":{"hypothesis":"High-diversity contexts may need more escape mass than low-diversity contexts, reducing mismatch without over-backing off all sparse contexts.","rollback_reason":"Primary metric 2.9689385942 is slightly worse than confirmed Run 037 best 2.9689383361, so diversity-based correction does not beat support-based correction.","next_action_hint":"Keep Run 037 support-dependent escape. Avoid more small escape variants unless using a clearly different evidence signal; consider runtime consolidation/distillation of current best stack.","learned":"Diversity-dependent escape almost ties the best but remains worse. The simple low-count correction in Run 037 is currently the best escape architecture; diversity alone does not explain the residual mismatch."}}
{"type":"hook","stage":"after","exit_code":0,"duration_ms":40,"stdout_bytes":216,"timed_out":false}
{"type":"hook","stage":"before","exit_code":0,"duration_ms":32,"stdout_bytes":7969,"timed_out":false}
{"run":41,"commit":"none","metric":2.9689390343,"metrics":{"elapsed_seconds":44.561476,"timed_out":0,"evaluated_tokens":200000,"stability_std":4.440892098500626e-16,"train_val_score":2.7603046181135316},"status":"discard","description":"Run 041 entropy-dependent escape; worse than confirmed count-dependent escape best","timestamp":1777800874143,"segment":0,"confidence":12.383828456164299,"asi":{"hypothesis":"High-entropy sparse contexts may need more escape mass while deterministic sparse contexts should remain near half escape.","rollback_reason":"Primary metric 2.9689390343 is worse than confirmed Run 037 best 2.9689383361, so entropy-dependent extra escape does not improve public robustness.","next_action_hint":"Keep Run 037. Escape evidence variants have likely saturated; pivot to runtime consolidation/distillation or a distinct model instead of more nearby escape tweaks.","learned":"Entropy-dependent escape improves train-val relative to count-dependent escape but worsens public practice, another train/public transfer warning. The simple low-count correction remains best."}}
{"type":"hook","stage":"after","exit_code":0,"duration_ms":40,"stdout_bytes":216,"timed_out":false}
{"type":"hook","stage":"before","exit_code":0,"duration_ms":30,"stdout_bytes":7969,"timed_out":false}
{"run":42,"commit":"none","metric":2.9689387507,"metrics":{"elapsed_seconds":42.963924,"timed_out":0,"evaluated_tokens":200000,"stability_std":0,"train_val_score":2.763896572632304},"status":"discard","description":"Run 042 recent LZ-style match expert mixed into Run 037; slight regression","timestamp":1777801179785,"segment":0,"confidence":11.854684684359347,"asi":{"hypothesis":"A tiny gated direct-recurrence/LZ expert over train-tail plus past public symbols may capture local repeated blocks not represented by the PPM/CTW/VOMM probability stack.","rollback_reason":"Primary metric 2.9689387507 is worse than confirmed Run 037 best 2.9689383361, so the direct recent-match recurrence signal does not add enough public-practice information at this weight/window.","next_action_hint":"Do not keep this LZ tail expert. Since escape variants and simple recent recurrence both saturated, try runtime consolidation/distillation of Run 037 or a more genuinely different architecture such as context-dependent expert gating.","learned":"The LZ-style recurrence proxy is deterministic and valid but nearly duplicates existing high-order tree/PPM evidence; train-val is also slightly worse than Run 037."}}
{"type":"hook","stage":"after","exit_code":0,"duration_ms":42,"stdout_bytes":216,"timed_out":false}
{"type":"hook","stage":"before","exit_code":0,"duration_ms":33,"stdout_bytes":7969,"timed_out":false}
{"run":43,"commit":"none","metric":2.9689395951,"metrics":{"elapsed_seconds":43.180784,"timed_out":0,"evaluated_tokens":200000,"stability_std":0,"train_val_score":2.765334850303866},"status":"discard","description":"Run 043 JS agreement-gated PPM-A weight; regressed by suppressing useful disagreement","timestamp":1777801426942,"segment":0,"confidence":11.368907091552645,"asi":{"hypothesis":"Mildly reducing the PPM-A weight when its distribution strongly disagrees with the CTW/VOMM/PPM-C base might avoid overconfident mismatched rare contexts.","rollback_reason":"Primary metric 2.9689395951 is worse than confirmed Run 037 best 2.9689383361; disagreement appears to contain useful rare-context signal, so penalizing it removes value.","next_action_hint":"Avoid agreement penalties on the Run 037 PPM-A gate. Consider runtime consolidation/distillation or an architecture that changes the base stack rather than suppressing the best PPM-A expert.","learned":"PPM-A's incremental value likely occurs in contexts where it differs from the base. JS agreement gating worsens both public and train-val relative to Run 037."}}
{"type":"hook","stage":"after","exit_code":0,"duration_ms":41,"stdout_bytes":216,"timed_out":false}
{"type":"hook","stage":"before","exit_code":0,"duration_ms":32,"stdout_bytes":7969,"timed_out":false}
{"run":44,"commit":"d7f4a90","metric":2.968937713,"metrics":{"elapsed_seconds":42.887659,"timed_out":0,"evaluated_tokens":200000,"stability_std":0,"train_val_score":2.763446353371243},"status":"keep","description":"Run 044 JS disagreement-boosted PPM-A gate; new best","timestamp":1777801678561,"segment":0,"confidence":11.282301799420557,"asi":{"hypothesis":"If Run 043 regressed because PPM-A/base disagreement contains useful rare-context conditional information, a tiny JS disagreement boost should improve over Run 037.","next_action_hint":"Confirm Run 044 with an exact rerun before further changes. If confirmed, explore a modestly stronger disagreement boost or a support-conditioned boost, but avoid large overconfident gates.","learned":"The sign test succeeded: penalizing disagreement hurt, boosting disagreement improved. PPM-A contributes useful non-redundant signal when it differs from the CTW/VOMM/PPM-C base."}}
{"type":"hook","stage":"after","exit_code":0,"duration_ms":39,"stdout_bytes":216,"timed_out":false}
{"type":"hook","stage":"before","exit_code":0,"duration_ms":38,"stdout_bytes":8161,"timed_out":false}
{"run":45,"commit":"none","metric":2.968937713,"metrics":{"elapsed_seconds":48.281023,"timed_out":0,"evaluated_tokens":200000,"stability_std":0,"train_val_score":2.763446353371243},"status":"discard","description":"Run 045 confirmation rerun of Run 044 disagreement boost; exact score reproduced","timestamp":1777801890642,"segment":0,"confidence":11.1733961720198,"asi":{"hypothesis":"The Run 044 disagreement-boosted PPM-A stack should reproduce exactly if the tiny improvement is deterministic and there is no hidden state.","rollback_reason":"Confirmation matched the current best exactly, so it does not improve the primary metric and is logged as discard.","next_action_hint":"Treat Run 044 as confirmed. Next try a modestly stronger or support-conditioned disagreement boost, while watching for overconfident train/public mismatch.","learned":"Run 044 is deterministic: public score, train-val, and stability block scores reproduced exactly."}}
{"type":"hook","stage":"after","exit_code":0,"duration_ms":39,"stdout_bytes":216,"timed_out":false}
{"type":"hook","stage":"before","exit_code":0,"duration_ms":32,"stdout_bytes":8161,"timed_out":false}
{"run":46,"commit":"c39b301","metric":2.9689371234,"metrics":{"elapsed_seconds":42.497918,"timed_out":0,"evaluated_tokens":200000,"stability_std":0,"train_val_score":2.762792892287903},"status":"keep","description":"Run 046 stronger JS disagreement boost; new best","timestamp":1777802125812,"segment":0,"confidence":11.104865298014962,"asi":{"hypothesis":"If PPM-A/base disagreement is useful conditional signal, a stronger JS boost than Run 044 should improve by allocating more weight to non-redundant rare-context evidence.","next_action_hint":"Confirm Run 046 with an exact rerun before further changes. If confirmed, test whether an even stronger boost saturates or a support-conditioned boost improves robustness.","learned":"Doubling the disagreement boost from 0.08 to 0.16 improved both public score and train-val, strengthening the lesson that PPM-A disagreement carries useful incremental information."}}
{"type":"hook","stage":"after","exit_code":0,"duration_ms":42,"stdout_bytes":216,"timed_out":false}
{"type":"hook","stage":"before","exit_code":0,"duration_ms":30,"stdout_bytes":7957,"timed_out":false}
{"run":47,"commit":"none","metric":2.9689371234,"metrics":{"elapsed_seconds":46.147744,"timed_out":0,"evaluated_tokens":200000,"stability_std":0,"train_val_score":2.762792892287903},"status":"discard","description":"Run 047 confirmation rerun of Run 046 stronger disagreement boost; exact score reproduced","timestamp":1777802353512,"segment":0,"confidence":11.074522981390524,"asi":{"hypothesis":"The Run 046 stronger disagreement-boosted PPM-A stack should reproduce exactly if the improvement is deterministic and there is no hidden state.","rollback_reason":"Confirmation matched the current best exactly, so it does not improve the primary metric and is logged as discard.","next_action_hint":"Treat Run 046 as confirmed. Next test whether an even stronger disagreement boost saturates, or a support-conditioned boost improves robustness without overfitting.","learned":"Run 046 is deterministic: public score, train-val, and stability block scores reproduced exactly."}}
{"type":"hook","stage":"after","exit_code":0,"duration_ms":40,"stdout_bytes":216,"timed_out":false}
{"type":"hook","stage":"before","exit_code":0,"duration_ms":32,"stdout_bytes":7957,"timed_out":false}
{"run":48,"commit":"90c4cd0","metric":2.968936567,"metrics":{"elapsed_seconds":42.989359,"timed_out":0,"evaluated_tokens":200000,"stability_std":0,"train_val_score":2.762141155355361},"status":"keep","description":"Run 048 extra-strong JS disagreement boost; new best","timestamp":1777802595716,"segment":0,"confidence":11.090589922420602,"asi":{"hypothesis":"If JS disagreement continues to proxy useful conditional PPM-A information, increasing the boost from 0.16 to 0.24 should improve over Run 046 without changing experts or evaluator semantics.","next_action_hint":"Confirm Run 048 with an exact rerun before further changes. If confirmed, cautiously test saturation with 0.32/cap1.36 or support-conditioned disagreement boost; watch for train/public overconfidence.","learned":"The monotone disagreement-boost trend continued: 0.24 improved public score and train-val over 0.16, supporting the conditional-information interpretation of PPM-A/base disagreement."}}
{"type":"hook","stage":"after","exit_code":0,"duration_ms":41,"stdout_bytes":216,"timed_out":false}
{"type":"hook","stage":"before","exit_code":0,"duration_ms":32,"stdout_bytes":8151,"timed_out":false}
{"run":49,"commit":"none","metric":2.968936567,"metrics":{"elapsed_seconds":45.780567,"timed_out":0,"evaluated_tokens":200000,"stability_std":0,"train_val_score":2.762141155355361},"status":"discard","description":"Run 049 confirmation rerun of Run 048 extra-strong disagreement boost; exact score reproduced","timestamp":1777802823924,"segment":0,"confidence":11.085487795705792,"asi":{"hypothesis":"The Run 048 extra-strong disagreement-boosted PPM-A stack should reproduce exactly if the new best is deterministic and there is no hidden state.","rollback_reason":"Confirmation matched the current best exactly, so it does not improve the primary metric and is logged as discard.","next_action_hint":"Treat Run 048 as confirmed. Next cautiously test saturation with boost 0.32/cap1.36 or a support-conditioned disagreement boost, watching for overconfidence.","learned":"Run 048 is deterministic: public score, train-val, and stability block scores reproduced exactly."}}
{"type":"hook","stage":"after","exit_code":0,"duration_ms":40,"stdout_bytes":216,"timed_out":false}
{"type":"hook","stage":"before","exit_code":0,"duration_ms":33,"stdout_bytes":8151,"timed_out":false}
{"run":50,"commit":"3740f7f","metric":2.9689360437,"metrics":{"elapsed_seconds":45.461671,"timed_out":0,"evaluated_tokens":200000,"stability_std":4.440892098500626e-16,"train_val_score":2.76149112225074},"status":"keep","description":"Run 050 saturation JS disagreement boost 0.32; new best","timestamp":1777803056284,"segment":0,"confidence":15.621785392564055,"asi":{"hypothesis":"If PPM-A/base JS disagreement remains a useful proxy for conditional information beyond the base stack, increasing the boost from 0.24 to 0.32 should further reduce log-loss.","next_action_hint":"Confirm Run 050 with an exact rerun before further changes. If confirmed, test a final cautious saturation step (0.40/cap1.44) or switch to support-conditioned boost if overconfidence appears.","learned":"The monotone disagreement-boost trend continued through 0.32 and train-val also improved, so the safe saturation point has not yet been reached."}}
{"type":"hook","stage":"after","exit_code":0,"duration_ms":40,"stdout_bytes":216,"timed_out":false}
{"type":"hook","stage":"before","exit_code":0,"duration_ms":35,"stdout_bytes":8112,"timed_out":false}
{"run":51,"commit":"none","metric":2.9689360437,"metrics":{"elapsed_seconds":41.907297,"timed_out":0,"evaluated_tokens":200000,"stability_std":4.440892098500626e-16,"train_val_score":2.76149112225074},"status":"discard","description":"Run 051 confirmation rerun of Run 050 saturation disagreement boost; exact score reproduced","timestamp":1777803267598,"segment":0,"confidence":22.52037748028357,"asi":{"hypothesis":"The Run 050 saturation disagreement-boosted PPM-A stack should reproduce exactly if the new best is deterministic and has no hidden state.","rollback_reason":"Confirmation matched the current best exactly, so it does not improve the primary metric and is logged as discard.","next_action_hint":"Treat Run 050 as confirmed. Next test one final cautious saturation step (0.40/cap1.44) or a support-conditioned disagreement boost; stop increasing if train/public diverge.","learned":"Run 050 is deterministic: public score, train-val, and stability block scores reproduced exactly."}}
{"type":"hook","stage":"after","exit_code":0,"duration_ms":39,"stdout_bytes":216,"timed_out":false}
{"type":"hook","stage":"before","exit_code":0,"duration_ms":30,"stdout_bytes":8112,"timed_out":false}
