{"type":"config","name":"ITML Activity A Phase 2 — Variable-order & Tree Models","metricName":"bits_per_symbol","metricUnit":"","bestDirection":"lower"}
{"run":0,"commit":"919c59e","metric":2.9692281375,"metrics":{"elapsed_seconds":9.722408,"timed_out":0,"evaluated_tokens":200000},"status":"keep","description":"Phase 1 champion — n=5 interpolated per-order mixture + n=3 online auxiliary (Run 117)","timestamp":1777758059000,"segment":0,"confidence":95.0,"asi":{"hypothesis":"Phase 1 concluded after 121 runs. Best n-gram family model archived. Phase 2 now explores structurally different model families.","source":"Phase 1 autoresearch archive","changed_files":[],"learned":"Hard-backoff n-grams plateaued. Soft interpolation, per-order smoothing, and small online auxiliary gave ~0.98% improvement. Further n-gram micro-tuning hit noise floor.","next_focus":"Variable-order Markov models, Context Tree Weighting, and PPM-style escape mechanisms.","phase":2}}
{"type":"hook","stage":"before","exit_code":0,"duration_ms":19,"stdout_bytes":463,"timed_out":false}
{"run":2,"commit":"none","metric":3.391531526,"metrics":{"elapsed_seconds":6.323486,"timed_out":0,"evaluated_tokens":200000,"stability_std":0,"train_val_score":1.968982738416794},"status":"discard","description":"Run 001 PPM-C order5 no-exclusion blending; valid but far worse than Phase 1 baseline on public practice","timestamp":1777760484937,"segment":0,"confidence":null,"asi":{"hypothesis":"Explicit PPM-C escapes would exploit variable-length contexts better than fixed n-gram interpolation.","rollback_reason":"Primary metric 3.391531526 is much worse than Phase 2 baseline 2.9692281375 despite valid deterministic behavior.","next_action_hint":"Try classic PPM-C with symbol exclusions and normalized unseen-symbol backoff, or hybridize PPM only after checking whether no-exclusion blending underfits public practice.","learned":"No-exclusion PPM-C blending is very strong on train-derived validation (~1.969) but generalizes poorly to public practice (~3.392), suggesting train/test mismatch or overconfident memorization of train contexts. The architecture is deterministic and runtime-safe."}}
{"type":"hook","stage":"after","exit_code":0,"duration_ms":40,"stdout_bytes":216,"timed_out":false}
{"type":"hook","stage":"before","exit_code":0,"duration_ms":16,"stdout_bytes":463,"timed_out":false}
{"run":3,"commit":"none","metric":3.2402309011,"metrics":{"elapsed_seconds":4.291544,"timed_out":0,"evaluated_tokens":200000,"stability_std":0,"train_val_score":2.258055843828943},"status":"discard","description":"Run 003 PPM-C order5 with symbol exclusions; improved over no-exclusion PPM but still far worse than Phase 1","timestamp":1777760600893,"segment":0,"confidence":null,"asi":{"hypothesis":"Classic PPM-C exclusions would reduce double-counting across context depths and improve public-practice performance over no-exclusion PPM.","rollback_reason":"Primary metric 3.2402309011 remains much worse than Phase 2 baseline 2.9692281375, though it improves over no-exclusion PPM's 3.3915.","next_action_hint":"Pure train-preloaded PPM remains mismatched to public practice; try a hedged hybrid with Phase 1 best or switch architecture to min-count VOMM/CTW rather than deeper PPM alone.","learned":"Exclusions helped public score by ~0.151 bits and reduced train/public gap, but still underperform. PPM recursion is deterministic and fast; remaining issue is model mismatch/overconfidence, not implementation validity."}}
{"type":"hook","stage":"after","exit_code":0,"duration_ms":39,"stdout_bytes":216,"timed_out":false}
{"type":"hook","stage":"before","exit_code":0,"duration_ms":16,"stdout_bytes":463,"timed_out":false}
{"run":4,"commit":"bee410a","metric":2.9690188235,"metrics":{"elapsed_seconds":15.641282,"timed_out":0,"evaluated_tokens":200000,"stability_std":4.440892098500626e-16,"train_val_score":2.7881003297338176},"status":"keep","description":"Run 004 confidence-gated PPM-C exclusion mixed into Phase 1 champion; small valid improvement","timestamp":1777760777948,"segment":0,"confidence":0.0015435448292154279,"asi":{"hypothesis":"A small confidence-gated PPM-C exclusion component can add complementary recurrence evidence while Phase 1 limits model-mismatch redundancy.","learned":"Hybrid PPM improved public-practice score by ~0.000209 bits/symbol over Phase 1 baseline. Pure PPM was badly mismatched, but a low-weight entropy/support gate extracts a tiny useful signal. Stability std is numerical zero; train-val is reasonable and not a public-only overfit red flag.","next_action_hint":"Explore structurally similar but not n-gram-sweep variants: calibrate PPM gate architecture via train-derived validation or test CTW/Min-count VOMM hybrids. Because gain is small, rerun or try a second independent tree-family hybrid before trusting."}}
{"type":"hook","stage":"after","exit_code":0,"duration_ms":39,"stdout_bytes":216,"timed_out":false}
{"type":"hook","stage":"before","exit_code":0,"duration_ms":19,"stdout_bytes":3813,"timed_out":false}
{"run":5,"commit":"none","metric":2.9691940927,"metrics":{"elapsed_seconds":13.326484,"timed_out":0,"evaluated_tokens":200000,"stability_std":0,"train_val_score":2.8437759842689756},"status":"discard","description":"Run 005 min-count VOMM + Phase 1 hybrid; beats original Phase 1 but not current Run 004 best","timestamp":1777760940203,"segment":0,"confidence":1,"asi":{"hypothesis":"A confidence-gated hard variable-depth VOMM can add complementary long-context signal to the Phase 1 champion.","rollback_reason":"Primary metric 2.9691940927 is worse than current best Run 004 at 2.9690188235, despite beating original Phase 1 baseline by ~0.000034 bits/symbol.","next_action_hint":"VOMM hard-depth signal is less useful than PPM-gated signal. Next try a CTW-style tree mixture hybrid, or combine only if it independently improves over Run 004 on rerun/validation.","learned":"Min-count VOMM is deterministic and valid, with reasonable train_val_score=2.8438, but its tiny gain over Phase 1 is smaller than the PPM hybrid. Hard deepest-context selection appears less complementary than escape/exclusion tree probabilities under this gate."}}
{"type":"hook","stage":"after","exit_code":0,"duration_ms":40,"stdout_bytes":216,"timed_out":false}
{"type":"hook","stage":"before","exit_code":0,"duration_ms":16,"stdout_bytes":3813,"timed_out":false}
{"run":6,"commit":"11e6828","metric":2.9690075292,"metrics":{"elapsed_seconds":23.050638,"timed_out":0,"evaluated_tokens":200000,"stability_std":0,"train_val_score":2.7878937228168152},"status":"keep","description":"Run 006 approximate CTW tree mixture gated into Run 004 hybrid; tiny new best","timestamp":1777761126442,"segment":0,"confidence":1.1145281052831308,"asi":{"hypothesis":"A KT-based recursive context-tree mixture can add a small depth-uncertainty hedge beyond the PPM+Phase1 hybrid.","learned":"Approximate CTW hybrid improved Run 004 by ~0.000011 bits/symbol and original Phase 1 by ~0.000221. The gain is extremely tiny but deterministic; train-val is comparable to Run 004. CTW seems complementary only at very low gated weight and increases runtime substantially.","next_action_hint":"Because improvement is within noise and runtime rose to ~23s, confirm with a rerun or try a cheaper CTW gate/depth variant only if it is architectural, not a smoothing sweep."}}
{"type":"hook","stage":"after","exit_code":0,"duration_ms":40,"stdout_bytes":216,"timed_out":false}
{"type":"hook","stage":"before","exit_code":0,"duration_ms":21,"stdout_bytes":6912,"timed_out":false}
{"run":7,"commit":"none","metric":2.9690734103,"metrics":{"elapsed_seconds":27.112581,"timed_out":0,"evaluated_tokens":200000,"stability_std":0,"train_val_score":2.7627108875455577},"status":"discard","description":"Run 007 PPM-D escape component gated into current CTW/PPM/Phase1 best; worsened public score","timestamp":1777761338252,"segment":0,"confidence":1.2586826436115475,"asi":{"hypothesis":"A less-escaping PPM-D component could add sharper high-order recurrence evidence beyond the PPM-C/CTW hybrid.","rollback_reason":"Primary metric 2.9690734103 is worse than current best Run 006 at 2.9690075292 and adds runtime.","next_action_hint":"PPM-D improves train-val but hurts public practice, consistent with overconfidence. Avoid stacking more PPM escape variants; prefer confirming Run 006 or exploring cheaper CTW/tree mixture variants with train-val sanity.","learned":"PPM-D gated into the current best lowered train_val_score to 2.7627 but worsened public score and runtime (~27s). Stronger high-order trust appears to overfit train-like recurrence rather than improve public-practice generalization."}}
{"type":"hook","stage":"after","exit_code":0,"duration_ms":41,"stdout_bytes":216,"timed_out":false}
{"type":"hook","stage":"before","exit_code":0,"duration_ms":21,"stdout_bytes":6912,"timed_out":false}
{"run":8,"commit":"none","metric":2.9690075292,"metrics":{"elapsed_seconds":23.234745,"timed_out":0,"evaluated_tokens":200000,"stability_std":0,"train_val_score":2.7878937228168152},"status":"discard","description":"Run 008 confirmation rerun of Run 006 CTW hybrid; exact score reproduced, no new improvement","timestamp":1777761492276,"segment":0,"confidence":1.8296332204394112,"asi":{"hypothesis":"The current best Run 006 CTW hybrid is deterministic and should reproduce exactly on the fixed 200k public-practice prefix.","rollback_reason":"Confirmation run was unchanged relative to current best, so it does not improve the primary metric even though it confirms the score.","next_action_hint":"Treat Run 006 as reproducible but marginal. Future work should seek a larger architectural gain or reduce CTW runtime while preserving the exact distribution family.","learned":"Run 008 exactly reproduced Run 006 score 2.9690075292 and train_val_score 2.7878937228168152 with stability_std=0.0. The improvement is tiny but not nondeterministic."}}
{"type":"hook","stage":"after","exit_code":0,"duration_ms":42,"stdout_bytes":216,"timed_out":false}
{"type":"hook","stage":"before","exit_code":0,"duration_ms":22,"stdout_bytes":6912,"timed_out":false}
{"run":9,"commit":"none","metric":2.9690364734,"metrics":{"elapsed_seconds":26.142942,"timed_out":0,"evaluated_tokens":200000,"stability_std":0,"train_val_score":2.7882676730268194},"status":"discard","description":"Run 009 depth-4 approximate CTW hybrid; valid but worse than depth-5 CTW best","timestamp":1777761682537,"segment":0,"confidence":3.348582522155484,"asi":{"hypothesis":"A shallower depth-4 CTW tree mixture might preserve the CTW gain with better-supported contexts and less mismatch than depth 5.","rollback_reason":"Primary metric 2.9690364734 is worse than current best Run 006 at 2.9690075292 and did not reduce runtime in this implementation.","next_action_hint":"Depth 5 appears to carry the small useful CTW signal. Avoid further shallow-depth CTW variants unless optimizing implementation cost separately; seek larger architectural changes or runtime simplification of the kept depth-5 model.","learned":"Depth-4 CTW remains deterministic and beats original Phase 1, but loses ~0.000029 bits/symbol relative to depth-5 CTW and train_val worsens slightly. Shorter contexts were not a better hedge here."}}
{"type":"hook","stage":"after","exit_code":0,"duration_ms":40,"stdout_bytes":216,"timed_out":false}
{"type":"hook","stage":"before","exit_code":0,"duration_ms":24,"stdout_bytes":6912,"timed_out":false}
{"run":10,"commit":"aac396b","metric":2.9689899984,"metrics":{"elapsed_seconds":22.359613,"timed_out":0,"evaluated_tokens":200000,"stability_std":4.440892098500626e-16,"train_val_score":2.7879082060879936},"status":"keep","description":"Run 010 count-dependent CTW tree mixture gated into Run 004 hybrid; new best","timestamp":1777761873544,"segment":0,"confidence":4.239006159884525,"asi":{"hypothesis":"Count-dependent CTW can better calibrate sparse versus well-supported contexts than fixed 0.5 CTW while preserving the useful depth-5 tree signal.","learned":"Count-dependent CTW improved Run 006 by ~0.0000175 bits/symbol and original Phase 1 by ~0.000238. It is deterministic (numerical-zero stability_std) and slightly faster than fixed CTW, with essentially unchanged train-val. Support-adaptive tree mixing appears marginally better than canonical 0.5 in this hybrid setting.","next_action_hint":"Confirm this new best with a rerun before stacking further complexity. If stable, consider implementation/runtime cleanup of CTW component rather than more PPM variants."}}
{"type":"hook","stage":"after","exit_code":0,"duration_ms":41,"stdout_bytes":216,"timed_out":false}
{"type":"hook","stage":"before","exit_code":0,"duration_ms":25,"stdout_bytes":7966,"timed_out":false}
{"type":"hook","stage":"before","exit_code":0,"duration_ms":33,"stdout_bytes":7966,"timed_out":false}
{"run":11,"commit":"none","metric":2.9689899984,"metrics":{"elapsed_seconds":22.027215,"timed_out":0,"evaluated_tokens":200000,"stability_std":4.440892098500626e-16,"train_val_score":2.7879082060879936},"status":"discard","description":"Run 011 confirmation rerun of Run 010 count-dependent CTW; exact score reproduced, no new improvement","timestamp":1777793434337,"segment":0,"confidence":5.124025820332935,"asi":{"hypothesis":"The current best Run 010 count-dependent CTW hybrid is deterministic and should reproduce exactly on the fixed public-practice prefix.","rollback_reason":"Confirmation run was unchanged relative to current best, so it does not improve the primary metric even though it confirms the score.","next_action_hint":"Treat Run 010 as reproducible. Next iteration should update EXPERIMENTS.md, then either seek a larger architecture change or reduce runtime of the count-dependent CTW without changing evaluator semantics.","learned":"Run 011 exactly reproduced Run 010 score 2.9689899984 and train_val_score 2.7879082060879936 with numerical-zero stability_std. The count-dependent CTW improvement is deterministic, not hidden nondeterminism."}}
{"type":"hook","stage":"after","exit_code":0,"duration_ms":39,"stdout_bytes":216,"timed_out":false}
{"type":"hook","stage":"before","exit_code":0,"duration_ms":25,"stdout_bytes":7966,"timed_out":false}
{"run":12,"commit":"none","metric":2.9689920071,"metrics":{"elapsed_seconds":22.845348,"timed_out":0,"evaluated_tokens":200000,"stability_std":0,"train_val_score":2.7879127791442575},"status":"discard","description":"Run 012 depth-6 count-dependent CTW hybrid; valid but slightly worse than depth-5 current best","timestamp":1777793657874,"segment":0,"confidence":6.325067297403277,"asi":{"hypothesis":"Adding a sixth CTW context level could capture longer dependencies while count-dependent mixing suppresses sparse contexts.","rollback_reason":"Primary metric 2.9689920071 is slightly worse than current best Run 010/011 at 2.9689899984 and runtime increased a little.","next_action_hint":"Depth 5 remains the sweet spot for count-dependent CTW. Avoid further depth-only CTW changes; consider runtime cleanup or a genuinely different tree/update architecture such as online-only recent CTW.","learned":"Depth-6 count-dependent CTW is deterministic and still beats Phase 1, but loses ~0.000002 bits/symbol vs depth 5 with nearly identical train-val. The additional depth does not add useful public-practice signal under this gate."}}
{"type":"hook","stage":"after","exit_code":0,"duration_ms":42,"stdout_bytes":216,"timed_out":false}
{"type":"hook","stage":"before","exit_code":0,"duration_ms":33,"stdout_bytes":7966,"timed_out":false}
{"run":13,"commit":"none","metric":2.968994839,"metrics":{"elapsed_seconds":29.339349,"timed_out":0,"evaluated_tokens":200000,"stability_std":0,"train_val_score":2.7880779676041803},"status":"discard","description":"Run 013 online recent-window CTW added to current best; deterministic but worsened score and runtime","timestamp":1777793882000,"segment":0,"confidence":8.261518607103046,"asi":{"hypothesis":"A strictly online recent-window CTW could capture local nonstationarity beyond the train-preloaded count-dependent CTW best.","rollback_reason":"Primary metric 2.968994839 is worse than current best 2.9689899984 and runtime increased to ~29s.","next_action_hint":"Recent CTW likely duplicates or conflicts with the existing Phase 1 recent auxiliary. Avoid adding heavier online recent tree components; consider simplifying/runtime-optimizing the kept count-dependent CTW or a different architecture such as probabilistic-depth VOMM.","learned":"Online recent-window CTW is deterministic and valid but slightly worsens both public score and train-val. The current best already captures enough online adaptation; extra recent tree signal adds noise/overhead rather than useful nonstationary evidence."}}
{"type":"hook","stage":"after","exit_code":0,"duration_ms":43,"stdout_bytes":216,"timed_out":false}
{"type":"hook","stage":"before","exit_code":0,"duration_ms":26,"stdout_bytes":7966,"timed_out":false}
{"run":14,"commit":"ec12f96","metric":2.9689815773,"metrics":{"elapsed_seconds":34.542061,"timed_out":0,"evaluated_tokens":200000,"stability_std":0,"train_val_score":2.7878915805320914},"status":"keep","description":"Run 014 probabilistic-depth VOMM gated into count-dependent CTW best; new best but slower","timestamp":1777794128954,"segment":0,"confidence":10.610444324904309,"asi":{"hypothesis":"A probabilistic-depth VOMM can avoid hard depth-selection brittleness and add complementary depth-uncertainty evidence beyond CTW.","learned":"Probabilistic-depth VOMM improved the confirmed Run 010 best by ~0.0000084 bits/symbol and original Phase 1 by ~0.0002466. It is deterministic and train-val is slightly better than Run 010, but runtime rose substantially to ~34.5s. VOMM can be complementary when mixed probabilistically rather than hard-selected.","next_action_hint":"Confirm with a rerun before stacking further components. If confirmed, consider optimizing the VOMM/CTW implementation or reducing redundant tree traversals to recover runtime."}}
{"type":"hook","stage":"after","exit_code":0,"duration_ms":40,"stdout_bytes":216,"timed_out":false}
{"type":"hook","stage":"before","exit_code":0,"duration_ms":30,"stdout_bytes":7966,"timed_out":false}
{"run":15,"commit":"none","metric":2.9689815773,"metrics":{"elapsed_seconds":34.638949,"timed_out":0,"evaluated_tokens":200000,"stability_std":0,"train_val_score":2.7878915805320914},"status":"discard","description":"Run 015 confirmation rerun of Run 014 probabilistic-depth VOMM; exact score reproduced, no new improvement","timestamp":1777794329645,"segment":0,"confidence":9.500660837895355,"asi":{"hypothesis":"The current best Run 014 probabilistic-depth VOMM hybrid is deterministic and should reproduce exactly on the fixed public-practice prefix.","rollback_reason":"Confirmation run was unchanged relative to current best, so it does not improve the primary metric even though it confirms the score.","next_action_hint":"Treat Run 014 as reproducible. Next work should either reduce runtime by consolidating tree traversals or test a different architecture; avoid stacking additional heavy tree components without a strong reason.","learned":"Run 015 exactly reproduced Run 014 score 2.9689815773 and train_val_score 2.7878915805320914 with stability_std=0.0. The probabilistic-depth VOMM improvement is deterministic."}}
{"type":"hook","stage":"after","exit_code":0,"duration_ms":40,"stdout_bytes":216,"timed_out":false}
{"type":"hook","stage":"before","exit_code":0,"duration_ms":29,"stdout_bytes":7966,"timed_out":false}
{"run":16,"commit":"b51c300","metric":2.9689753717,"metrics":{"elapsed_seconds":42.773843,"timed_out":0,"evaluated_tokens":200000,"stability_std":0,"train_val_score":2.778627117156063},"status":"keep","description":"Run 016 PPM-A escape component gated into probabilistic-depth VOMM best; new best but very slow","timestamp":1777794609146,"segment":0,"confidence":9.739780131668178,"asi":{"hypothesis":"A conservative PPM-A escape law can add complementary zero-frequency handling beyond the CTW/VOMM stack when gated lightly.","learned":"PPM-A improved the confirmed Run 014 best by ~0.0000062 bits/symbol and original Phase 1 by ~0.0002528. It is deterministic and train-val improved substantially, but runtime rose to ~42.8s. Unlike PPM-D, PPM-A's single escape count appears complementary when strongly gated.","next_action_hint":"Confirm Run 016 before further stacking. If confirmed, prioritize runtime consolidation because the model now layers Phase1, PPM-C, CTW, VOMM, and PPM-A tree traversals."}}
{"type":"hook","stage":"after","exit_code":0,"duration_ms":41,"stdout_bytes":216,"timed_out":false}
{"type":"hook","stage":"before","exit_code":0,"duration_ms":29,"stdout_bytes":7966,"timed_out":false}
{"run":17,"commit":"none","metric":2.9689753717,"metrics":{"elapsed_seconds":40.236143,"timed_out":0,"evaluated_tokens":200000,"stability_std":0,"train_val_score":2.778627117156063},"status":"discard","description":"Run 017 confirmation rerun of Run 016 PPM-A hybrid; exact score reproduced, no new improvement","timestamp":1777794835871,"segment":0,"confidence":9.739780131668178,"asi":{"hypothesis":"The current best Run 016 PPM-A hybrid is deterministic and should reproduce exactly on the fixed public-practice prefix.","rollback_reason":"Confirmation run was unchanged relative to current best, so it does not improve the primary metric even though it confirms the score.","next_action_hint":"Treat Run 016 as reproducible. Next work should prioritize runtime consolidation or a different architecture; avoid blindly stacking more tree components as runtime is now ~40s.","learned":"Run 017 exactly reproduced Run 016 score 2.9689753717 and train_val_score 2.778627117156063 with stability_std=0.0. The PPM-A improvement is deterministic."}}
{"type":"hook","stage":"after","exit_code":0,"duration_ms":44,"stdout_bytes":216,"timed_out":false}
